17:14:34.074151 IP 165.22.229.18.22 > 50.101.85.188.58534: Flags [P.], seq 2063460:2063704, ack 1189, win 501, length 244
17:14:34.074230 IP 165.22.229.18.22 > 50.101.85.188.58534: Flags [P.], seq 2063704:2064032, ack 1189, win 501, length 328
17:14:34.074352 IP 165.22.229.18.22 > 50.101.85.188.58534: Flags [P.], seq 2064032:2064196, ack 1189, win 501, length 164
17:14:34.074447 IP 165.22.229.18.22 > 50.101.85.188.58534: Flags [P.], seq 2064196:2064360, ack 1189, win 501, length 164
17:14:34.074574 IP 165.22.229.18.22 > 50.101.85.188.58534: Flags [P.], seq 2064360:2064524, ack 1189, win 501, length 164
17:14:34.074677 IP 165.22.229.18.22 > 50.101.85.188.58534: Flags [P.], seq 2064524:2064688, ack 1189, win 501, length 164
17:14:34.074797 IP 165.22.229.18.22 > 50.101.85.188.58534: Flags [P.], seq 2064688:2064852, ack 1189, win 501, length 164
17:14:34.074926 IP 50.101.85.188.58534 > 165.22.229.18.22: Flags [.], ack 2059280, win 510, length 0
17:14:34.074927 IP 50.101.85.188.58534 > 165.22.229.18.22: Flags [.], ack 2059772, win 516, length 0
17:14:34.074927 IP 50.101.85.188.58534 > 165.22.229.18.22: Flags [.], ack 2060428, win 513, length 0
17:14:34.074927 IP 50.101.85.188.58534 > 165.22.229.18.22: Flags [.], ack 2060756, win 512, length 0
17:14:34.075065 IP 165.22.229.18.22 > 50.101.85.188.58534: Flags [P.], seq 2064852:2065016, ack 1189, win 501, length 164
17:14:34.075164 IP 165.22.229.18.22 > 50.101.85.188.58534: Flags [P.], seq 2065016:2065460, ack 1189, win 501, length 444
17:14:34.075303 IP 165.22.229.18.22 > 50.101.85.188.58534: Flags [P.], seq 2065460:2065624, ack 1189, win 501, length 164
17:14:34.075437 IP 165.22.229.18.22 > 50.101.85.188.58534: Flags [P.], seq 2065624:2065788, ack 1189, win 501, length 164
17:14:34.075572 IP 165.22.229.18.22 > 50.101.85.188.58534: Flags [P.], seq 2065788:2065952, ack 1189, win 501, length 164
17:14:34.075713 IP 165.22.229.18.22 > 50.101.85.188.58534: Flags [P.], seq 2065952:2066116, ack 1189, win 501, length 164
17:14:34.075830 IP 165.22.229.18.22 > 50.101.85.188.58534: Flags [P.], seq 2066116:2066280, ack 1189, win 501, length 164
17:14:34.075967 IP 50.101.85.188.58534 > 165.22.229.18.22: Flags [.], ack 2061740, win 516, length 0
17:14:34.075967 IP 50.101.85.188.58534 > 165.22.229.18.22: Flags [.], ack 2063132, win 510, length 0
17:14:34.075999 IP 165.22.229.18.22 > 50.101.85.188.58534: Flags [P.], seq 2066280:2066444, ack 1189, win 501, length 164
17:14:34.076181 IP 165.22.229.18.22 > 50.101.85.188.58534: Flags [P.], seq 2066444:2066608, ack 1189, win 501, length 164
17:14:34.076279 IP 165.22.229.18.22 > 50.101.85.188.58534: Flags [P.], seq 2066608:2066972, ack 1189, win 501, length 364
17:14:34.076357 IP 165.22.229.18.22 > 50.101.85.188.58534: Flags [P.], seq 2066972:2067136, ack 1189, win 501, length 164
17:14:34.076433 IP 165.22.229.18.22 > 50.101.85.188.58534: Flags [P.], seq 2067136:2067300, ack 1189, win 501, length 164
17:14:34.076509 IP 165.22.229.18.22 > 50.101.85.188.58534: Flags [P.], seq 2067300:2067464, ack 1189, win 501, length 164
17:14:34.076585 IP 165.22.229.18.22 > 50.101.85.188.58534: Flags [P.], seq 2067464:2067628, ack 1189, win 501, length 164
17:14:34.076728 IP 165.22.229.18.22 > 50.101.85.188.58534: Flags [P.], seq 2067628:2067792, ack 1189, win 501, length 164
17:14:34.076866 IP 165.22.229.18.22 > 50.101.85.188.58534: Flags [P.], seq 2067792:2067956, ack 1189, win 501, length 164
17:14:34.076905 IP 50.101.85.188.58534 > 165.22.229.18.22: Flags [.], ack 2063460, win 516, length 0
17:14:34.077043 IP 165.22.229.18.22 > 50.101.85.188.58534: Flags [P.], seq 2067956:2068120, ack 1189, win 501, length 164
17:14:34.077133 IP 165.22.229.18.22 > 50.101.85.188.58534: Flags [P.], seq 2068120:2068380, ack 1189, win 501, length 260
17:14:34.077211 IP 165.22.229.18.22 > 50.101.85.188.58534: Flags [P.], seq 2068380:2068544, ack 1189, win 501, length 164
17:14:34.077307 IP 165.22.229.18.22 > 50.101.85.188.58534: Flags [P.], seq 2068544:2068708, ack 1189, win 501, length 164
17:14:34.077391 IP 165.22.229.18.22 > 50.101.85.188.58534: Flags [P.], seq 2068708:2068872, ack 1189, win 501, length 164
17:14:34.077467 IP 165.22.229.18.22 > 50.101.85.188.58534: Flags [P.], seq 2068872:2069200, ack 1189, win 501, length 328
17:14:34.077603 IP 165.22.229.18.22 > 50.101.85.188.58534: Flags [P.], seq 2069200:2069364, ack 1189, win 501, length 164
17:14:34.077705 IP 165.22.229.18.22 > 50.101.85.188.58534: Flags [P.], seq 2069364:2069528, ack 1189, win 501, length 164
17:14:34.077863 IP 165.22.229.18.22 > 50.101.85.188.58534: Flags [P.], seq 2069528:2069692, ack 1189, win 501, length 164
17:14:34.077940 IP 50.101.85.188.58534 > 165.22.229.18.22: Flags [.], ack 2064852, win 510, length 0
17:14:34.077941 IP 50.101.85.188.58534 > 165.22.229.18.22: Flags [.], ack 2065460, win 516, length 0
17:14:34.078036 IP 165.22.229.18.22 > 50.101.85.188.58534: Flags [P.], seq 2069692:2070056, ack 1189, win 501, length 364
17:14:34.078169 IP 165.22.229.18.22 > 50.101.85.188.58534: Flags [P.], seq 2070056:2070220, ack 1189, win 501, length 164
17:14:34.078264 IP 165.22.229.18.22 > 50.101.85.188.58534: Flags [P.], seq 2070220:2070384, ack 1189, win 501, length 164
17:14:34.078349 IP 165.22.229.18.22 > 50.101.85.188.58534: Flags [P.], seq 2070384:2070548, ack 1189, win 501, length 164
17:14:34.078432 IP 165.22.229.18.22 > 50.101.85.188.58534: Flags [P.], seq 2070548:2070712, ack 1189, win 501, length 164
17:14:34.078539 IP 165.22.229.18.22 > 50.101.85.188.58534: Flags [P.], seq 2070712:2070876, ack 1189, win 501, length 164
17:14:34.078663 IP 165.22.229.18.22 > 50.101.85.188.58534: Flags [P.], seq 2070876:2071040, ack 1189, win 501, length 164
17:14:34.078773 IP 165.22.229.18.22 > 50.101.85.188.58534: Flags [P.], seq 2071040:2071204, ack 1189, win 501, length 164
17:14:34.078867 IP 165.22.229.18.22 > 50.101.85.188.58534: Flags [P.], seq 2071204:2071368, ack 1189, win 501, length 164
17:14:34.078968 IP 165.22.229.18.22 > 50.101.85.188.58534: Flags [P.], seq 2071368:2071532, ack 1189, win 501, length 164
17:14:34.079011 IP 50.101.85.188.58534 > 165.22.229.18.22: Flags [P.], seq 1189:1225, ack 2065460, win 516, length 36
17:14:34.079124 IP 165.22.229.18.22 > 50.101.85.188.58534: Flags [P.], seq 2071532:2071808, ack 1225, win 501, length 276
17:14:34.079229 IP 165.22.229.18.22 > 50.101.85.188.58534: Flags [P.], seq 2071808:2071972, ack 1225, win 501, length 164
17:14:34.079329 IP 165.22.229.18.22 > 50.101.85.188.58534: Flags [P.], seq 2071972:2072136, ack 1225, win 501, length 164
17:14:34.079433 IP 165.22.229.18.22 > 50.101.85.188.58534: Flags [P.], seq 2072136:2072300, ack 1225, win 501, length 164
17:14:34.079531 IP 165.22.229.18.22 > 50.101.85.188.58534: Flags [P.], seq 2072300:2072464, ack 1225, win 501, length 164
17:14:34.079625 IP 165.22.229.18.22 > 50.101.85.188.58534: Flags [P.], seq 2072464:2072628, ack 1225, win 501, length 164
17:14:34.079725 IP 165.22.229.18.22 > 50.101.85.188.58534: Flags [P.], seq 2072628:2072792, ack 1225, win 501, length 164
17:14:34.079829 IP 165.22.229.18.22 > 50.101.85.188.58534: Flags [P.], seq 2072792:2072956, ack 1225, win 501, length 164
17:14:34.079936 IP 165.22.229.18.22 > 50.101.85.188.58534: Flags [P.], seq 2072956:2073120, ack 1225, win 501, length 164
17:14:34.079962 IP 50.101.85.188.58534 > 165.22.229.18.22: Flags [.], ack 2066116, win 513, length 0
17:14:34.079962 IP 50.101.85.188.58534 > 165.22.229.18.22: Flags [.], ack 2067956, win 516, length 0
17:14:34.080083 IP 165.22.229.18.22 > 50.101.85.188.58534: Flags [P.], seq 2073120:2073484, ack 1225, win 501, length 364
17:14:34.080172 IP 165.22.229.18.22 > 50.101.85.188.58534: Flags [P.], seq 2073484:2073648, ack 1225, win 501, length 164
17:14:34.080256 IP 165.22.229.18.22 > 50.101.85.188.58534: Flags [P.], seq 2073648:2073812, ack 1225, win 501, length 164
17:14:34.080353 IP 165.22.229.18.22 > 50.101.85.188.58534: Flags [P.], seq 2073812:2073976, ack 1225, win 501, length 164
17:14:34.080454 IP 165.22.229.18.22 > 50.101.85.188.58534: Flags [P.], seq 2073976:2074140, ack 1225, win 501, length 164
17:14:34.080552 IP 165.22.229.18.22 > 50.101.85.188.58534: Flags [P.], seq 2074140:2074304, ack 1225, win 501, length 164
17:14:34.080648 IP 165.22.229.18.22 > 50.101.85.188.58534: Flags [P.], seq 2074304:2074468, ack 1225, win 501, length 164
17:14:34.080742 IP 165.22.229.18.22 > 50.101.85.188.58534: Flags [P.], seq 2074468:2074632, ack 1225, win 501, length 164
17:14:34.080845 IP 165.22.229.18.22 > 50.101.85.188.58534: Flags [P.], seq 2074632:2074796, ack 1225, win 501, length 164
17:14:34.080951 IP 50.101.85.188.58534 > 165.22.229.18.22: Flags [.], ack 2068544, win 513, length 0
17:14:34.080951 IP 50.101.85.188.58534 > 165.22.229.18.22: Flags [.], ack 2069692, win 516, length 0
17:14:34.080968 IP 165.22.229.18.22 > 50.101.85.188.58534: Flags [P.], seq 2074796:2074960, ack 1225, win 501, length 164
17:14:34.081090 IP 165.22.229.18.22 > 50.101.85.188.58534: Flags [P.], seq 2074960:2075324, ack 1225, win 501, length 364
17:14:34.081231 IP 165.22.229.18.22 > 50.101.85.188.58534: Flags [P.], seq 2075324:2075488, ack 1225, win 501, length 164
17:14:34.081388 IP 165.22.229.18.22 > 50.101.85.188.58534: Flags [P.], seq 2075488:2075652, ack 1225, win 501, length 164
17:14:34.081503 IP 165.22.229.18.22 > 50.101.85.188.58534: Flags [P.], seq 2075652:2075816, ack 1225, win 501, length 164
17:14:34.081598 IP 165.22.229.18.22 > 50.101.85.188.58534: Flags [P.], seq 2075816:2075980, ack 1225, win 501, length 164
17:14:34.081698 IP 165.22.229.18.22 > 50.101.85.188.58534: Flags [P.], seq 2075980:2076144, ack 1225, win 501, length 164
17:14:34.081795 IP 165.22.229.18.22 > 50.101.85.188.58534: Flags [P.], seq 2076144:2076308, ack 1225, win 501, length 164
17:14:34.081892 IP 165.22.229.18.22 > 50.101.85.188.58534: Flags [P.], seq 2076308:2076472, ack 1225, win 501, length 164
17:14:34.081921 IP 50.101.85.188.58534 > 165.22.229.18.22: Flags [.], ack 2070548, win 512, length 0
17:14:34.081921 IP 50.101.85.188.58534 > 165.22.229.18.22: Flags [.], ack 2071808, win 516, length 0
17:14:34.082038 IP 165.22.229.18.22 > 50.101.85.188.58534: Flags [P.], seq 2076472:2076836, ack 1225, win 501, length 364
17:14:34.082146 IP 165.22.229.18.22 > 50.101.85.188.58534: Flags [P.], seq 2076836:2077000, ack 1225, win 501, length 164
17:14:34.082263 IP 165.22.229.18.22 > 50.101.85.188.58534: Flags [P.], seq 2077000:2077164, ack 1225, win 501, length 164
17:14:34.082381 IP 165.22.229.18.22 > 50.101.85.188.58534: Flags [P.], seq 2077164:2077328, ack 1225, win 501, length 164
17:14:34.082545 IP 165.22.229.18.22 > 50.101.85.188.58534: Flags [P.], seq 2077328:2077492, ack 1225, win 501, length 164
17:14:34.082685 IP 165.22.229.18.22 > 50.101.85.188.58534: Flags [P.], seq 2077492:2077656, ack 1225, win 501, length 164
17:14:34.082778 IP 165.22.229.18.22 > 50.101.85.188.58534: Flags [P.], seq 2077656:2077820, ack 1225, win 501, length 164
17:14:34.082861 IP 165.22.229.18.22 > 50.101.85.188.58534: Flags [P.], seq 2077820:2077984, ack 1225, win 501, length 164
17:14:34.082954 IP 50.101.85.188.58534 > 165.22.229.18.22: Flags [.], ack 2072300, win 514, length 0
17:14:34.082973 IP 165.22.229.18.22 > 50.101.85.188.58534: Flags [P.], seq 2077984:2078148, ack 1225, win 501, length 164
17:14:34.083094 IP 165.22.229.18.22 > 50.101.85.188.58534: Flags [P.], seq 2078148:2078408, ack 1225, win 501, length 260
17:14:34.083227 IP 165.22.229.18.22 > 50.101.85.188.58534: Flags [P.], seq 2078408:2078572, ack 1225, win 501, length 164
17:14:34.083339 IP 165.22.229.18.22 > 50.101.85.188.58534: Flags [P.], seq 2078572:2078736, ack 1225, win 501, length 164
17:14:34.083455 IP 165.22.229.18.22 > 50.101.85.188.58534: Flags [P.], seq 2078736:2078900, ack 1225, win 501, length 164
17:14:34.083551 IP 165.22.229.18.22 > 50.101.85.188.58534: Flags [P.], seq 2078900:2079064, ack 1225, win 501, length 164
17:14:34.083638 IP 165.22.229.18.22 > 50.101.85.188.58534: Flags [P.], seq 2079064:2079228, ack 1225, win 501, length 164
17:14:34.083719 IP 165.22.229.18.22 > 50.101.85.188.58534: Flags [P.], seq 2079228:2079392, ack 1225, win 501, length 164
17:14:34.083800 IP 165.22.229.18.22 > 50.101.85.188.58534: Flags [P.], seq 2079392:2079556, ack 1225, win 501, length 164
17:14:34.083885 IP 165.22.229.18.22 > 50.101.85.188.58534: Flags [P.], seq 2079556:2079720, ack 1225, win 501, length 164
17:14:34.083961 IP 50.101.85.188.58534 > 165.22.229.18.22: Flags [.], ack 2073648, win 516, length 0
17:14:34.083961 IP 50.101.85.188.58534 > 165.22.229.18.22: Flags [.], ack 2074796, win 511, length 0
17:14:34.084054 IP 165.22.229.18.22 > 50.101.85.188.58534: Flags [P.], seq 2079720:2080084, ack 1225, win 501, length 364
17:14:34.084140 IP 165.22.229.18.22 > 50.101.85.188.58534: Flags [P.], seq 2080084:2080248, ack 1225, win 501, length 164
17:14:34.084221 IP 165.22.229.18.22 > 50.101.85.188.58534: Flags [P.], seq 2080248:2080412, ack 1225, win 501, length 164
17:14:34.084302 IP 165.22.229.18.22 > 50.101.85.188.58534: Flags [P.], seq 2080412:2080576, ack 1225, win 501, length 164
17:14:34.084416 IP 165.22.229.18.22 > 50.101.85.188.58534: Flags [P.], seq 2080576:2080740, ack 1225, win 501, length 164
17:14:34.084508 IP 165.22.229.18.22 > 50.101.85.188.58534: Flags [P.], seq 2080740:2080904, ack 1225, win 501, length 164
17:14:34.084618 IP 165.22.229.18.22 > 50.101.85.188.58534: Flags [P.], seq 2080904:2081068, ack 1225, win 501, length 164
17:14:34.084709 IP 165.22.229.18.22 > 50.101.85.188.58534: Flags [P.], seq 2081068:2081232, ack 1225, win 501, length 164
17:14:34.084793 IP 165.22.229.18.22 > 50.101.85.188.58534: Flags [P.], seq 2081232:2081396, ack 1225, win 501, length 164
17:14:34.084873 IP 165.22.229.18.22 > 50.101.85.188.58534: Flags [P.], seq 2081396:2081560, ack 1225, win 501, length 164
17:14:34.084955 IP 165.22.229.18.22 > 50.101.85.188.58534: Flags [P.], seq 2081560:2081724, ack 1225, win 501, length 164
17:14:34.084971 IP 50.101.85.188.58534 > 165.22.229.18.22: Flags [.], ack 2075652, win 516, length 0
17:14:34.084971 IP 50.101.85.188.58534 > 165.22.229.18.22: Flags [.], ack 2077000, win 510, length 0
17:14:34.085090 IP 165.22.229.18.22 > 50.101.85.188.58534: Flags [P.], seq 2081724:2082088, ack 1225, win 501, length 364
17:14:34.085183 IP 165.22.229.18.22 > 50.101.85.188.58534: Flags [P.], seq 2082088:2082252, ack 1225, win 501, length 164
17:14:34.085264 IP 165.22.229.18.22 > 50.101.85.188.58534: Flags [P.], seq 2082252:2082416, ack 1225, win 501, length 164
17:14:34.085373 IP 165.22.229.18.22 > 50.101.85.188.58534: Flags [P.], seq 2082416:2082580, ack 1225, win 501, length 164
17:14:34.085471 IP 165.22.229.18.22 > 50.101.85.188.58534: Flags [P.], seq 2082580:2082744, ack 1225, win 501, length 164
17:14:34.085577 IP 165.22.229.18.22 > 50.101.85.188.58534: Flags [P.], seq 2082744:2082908, ack 1225, win 501, length 164
17:14:34.085669 IP 165.22.229.18.22 > 50.101.85.188.58534: Flags [P.], seq 2082908:2083072, ack 1225, win 501, length 164
17:14:34.085782 IP 165.22.229.18.22 > 50.101.85.188.58534: Flags [P.], seq 2083072:2083236, ack 1225, win 501, length 164
17:14:34.085879 IP 165.22.229.18.22 > 50.101.85.188.58534: Flags [P.], seq 2083236:2083400, ack 1225, win 501, length 164
17:14:34.085961 IP 50.101.85.188.58534 > 165.22.229.18.22: Flags [.], ack 2077328, win 516, length 0
17:14:34.085961 IP 50.101.85.188.58534 > 165.22.229.18.22: Flags [.], ack 2078736, win 510, length 0
17:14:34.086050 IP 165.22.229.18.22 > 50.101.85.188.58534: Flags [P.], seq 2083400:2083764, ack 1225, win 501, length 364
17:14:34.086159 IP 165.22.229.18.22 > 50.101.85.188.58534: Flags [P.], seq 2083764:2083928, ack 1225, win 501, length 164
17:14:34.086246 IP 165.22.229.18.22 > 50.101.85.188.58534: Flags [P.], seq 2083928:2084092, ack 1225, win 501, length 164
17:14:34.086329 IP 165.22.229.18.22 > 50.101.85.188.58534: Flags [P.], seq 2084092:2084256, ack 1225, win 501, length 164
17:14:34.086439 IP 165.22.229.18.22 > 50.101.85.188.58534: Flags [P.], seq 2084256:2084420, ack 1225, win 501, length 164
17:14:34.086559 IP 165.22.229.18.22 > 50.101.85.188.58534: Flags [P.], seq 2084420:2084584, ack 1225, win 501, length 164
17:14:34.086711 IP 165.22.229.18.22 > 50.101.85.188.58534: Flags [P.], seq 2084584:2084748, ack 1225, win 501, length 164
17:14:34.086856 IP 165.22.229.18.22 > 50.101.85.188.58534: Flags [P.], seq 2084748:2084912, ack 1225, win 501, length 164
17:14:34.086987 IP 50.101.85.188.58534 > 165.22.229.18.22: Flags [.], ack 2079392, win 516, length 0
17:14:34.087101 IP 165.22.229.18.22 > 50.101.85.188.58534: Flags [P.], seq 2084912:2085076, ack 1225, win 501, length 164
17:14:34.087190 IP 165.22.229.18.22 > 50.101.85.188.58534: Flags [P.], seq 2085076:2085380, ack 1225, win 501, length 304
17:14:34.087281 IP 165.22.229.18.22 > 50.101.85.188.58534: Flags [P.], seq 2085380:2085544, ack 1225, win 501, length 164
17:14:34.087366 IP 165.22.229.18.22 > 50.101.85.188.58534: Flags [P.], seq 2085544:2085708, ack 1225, win 501, length 164
17:14:34.087450 IP 165.22.229.18.22 > 50.101.85.188.58534: Flags [P.], seq 2085708:2085872, ack 1225, win 501, length 164
17:14:34.087532 IP 165.22.229.18.22 > 50.101.85.188.58534: Flags [P.], seq 2085872:2086036, ack 1225, win 501, length 164
17:14:34.087614 IP 165.22.229.18.22 > 50.101.85.188.58534: Flags [P.], seq 2086036:2086200, ack 1225, win 501, length 164
17:14:34.087695 IP 165.22.229.18.22 > 50.101.85.188.58534: Flags [P.], seq 2086200:2086364, ack 1225, win 501, length 164
17:14:34.087786 IP 165.22.229.18.22 > 50.101.85.188.58534: Flags [P.], seq 2086364:2086528, ack 1225, win 501, length 164
17:14:34.087882 IP 165.22.229.18.22 > 50.101.85.188.58534: Flags [P.], seq 2086528:2086692, ack 1225, win 501, length 164
17:14:34.088003 IP 50.101.85.188.58534 > 165.22.229.18.22: Flags [.], ack 2080904, win 516, length 0
17:14:34.088003 IP 50.101.85.188.58534 > 165.22.229.18.22: Flags [.], ack 2081560, win 513, length 0
17:14:34.088116 IP 165.22.229.18.22 > 50.101.85.188.58534: Flags [P.], seq 2086692:2086856, ack 1225, win 501, length 164
17:14:34.088229 IP 165.22.229.18.22 > 50.101.85.188.58534: Flags [P.], seq 2086856:2087220, ack 1225, win 501, length 364
17:14:34.088346 IP 165.22.229.18.22 > 50.101.85.188.58534: Flags [P.], seq 2087220:2087384, ack 1225, win 501, length 164
17:14:34.088461 IP 165.22.229.18.22 > 50.101.85.188.58534: Flags [P.], seq 2087384:2087548, ack 1225, win 501, length 164
17:14:34.088593 IP 165.22.229.18.22 > 50.101.85.188.58534: Flags [P.], seq 2087548:2087712, ack 1225, win 501, length 164
17:14:34.088727 IP 165.22.229.18.22 > 50.101.85.188.58534: Flags [P.], seq 2087712:2087876, ack 1225, win 501, length 164
17:14:34.088854 IP 165.22.229.18.22 > 50.101.85.188.58534: Flags [P.], seq 2087876:2088040, ack 1225, win 501, length 164
17:14:34.088962 IP 50.101.85.188.58534 > 165.22.229.18.22: Flags [.], ack 2083072, win 516, length 0
17:14:34.089069 IP 165.22.229.18.22 > 50.101.85.188.58534: Flags [P.], seq 2088040:2088204, ack 1225, win 501, length 164
17:14:34.089198 IP 165.22.229.18.22 > 50.101.85.188.58534: Flags [P.], seq 2088204:2088344, ack 1225, win 501, length 140
17:14:34.089311 IP 165.22.229.18.22 > 50.101.85.188.58534: Flags [P.], seq 2088344:2088508, ack 1225, win 501, length 164
17:14:34.089420 IP 165.22.229.18.22 > 50.101.85.188.58534: Flags [P.], seq 2088508:2088672, ack 1225, win 501, length 164
17:14:34.089522 IP 165.22.229.18.22 > 50.101.85.188.58534: Flags [P.], seq 2088672:2089000, ack 1225, win 501, length 328
17:14:34.089668 IP 165.22.229.18.22 > 50.101.85.188.58534: Flags [P.], seq 2089000:2089164, ack 1225, win 501, length 164
17:14:34.089795 IP 165.22.229.18.22 > 50.101.85.188.58534: Flags [P.], seq 2089164:2089328, ack 1225, win 501, length 164
17:14:34.089906 IP 50.101.85.188.58534 > 165.22.229.18.22: Flags [.], ack 2084092, win 512, length 0
17:14:34.089906 IP 50.101.85.188.58534 > 165.22.229.18.22: Flags [.], ack 2084912, win 516, length 0
17:14:34.090008 IP 165.22.229.18.22 > 50.101.85.188.58534: Flags [P.], seq 2089328:2089492, ack 1225, win 501, length 164
17:14:34.090145 IP 165.22.229.18.22 > 50.101.85.188.58534: Flags [P.], seq 2089492:2089736, ack 1225, win 501, length 244
17:14:34.090246 IP 165.22.229.18.22 > 50.101.85.188.58534: Flags [P.], seq 2089736:2089900, ack 1225, win 501, length 164
17:14:34.090345 IP 165.22.229.18.22 > 50.101.85.188.58534: Flags [P.], seq 2089900:2090064, ack 1225, win 501, length 164
17:14:34.090445 IP 165.22.229.18.22 > 50.101.85.188.58534: Flags [P.], seq 2090064:2090228, ack 1225, win 501, length 164
17:14:34.090566 IP 165.22.229.18.22 > 50.101.85.188.58534: Flags [P.], seq 2090228:2090392, ack 1225, win 501, length 164
17:14:34.090683 IP 165.22.229.18.22 > 50.101.85.188.58534: Flags [P.], seq 2090392:2090556, ack 1225, win 501, length 164
17:14:34.090798 IP 165.22.229.18.22 > 50.101.85.188.58534: Flags [P.], seq 2090556:2090720, ack 1225, win 501, length 164
17:14:34.090914 IP 50.101.85.188.58534 > 165.22.229.18.22: Flags [.], ack 2084912, win 516, options [nop,nop,sack 1 {2085076:2085380}], length 0
17:14:34.090914 IP 50.101.85.188.58534 > 165.22.229.18.22: Flags [.], ack 2085380, win 514, length 0
17:14:34.090914 IP 50.101.85.188.58534 > 165.22.229.18.22: Flags [.], ack 2085872, win 512, length 0
17:14:34.090914 IP 50.101.85.188.58534 > 165.22.229.18.22: Flags [.], ack 2086856, win 516, length 0
17:14:34.091066 IP 165.22.229.18.22 > 50.101.85.188.58534: Flags [P.], seq 2090720:2090884, ack 1225, win 501, length 164
17:14:34.091196 IP 165.22.229.18.22 > 50.101.85.188.58534: Flags [P.], seq 2090884:2091496, ack 1225, win 501, length 612
17:14:34.091315 IP 165.22.229.18.22 > 50.101.85.188.58534: Flags [P.], seq 2091496:2091660, ack 1225, win 501, length 164
17:14:34.091434 IP 165.22.229.18.22 > 50.101.85.188.58534: Flags [P.], seq 2091660:2091824, ack 1225, win 501, length 164
17:14:34.091574 IP 165.22.229.18.22 > 50.101.85.188.58534: Flags [P.], seq 2091824:2092152, ack 1225, win 501, length 328
17:14:34.091697 IP 165.22.229.18.22 > 50.101.85.188.58534: Flags [P.], seq 2092152:2092316, ack 1225, win 501, length 164
17:14:34.091815 IP 165.22.229.18.22 > 50.101.85.188.58534: Flags [P.], seq 2092316:2092480, ack 1225, win 501, length 164
17:14:34.091922 IP 50.101.85.188.58534 > 165.22.229.18.22: Flags [.], ack 2087548, win 513, length 0
17:14:34.092006 IP 165.22.229.18.22 > 50.101.85.188.58534: Flags [P.], seq 2092480:2092740, ack 1225, win 501, length 260
17:14:34.092124 IP 165.22.229.18.22 > 50.101.85.188.58534: Flags [P.], seq 2092740:2092904, ack 1225, win 501, length 164
17:14:34.092241 IP 165.22.229.18.22 > 50.101.85.188.58534: Flags [P.], seq 2092904:2093068, ack 1225, win 501, length 164
17:14:34.092361 IP 165.22.229.18.22 > 50.101.85.188.58534: Flags [P.], seq 2093068:2093232, ack 1225, win 501, length 164
17:14:34.092479 IP 165.22.229.18.22 > 50.101.85.188.58534: Flags [P.], seq 2093232:2093396, ack 1225, win 501, length 164
17:14:34.092596 IP 165.22.229.18.22 > 50.101.85.188.58534: Flags [P.], seq 2093396:2093560, ack 1225, win 501, length 164
17:14:34.092712 IP 165.22.229.18.22 > 50.101.85.188.58534: Flags [P.], seq 2093560:2093724, ack 1225, win 501, length 164
17:14:34.092829 IP 165.22.229.18.22 > 50.101.85.188.58534: Flags [P.], seq 2093724:2093888, ack 1225, win 501, length 164
17:14:34.092928 IP 50.101.85.188.58534 > 165.22.229.18.22: Flags [.], ack 2088508, win 516, length 0
17:14:34.092929 IP 50.101.85.188.58534 > 165.22.229.18.22: Flags [.], ack 2089000, win 514, length 0
17:14:34.093036 IP 165.22.229.18.22 > 50.101.85.188.58534: Flags [P.], seq 2093888:2094252, ack 1225, win 501, length 364
17:14:34.093155 IP 165.22.229.18.22 > 50.101.85.188.58534: Flags [P.], seq 2094252:2094416, ack 1225, win 501, length 164
17:14:34.093300 IP 165.22.229.18.22 > 50.101.85.188.58534: Flags [P.], seq 2094416:2094580, ack 1225, win 501, length 164
17:14:34.093424 IP 165.22.229.18.22 > 50.101.85.188.58534: Flags [P.], seq 2094580:2094744, ack 1225, win 501, length 164
17:14:34.093542 IP 165.22.229.18.22 > 50.101.85.188.58534: Flags [P.], seq 2094744:2094908, ack 1225, win 501, length 164
17:14:34.093659 IP 165.22.229.18.22 > 50.101.85.188.58534: Flags [P.], seq 2094908:2095072, ack 1225, win 501, length 164
17:14:34.093781 IP 165.22.229.18.22 > 50.101.85.188.58534: Flags [P.], seq 2095072:2095236, ack 1225, win 501, length 164
17:14:34.093912 IP 50.101.85.188.58534 > 165.22.229.18.22: Flags [.], ack 2089900, win 510, length 0
17:14:34.093912 IP 50.101.85.188.58534 > 165.22.229.18.22: Flags [.], ack 2090556, win 516, length 0
17:14:34.093931 IP 165.22.229.18.22 > 50.101.85.188.58534: Flags [P.], seq 2095236:2095400, ack 1225, win 501, length 164
17:14:34.094105 IP 165.22.229.18.22 > 50.101.85.188.58534: Flags [P.], seq 2095400:2095764, ack 1225, win 501, length 364
17:14:34.094222 IP 165.22.229.18.22 > 50.101.85.188.58534: Flags [P.], seq 2095764:2095928, ack 1225, win 501, length 164
17:14:34.094339 IP 165.22.229.18.22 > 50.101.85.188.58534: Flags [P.], seq 2095928:2096092, ack 1225, win 501, length 164
17:14:34.094458 IP 165.22.229.18.22 > 50.101.85.188.58534: Flags [P.], seq 2096092:2096256, ack 1225, win 501, length 164
17:14:34.094576 IP 165.22.229.18.22 > 50.101.85.188.58534: Flags [P.], seq 2096256:2096420, ack 1225, win 501, length 164
17:14:34.094693 IP 165.22.229.18.22 > 50.101.85.188.58534: Flags [P.], seq 2096420:2096584, ack 1225, win 501, length 164
17:14:34.094866 IP 165.22.229.18.22 > 50.101.85.188.58534: Flags [P.], seq 2096584:2096748, ack 1225, win 501, length 164
17:14:34.094940 IP 50.101.85.188.58534 > 165.22.229.18.22: Flags [.], ack 2091660, win 511, length 0
17:14:34.094940 IP 50.101.85.188.58534 > 165.22.229.18.22: Flags [.], ack 2092904, win 516, length 0
17:14:34.094940 IP 50.101.85.188.58534 > 165.22.229.18.22: Flags [.], ack 2093396, win 514, length 0
17:14:34.095069 IP 165.22.229.18.22 > 50.101.85.188.58534: Flags [P.], seq 2096748:2097216, ack 1225, win 501, length 468
17:14:34.095161 IP 165.22.229.18.22 > 50.101.85.188.58534: Flags [P.], seq 2097216:2097380, ack 1225, win 501, length 164
17:14:34.095245 IP 165.22.229.18.22 > 50.101.85.188.58534: Flags [P.], seq 2097380:2097544, ack 1225, win 501, length 164
17:14:34.095331 IP 165.22.229.18.22 > 50.101.85.188.58534: Flags [P.], seq 2097544:2097708, ack 1225, win 501, length 164
17:14:34.095414 IP 165.22.229.18.22 > 50.101.85.188.58534: Flags [P.], seq 2097708:2097872, ack 1225, win 501, length 164
17:14:34.095499 IP 165.22.229.18.22 > 50.101.85.188.58534: Flags [P.], seq 2097872:2098036, ack 1225, win 501, length 164
17:14:34.095622 IP 165.22.229.18.22 > 50.101.85.188.58534: Flags [P.], seq 2098036:2098200, ack 1225, win 501, length 164
17:14:34.095741 IP 165.22.229.18.22 > 50.101.85.188.58534: Flags [P.], seq 2098200:2098364, ack 1225, win 501, length 164
17:14:34.095860 IP 165.22.229.18.22 > 50.101.85.188.58534: Flags [P.], seq 2098364:2098528, ack 1225, win 501, length 164
17:14:34.095959 IP 50.101.85.188.58534 > 165.22.229.18.22: Flags [.], ack 2093888, win 512, length 0
17:14:34.096048 IP 165.22.229.18.22 > 50.101.85.188.58534: Flags [P.], seq 2098528:2098788, ack 1225, win 501, length 260
17:14:34.096166 IP 165.22.229.18.22 > 50.101.85.188.58534: Flags [P.], seq 2098788:2098952, ack 1225, win 501, length 164
17:14:34.096285 IP 165.22.229.18.22 > 50.101.85.188.58534: Flags [P.], seq 2098952:2099116, ack 1225, win 501, length 164
17:14:34.096403 IP 165.22.229.18.22 > 50.101.85.188.58534: Flags [P.], seq 2099116:2099280, ack 1225, win 501, length 164
17:14:34.096522 IP 165.22.229.18.22 > 50.101.85.188.58534: Flags [P.], seq 2099280:2099444, ack 1225, win 501, length 164
17:14:34.096642 IP 165.22.229.18.22 > 50.101.85.188.58534: Flags [P.], seq 2099444:2099608, ack 1225, win 501, length 164
17:14:34.096760 IP 165.22.229.18.22 > 50.101.85.188.58534: Flags [P.], seq 2099608:2099772, ack 1225, win 501, length 164
17:14:34.096877 IP 165.22.229.18.22 > 50.101.85.188.58534: Flags [P.], seq 2099772:2099936, ack 1225, win 501, length 164
17:14:34.096939 IP 50.101.85.188.58534 > 165.22.229.18.22: Flags [.], ack 2095236, win 516, length 0
17:14:34.096939 IP 50.101.85.188.58534 > 165.22.229.18.22: Flags [.], ack 2096092, win 512, length 0
17:14:34.097074 IP 165.22.229.18.22 > 50.101.85.188.58534: Flags [P.], seq 2099936:2100300, ack 1225, win 501, length 364
17:14:34.097193 IP 165.22.229.18.22 > 50.101.85.188.58534: Flags [P.], seq 2100300:2100464, ack 1225, win 501, length 164
17:14:34.097321 IP 165.22.229.18.22 > 50.101.85.188.58534: Flags [P.], seq 2100464:2100628, ack 1225, win 501, length 164
17:14:34.097442 IP 165.22.229.18.22 > 50.101.85.188.58534: Flags [P.], seq 2100628:2100792, ack 1225, win 501, length 164
17:14:34.097559 IP 165.22.229.18.22 > 50.101.85.188.58534: Flags [P.], seq 2100792:2100956, ack 1225, win 501, length 164
17:14:34.097680 IP 165.22.229.18.22 > 50.101.85.188.58534: Flags [P.], seq 2100956:2101120, ack 1225, win 501, length 164
17:14:34.097813 IP 165.22.229.18.22 > 50.101.85.188.58534: Flags [P.], seq 2101120:2101284, ack 1225, win 501, length 164
17:14:34.097918 IP 50.101.85.188.58534 > 165.22.229.18.22: Flags [.], ack 2096584, win 510, length 0
17:14:34.097999 IP 165.22.229.18.22 > 50.101.85.188.58534: Flags [P.], seq 2101284:2101544, ack 1225, win 501, length 260
17:14:34.098133 IP 165.22.229.18.22 > 50.101.85.188.58534: Flags [P.], seq 2101544:2101708, ack 1225, win 501, length 164
17:14:34.098251 IP 165.22.229.18.22 > 50.101.85.188.58534: Flags [P.], seq 2101708:2101872, ack 1225, win 501, length 164
17:14:34.098369 IP 165.22.229.18.22 > 50.101.85.188.58534: Flags [P.], seq 2101872:2102036, ack 1225, win 501, length 164
17:14:34.098491 IP 165.22.229.18.22 > 50.101.85.188.58534: Flags [P.], seq 2102036:2102200, ack 1225, win 501, length 164
17:14:34.098608 IP 165.22.229.18.22 > 50.101.85.188.58534: Flags [P.], seq 2102200:2102364, ack 1225, win 501, length 164
17:14:34.098727 IP 165.22.229.18.22 > 50.101.85.188.58534: Flags [P.], seq 2102364:2102528, ack 1225, win 501, length 164
17:14:34.098843 IP 165.22.229.18.22 > 50.101.85.188.58534: Flags [P.], seq 2102528:2102692, ack 1225, win 501, length 164
17:14:34.098939 IP 50.101.85.188.58534 > 165.22.229.18.22: Flags [.], ack 2098528, win 516, length 0
17:14:34.099032 IP 165.22.229.18.22 > 50.101.85.188.58534: Flags [P.], seq 2102692:2102952, ack 1225, win 501, length 260
17:14:34.099151 IP 165.22.229.18.22 > 50.101.85.188.58534: Flags [P.], seq 2102952:2103116, ack 1225, win 501, length 164
17:14:34.099268 IP 165.22.229.18.22 > 50.101.85.188.58534: Flags [P.], seq 2103116:2103280, ack 1225, win 501, length 164
17:14:34.099394 IP 165.22.229.18.22 > 50.101.85.188.58534: Flags [P.], seq 2103280:2103444, ack 1225, win 501, length 164
17:14:34.099521 IP 165.22.229.18.22 > 50.101.85.188.58534: Flags [P.], seq 2103444:2103608, ack 1225, win 501, length 164
17:14:34.099611 IP 165.22.229.18.22 > 50.101.85.188.58534: Flags [P.], seq 2103608:2103772, ack 1225, win 501, length 164
17:14:34.099719 IP 165.22.229.18.22 > 50.101.85.188.58534: Flags [P.], seq 2103772:2103936, ack 1225, win 501, length 164
17:14:34.099806 IP 165.22.229.18.22 > 50.101.85.188.58534: Flags [P.], seq 2103936:2104100, ack 1225, win 501, length 164
17:14:34.099887 IP 165.22.229.18.22 > 50.101.85.188.58534: Flags [P.], seq 2104100:2104264, ack 1225, win 501, length 164
17:14:34.099926 IP 50.101.85.188.58534 > 165.22.229.18.22: Flags [.], ack 2098952, win 514, length 0
17:14:34.099927 IP 50.101.85.188.58534 > 165.22.229.18.22: Flags [.], ack 2099772, win 511, length 0
17:14:34.100052 IP 165.22.229.18.22 > 50.101.85.188.58534: Flags [P.], seq 2104264:2104628, ack 1225, win 501, length 364
17:14:34.100170 IP 165.22.229.18.22 > 50.101.85.188.58534: Flags [P.], seq 2104628:2104792, ack 1225, win 501, length 164
17:14:34.100442 IP 165.22.229.18.22 > 50.101.85.188.58534: Flags [P.], seq 2104792:2104956, ack 1225, win 501, length 164
17:14:34.100571 IP 165.22.229.18.22 > 50.101.85.188.58534: Flags [P.], seq 2104956:2105120, ack 1225, win 501, length 164
17:14:34.100690 IP 165.22.229.18.22 > 50.101.85.188.58534: Flags [P.], seq 2105120:2105284, ack 1225, win 501, length 164
17:14:34.100821 IP 165.22.229.18.22 > 50.101.85.188.58534: Flags [P.], seq 2105284:2105448, ack 1225, win 501, length 164
17:14:34.100955 IP 165.22.229.18.22 > 50.101.85.188.58534: Flags [P.], seq 2105448:2105612, ack 1225, win 501, length 164
17:14:34.101069 IP 165.22.229.18.22 > 50.101.85.188.58534: Flags [P.], seq 2105612:2105776, ack 1225, win 501, length 164
17:14:34.101162 IP 165.22.229.18.22 > 50.101.85.188.58534: Flags [P.], seq 2105776:2105940, ack 1225, win 501, length 164
17:14:34.101280 IP 165.22.229.18.22 > 50.101.85.188.58534: Flags [P.], seq 2105940:2106104, ack 1225, win 501, length 164
17:14:34.101388 IP 165.22.229.18.22 > 50.101.85.188.58534: Flags [P.], seq 2106104:2106268, ack 1225, win 501, length 164
17:14:34.101477 IP 165.22.229.18.22 > 50.101.85.188.58534: Flags [P.], seq 2106268:2106432, ack 1225, win 501, length 164
17:14:34.101560 IP 165.22.229.18.22 > 50.101.85.188.58534: Flags [P.], seq 2106432:2106596, ack 1225, win 501, length 164
17:14:34.101643 IP 165.22.229.18.22 > 50.101.85.188.58534: Flags [P.], seq 2106596:2106760, ack 1225, win 501, length 164
17:14:34.101726 IP 165.22.229.18.22 > 50.101.85.188.58534: Flags [P.], seq 2106760:2106924, ack 1225, win 501, length 164
17:14:34.101810 IP 165.22.229.18.22 > 50.101.85.188.58534: Flags [P.], seq 2106924:2107088, ack 1225, win 501, length 164
17:14:34.101891 IP 165.22.229.18.22 > 50.101.85.188.58534: Flags [P.], seq 2107088:2107252, ack 1225, win 501, length 164
17:14:34.101929 IP 50.101.85.188.58534 > 165.22.229.18.22: Flags [.], ack 2100464, win 516, length 0
17:14:34.101929 IP 50.101.85.188.58534 > 165.22.229.18.22: Flags [.], ack 2102036, win 516, length 0
17:14:34.101929 IP 50.101.85.188.58534 > 165.22.229.18.22: Flags [.], ack 2102528, win 514, length 0
17:14:34.101929 IP 50.101.85.188.58534 > 165.22.229.18.22: Flags [.], ack 2103116, win 511, length 0
17:14:34.102066 IP 165.22.229.18.22 > 50.101.85.188.58534: Flags [P.], seq 2107252:2107824, ack 1225, win 501, length 572
17:14:34.102191 IP 165.22.229.18.22 > 50.101.85.188.58534: Flags [P.], seq 2107824:2107988, ack 1225, win 501, length 164
17:14:34.102278 IP 165.22.229.18.22 > 50.101.85.188.58534: Flags [P.], seq 2107988:2108152, ack 1225, win 501, length 164
17:14:34.102362 IP 165.22.229.18.22 > 50.101.85.188.58534: Flags [P.], seq 2108152:2108316, ack 1225, win 501, length 164
17:14:34.102444 IP 165.22.229.18.22 > 50.101.85.188.58534: Flags [P.], seq 2108316:2108480, ack 1225, win 501, length 164
17:14:34.102553 IP 165.22.229.18.22 > 50.101.85.188.58534: Flags [P.], seq 2108480:2108644, ack 1225, win 501, length 164
17:14:34.102654 IP 165.22.229.18.22 > 50.101.85.188.58534: Flags [P.], seq 2108644:2108808, ack 1225, win 501, length 164
17:14:34.102748 IP 165.22.229.18.22 > 50.101.85.188.58534: Flags [P.], seq 2108808:2108972, ack 1225, win 501, length 164
17:14:34.102855 IP 165.22.229.18.22 > 50.101.85.188.58534: Flags [P.], seq 2108972:2109136, ack 1225, win 501, length 164
17:14:34.102963 IP 50.101.85.188.58534 > 165.22.229.18.22: Flags [.], ack 2104100, win 516, length 0
17:14:34.102982 IP 165.22.229.18.22 > 50.101.85.188.58534: Flags [P.], seq 2109136:2109300, ack 1225, win 501, length 164
17:14:34.103094 IP 165.22.229.18.22 > 50.101.85.188.58534: Flags [P.], seq 2109300:2109560, ack 1225, win 501, length 260
17:14:34.103192 IP 165.22.229.18.22 > 50.101.85.188.58534: Flags [P.], seq 2109560:2109724, ack 1225, win 501, length 164
17:14:34.103286 IP 165.22.229.18.22 > 50.101.85.188.58534: Flags [P.], seq 2109724:2109888, ack 1225, win 501, length 164
17:14:34.103380 IP 165.22.229.18.22 > 50.101.85.188.58534: Flags [P.], seq 2109888:2110052, ack 1225, win 501, length 164
17:14:34.103481 IP 165.22.229.18.22 > 50.101.85.188.58534: Flags [P.], seq 2110052:2110216, ack 1225, win 501, length 164
17:14:34.103583 IP 165.22.229.18.22 > 50.101.85.188.58534: Flags [P.], seq 2110216:2110380, ack 1225, win 501, length 164
17:14:34.103679 IP 165.22.229.18.22 > 50.101.85.188.58534: Flags [P.], seq 2110380:2110544, ack 1225, win 501, length 164
17:14:34.103771 IP 165.22.229.18.22 > 50.101.85.188.58534: Flags [P.], seq 2110544:2110708, ack 1225, win 501, length 164
17:14:34.103872 IP 165.22.229.18.22 > 50.101.85.188.58534: Flags [P.], seq 2110708:2110872, ack 1225, win 501, length 164
17:14:34.103898 IP 50.101.85.188.58534 > 165.22.229.18.22: Flags [.], ack 2105284, win 511, length 0
17:14:34.103898 IP 50.101.85.188.58534 > 165.22.229.18.22: Flags [.], ack 2105612, win 516, length 0
17:14:34.104013 IP 165.22.229.18.22 > 50.101.85.188.58534: Flags [P.], seq 2110872:2111236, ack 1225, win 501, length 364
17:14:34.104112 IP 165.22.229.18.22 > 50.101.85.188.58534: Flags [P.], seq 2111236:2111400, ack 1225, win 501, length 164
17:14:34.104219 IP 165.22.229.18.22 > 50.101.85.188.58534: Flags [P.], seq 2111400:2111564, ack 1225, win 501, length 164
17:14:34.104318 IP 165.22.229.18.22 > 50.101.85.188.58534: Flags [P.], seq 2111564:2111728, ack 1225, win 501, length 164
17:14:34.104413 IP 165.22.229.18.22 > 50.101.85.188.58534: Flags [P.], seq 2111728:2111892, ack 1225, win 501, length 164
17:14:34.104515 IP 165.22.229.18.22 > 50.101.85.188.58534: Flags [P.], seq 2111892:2112056, ack 1225, win 501, length 164
17:14:34.104614 IP 165.22.229.18.22 > 50.101.85.188.58534: Flags [P.], seq 2112056:2112220, ack 1225, win 501, length 164
17:14:34.104714 IP 165.22.229.18.22 > 50.101.85.188.58534: Flags [P.], seq 2112220:2112384, ack 1225, win 501, length 164
17:14:34.104807 IP 165.22.229.18.22 > 50.101.85.188.58534: Flags [P.], seq 2112384:2112548, ack 1225, win 501, length 164
17:14:34.104897 IP 50.101.85.188.58534 > 165.22.229.18.22: Flags [.], ack 2107088, win 516, length 0
17:14:34.104965 IP 165.22.229.18.22 > 50.101.85.188.58534: Flags [P.], seq 2112548:2112712, ack 1225, win 501, length 164
17:14:34.105044 IP 165.22.229.18.22 > 50.101.85.188.58534: Flags [P.], seq 2112712:2112852, ack 1225, win 501, length 140
17:14:34.105111 IP 165.22.229.18.22 > 50.101.85.188.58534: Flags [P.], seq 2112852:2113016, ack 1225, win 501, length 164
17:14:34.105198 IP 165.22.229.18.22 > 50.101.85.188.58534: Flags [P.], seq 2113016:2113344, ack 1225, win 501, length 328
17:14:34.105305 IP 165.22.229.18.22 > 50.101.85.188.58534: Flags [P.], seq 2113344:2113508, ack 1225, win 501, length 164
17:14:34.105395 IP 165.22.229.18.22 > 50.101.85.188.58534: Flags [P.], seq 2113508:2113672, ack 1225, win 501, length 164
17:14:34.105493 IP 165.22.229.18.22 > 50.101.85.188.58534: Flags [P.], seq 2113672:2113836, ack 1225, win 501, length 164
17:14:34.105615 IP 165.22.229.18.22 > 50.101.85.188.58534: Flags [P.], seq 2113836:2114000, ack 1225, win 501, length 164
17:14:34.105767 IP 165.22.229.18.22 > 50.101.85.188.58534: Flags [P.], seq 2114000:2114164, ack 1225, win 501, length 164
17:14:34.105861 IP 165.22.229.18.22 > 50.101.85.188.58534: Flags [P.], seq 2114164:2114328, ack 1225, win 501, length 164
17:14:34.105937 IP 50.101.85.188.58534 > 165.22.229.18.22: Flags [.], ack 2107988, win 512, length 0
17:14:34.105937 IP 50.101.85.188.58534 > 165.22.229.18.22: Flags [.], ack 2109300, win 516, length 0
17:14:34.106029 IP 165.22.229.18.22 > 50.101.85.188.58534: Flags [P.], seq 2114328:2114692, ack 1225, win 501, length 364
17:14:34.106148 IP 165.22.229.18.22 > 50.101.85.188.58534: Flags [P.], seq 2114692:2114856, ack 1225, win 501, length 164
17:14:34.106237 IP 165.22.229.18.22 > 50.101.85.188.58534: Flags [P.], seq 2114856:2115020, ack 1225, win 501, length 164
17:14:34.106321 IP 165.22.229.18.22 > 50.101.85.188.58534: Flags [P.], seq 2115020:2115184, ack 1225, win 501, length 164
17:14:34.106409 IP 165.22.229.18.22 > 50.101.85.188.58534: Flags [P.], seq 2115184:2115348, ack 1225, win 501, length 164
17:14:34.106490 IP 165.22.229.18.22 > 50.101.85.188.58534: Flags [P.], seq 2115348:2115512, ack 1225, win 501, length 164
