17:16:04.126122 IP lamponubuntu2004-s-1vcpu-1gb-tor1-01.ssh > 50.101.85.188.58534: Flags [P.], seq 1664824:1665004, ack 973, win 501, length 180
17:16:04.126255 IP lamponubuntu2004-s-1vcpu-1gb-tor1-01.ssh > 50.101.85.188.58534: Flags [P.], seq 1665004:1665184, ack 973, win 501, length 180
17:16:04.126388 IP lamponubuntu2004-s-1vcpu-1gb-tor1-01.ssh > 50.101.85.188.58534: Flags [P.], seq 1665184:1665364, ack 973, win 501, length 180
17:16:04.126549 IP lamponubuntu2004-s-1vcpu-1gb-tor1-01.ssh > 50.101.85.188.58534: Flags [P.], seq 1665364:1665544, ack 973, win 501, length 180
17:16:04.126694 IP lamponubuntu2004-s-1vcpu-1gb-tor1-01.ssh > 50.101.85.188.58534: Flags [P.], seq 1665544:1665724, ack 973, win 501, length 180
17:16:04.126837 IP lamponubuntu2004-s-1vcpu-1gb-tor1-01.ssh > 50.101.85.188.58534: Flags [P.], seq 1665724:1665904, ack 973, win 501, length 180
17:16:04.126969 IP lamponubuntu2004-s-1vcpu-1gb-tor1-01.ssh > 50.101.85.188.58534: Flags [P.], seq 1665904:1666084, ack 973, win 501, length 180
17:16:04.127171 IP lamponubuntu2004-s-1vcpu-1gb-tor1-01.ssh > 50.101.85.188.58534: Flags [P.], seq 1666084:1666264, ack 973, win 501, length 180
17:16:04.127309 IP lamponubuntu2004-s-1vcpu-1gb-tor1-01.ssh > 50.101.85.188.58534: Flags [P.], seq 1666264:1666444, ack 973, win 501, length 180
17:16:04.127445 IP lamponubuntu2004-s-1vcpu-1gb-tor1-01.ssh > 50.101.85.188.58534: Flags [P.], seq 1666444:1666624, ack 973, win 501, length 180
17:16:04.127574 IP lamponubuntu2004-s-1vcpu-1gb-tor1-01.ssh > 50.101.85.188.58534: Flags [P.], seq 1666624:1666804, ack 973, win 501, length 180
17:16:04.127732 IP lamponubuntu2004-s-1vcpu-1gb-tor1-01.ssh > 50.101.85.188.58534: Flags [P.], seq 1666804:1666984, ack 973, win 501, length 180
17:16:04.127880 IP lamponubuntu2004-s-1vcpu-1gb-tor1-01.ssh > 50.101.85.188.58534: Flags [P.], seq 1666984:1667164, ack 973, win 501, length 180
17:16:04.128017 IP lamponubuntu2004-s-1vcpu-1gb-tor1-01.ssh > 50.101.85.188.58534: Flags [P.], seq 1667164:1667344, ack 973, win 501, length 180
17:16:04.128158 IP lamponubuntu2004-s-1vcpu-1gb-tor1-01.ssh > 50.101.85.188.58534: Flags [P.], seq 1667344:1667524, ack 973, win 501, length 180
17:16:04.128292 IP lamponubuntu2004-s-1vcpu-1gb-tor1-01.ssh > 50.101.85.188.58534: Flags [P.], seq 1667524:1667704, ack 973, win 501, length 180
17:16:04.128431 IP lamponubuntu2004-s-1vcpu-1gb-tor1-01.ssh > 50.101.85.188.58534: Flags [P.], seq 1667704:1667884, ack 973, win 501, length 180
17:16:04.128570 IP lamponubuntu2004-s-1vcpu-1gb-tor1-01.ssh > 50.101.85.188.58534: Flags [P.], seq 1667884:1668064, ack 973, win 501, length 180
17:16:04.128701 IP lamponubuntu2004-s-1vcpu-1gb-tor1-01.ssh > 50.101.85.188.58534: Flags [P.], seq 1668064:1668244, ack 973, win 501, length 180
17:16:04.128839 IP lamponubuntu2004-s-1vcpu-1gb-tor1-01.ssh > 50.101.85.188.58534: Flags [P.], seq 1668244:1668424, ack 973, win 501, length 180
17:16:04.128984 IP lamponubuntu2004-s-1vcpu-1gb-tor1-01.ssh > 50.101.85.188.58534: Flags [P.], seq 1668424:1668604, ack 973, win 501, length 180
17:16:04.129139 IP lamponubuntu2004-s-1vcpu-1gb-tor1-01.ssh > 50.101.85.188.58534: Flags [P.], seq 1668604:1668784, ack 973, win 501, length 180
17:16:04.129282 IP lamponubuntu2004-s-1vcpu-1gb-tor1-01.ssh > 50.101.85.188.58534: Flags [P.], seq 1668784:1668964, ack 973, win 501, length 180
17:16:04.129441 IP lamponubuntu2004-s-1vcpu-1gb-tor1-01.ssh > 50.101.85.188.58534: Flags [P.], seq 1668964:1669144, ack 973, win 501, length 180
17:16:04.129592 IP lamponubuntu2004-s-1vcpu-1gb-tor1-01.ssh > 50.101.85.188.58534: Flags [P.], seq 1669144:1669324, ack 973, win 501, length 180
17:16:04.129732 IP lamponubuntu2004-s-1vcpu-1gb-tor1-01.ssh > 50.101.85.188.58534: Flags [P.], seq 1669324:1669504, ack 973, win 501, length 180
17:16:04.129871 IP lamponubuntu2004-s-1vcpu-1gb-tor1-01.ssh > 50.101.85.188.58534: Flags [P.], seq 1669504:1669684, ack 973, win 501, length 180
17:16:04.130025 IP lamponubuntu2004-s-1vcpu-1gb-tor1-01.ssh > 50.101.85.188.58534: Flags [P.], seq 1669684:1669864, ack 973, win 501, length 180
17:16:04.130187 IP lamponubuntu2004-s-1vcpu-1gb-tor1-01.ssh > 50.101.85.188.58534: Flags [P.], seq 1669864:1670044, ack 973, win 501, length 180
17:16:04.130318 IP lamponubuntu2004-s-1vcpu-1gb-tor1-01.ssh > 50.101.85.188.58534: Flags [P.], seq 1670044:1670224, ack 973, win 501, length 180
17:16:04.130447 IP lamponubuntu2004-s-1vcpu-1gb-tor1-01.ssh > 50.101.85.188.58534: Flags [P.], seq 1670224:1670404, ack 973, win 501, length 180
17:16:04.130580 IP lamponubuntu2004-s-1vcpu-1gb-tor1-01.ssh > 50.101.85.188.58534: Flags [P.], seq 1670404:1670584, ack 973, win 501, length 180
17:16:04.130716 IP lamponubuntu2004-s-1vcpu-1gb-tor1-01.ssh > 50.101.85.188.58534: Flags [P.], seq 1670584:1670764, ack 973, win 501, length 180
17:16:04.130862 IP lamponubuntu2004-s-1vcpu-1gb-tor1-01.ssh > 50.101.85.188.58534: Flags [P.], seq 1670764:1670944, ack 973, win 501, length 180
17:16:04.131005 IP lamponubuntu2004-s-1vcpu-1gb-tor1-01.ssh > 50.101.85.188.58534: Flags [P.], seq 1670944:1671124, ack 973, win 501, length 180
17:16:04.131158 IP lamponubuntu2004-s-1vcpu-1gb-tor1-01.ssh > 50.101.85.188.58534: Flags [P.], seq 1671124:1671304, ack 973, win 501, length 180
17:16:04.131308 IP lamponubuntu2004-s-1vcpu-1gb-tor1-01.ssh > 50.101.85.188.58534: Flags [P.], seq 1671304:1671484, ack 973, win 501, length 180
17:16:04.131451 IP lamponubuntu2004-s-1vcpu-1gb-tor1-01.ssh > 50.101.85.188.58534: Flags [P.], seq 1671484:1671664, ack 973, win 501, length 180
17:16:04.131753 IP lamponubuntu2004-s-1vcpu-1gb-tor1-01.ssh > 50.101.85.188.58534: Flags [P.], seq 1671664:1671844, ack 973, win 501, length 180
17:16:04.131908 IP lamponubuntu2004-s-1vcpu-1gb-tor1-01.ssh > 50.101.85.188.58534: Flags [P.], seq 1671844:1672024, ack 973, win 501, length 180
17:16:04.132063 IP lamponubuntu2004-s-1vcpu-1gb-tor1-01.ssh > 50.101.85.188.58534: Flags [P.], seq 1672024:1672204, ack 973, win 501, length 180
17:16:04.132194 IP lamponubuntu2004-s-1vcpu-1gb-tor1-01.ssh > 50.101.85.188.58534: Flags [P.], seq 1672204:1672384, ack 973, win 501, length 180
17:16:04.132324 IP lamponubuntu2004-s-1vcpu-1gb-tor1-01.ssh > 50.101.85.188.58534: Flags [P.], seq 1672384:1672564, ack 973, win 501, length 180
17:16:04.132464 IP lamponubuntu2004-s-1vcpu-1gb-tor1-01.ssh > 50.101.85.188.58534: Flags [P.], seq 1672564:1672744, ack 973, win 501, length 180
17:16:04.132607 IP lamponubuntu2004-s-1vcpu-1gb-tor1-01.ssh > 50.101.85.188.58534: Flags [P.], seq 1672744:1672924, ack 973, win 501, length 180
17:16:04.132750 IP lamponubuntu2004-s-1vcpu-1gb-tor1-01.ssh > 50.101.85.188.58534: Flags [P.], seq 1672924:1673104, ack 973, win 501, length 180
17:16:04.132891 IP lamponubuntu2004-s-1vcpu-1gb-tor1-01.ssh > 50.101.85.188.58534: Flags [P.], seq 1673104:1673284, ack 973, win 501, length 180
17:16:04.133029 IP lamponubuntu2004-s-1vcpu-1gb-tor1-01.ssh > 50.101.85.188.58534: Flags [P.], seq 1673284:1673464, ack 973, win 501, length 180
17:16:04.133168 IP lamponubuntu2004-s-1vcpu-1gb-tor1-01.ssh > 50.101.85.188.58534: Flags [P.], seq 1673464:1673644, ack 973, win 501, length 180
17:16:04.133306 IP lamponubuntu2004-s-1vcpu-1gb-tor1-01.ssh > 50.101.85.188.58534: Flags [P.], seq 1673644:1673824, ack 973, win 501, length 180
17:16:04.133471 IP lamponubuntu2004-s-1vcpu-1gb-tor1-01.ssh > 50.101.85.188.58534: Flags [P.], seq 1673824:1674004, ack 973, win 501, length 180
17:16:04.133613 IP lamponubuntu2004-s-1vcpu-1gb-tor1-01.ssh > 50.101.85.188.58534: Flags [P.], seq 1674004:1674184, ack 973, win 501, length 180
17:16:04.133750 IP lamponubuntu2004-s-1vcpu-1gb-tor1-01.ssh > 50.101.85.188.58534: Flags [P.], seq 1674184:1674364, ack 973, win 501, length 180
17:16:04.133884 IP lamponubuntu2004-s-1vcpu-1gb-tor1-01.ssh > 50.101.85.188.58534: Flags [P.], seq 1674364:1674544, ack 973, win 501, length 180
17:16:04.134026 IP lamponubuntu2004-s-1vcpu-1gb-tor1-01.ssh > 50.101.85.188.58534: Flags [P.], seq 1674544:1674724, ack 973, win 501, length 180
17:16:04.134193 IP lamponubuntu2004-s-1vcpu-1gb-tor1-01.ssh > 50.101.85.188.58534: Flags [P.], seq 1674724:1674904, ack 973, win 501, length 180
17:16:04.134337 IP lamponubuntu2004-s-1vcpu-1gb-tor1-01.ssh > 50.101.85.188.58534: Flags [P.], seq 1674904:1675084, ack 973, win 501, length 180
17:16:04.134479 IP lamponubuntu2004-s-1vcpu-1gb-tor1-01.ssh > 50.101.85.188.58534: Flags [P.], seq 1675084:1675264, ack 973, win 501, length 180
17:16:04.134618 IP lamponubuntu2004-s-1vcpu-1gb-tor1-01.ssh > 50.101.85.188.58534: Flags [P.], seq 1675264:1675444, ack 973, win 501, length 180
17:16:04.134757 IP lamponubuntu2004-s-1vcpu-1gb-tor1-01.ssh > 50.101.85.188.58534: Flags [P.], seq 1675444:1675624, ack 973, win 501, length 180
17:16:04.134901 IP lamponubuntu2004-s-1vcpu-1gb-tor1-01.ssh > 50.101.85.188.58534: Flags [P.], seq 1675624:1675804, ack 973, win 501, length 180
17:16:04.135043 IP lamponubuntu2004-s-1vcpu-1gb-tor1-01.ssh > 50.101.85.188.58534: Flags [P.], seq 1675804:1675984, ack 973, win 501, length 180
17:16:04.135182 IP lamponubuntu2004-s-1vcpu-1gb-tor1-01.ssh > 50.101.85.188.58534: Flags [P.], seq 1675984:1676164, ack 973, win 501, length 180
17:16:04.135315 IP lamponubuntu2004-s-1vcpu-1gb-tor1-01.ssh > 50.101.85.188.58534: Flags [P.], seq 1676164:1676344, ack 973, win 501, length 180
17:16:04.135440 IP lamponubuntu2004-s-1vcpu-1gb-tor1-01.ssh > 50.101.85.188.58534: Flags [P.], seq 1676344:1676524, ack 973, win 501, length 180
17:16:04.135580 IP lamponubuntu2004-s-1vcpu-1gb-tor1-01.ssh > 50.101.85.188.58534: Flags [P.], seq 1676524:1676704, ack 973, win 501, length 180
17:16:04.135718 IP lamponubuntu2004-s-1vcpu-1gb-tor1-01.ssh > 50.101.85.188.58534: Flags [P.], seq 1676704:1676884, ack 973, win 501, length 180
17:16:04.135860 IP lamponubuntu2004-s-1vcpu-1gb-tor1-01.ssh > 50.101.85.188.58534: Flags [P.], seq 1676884:1677064, ack 973, win 501, length 180
17:16:04.136000 IP lamponubuntu2004-s-1vcpu-1gb-tor1-01.ssh > 50.101.85.188.58534: Flags [P.], seq 1677064:1677244, ack 973, win 501, length 180
17:16:04.136143 IP lamponubuntu2004-s-1vcpu-1gb-tor1-01.ssh > 50.101.85.188.58534: Flags [P.], seq 1677244:1677424, ack 973, win 501, length 180
17:16:04.136284 IP lamponubuntu2004-s-1vcpu-1gb-tor1-01.ssh > 50.101.85.188.58534: Flags [P.], seq 1677424:1677604, ack 973, win 501, length 180
17:16:04.136431 IP lamponubuntu2004-s-1vcpu-1gb-tor1-01.ssh > 50.101.85.188.58534: Flags [P.], seq 1677604:1677784, ack 973, win 501, length 180
17:16:04.136567 IP lamponubuntu2004-s-1vcpu-1gb-tor1-01.ssh > 50.101.85.188.58534: Flags [P.], seq 1677784:1677964, ack 973, win 501, length 180
17:16:04.136708 IP lamponubuntu2004-s-1vcpu-1gb-tor1-01.ssh > 50.101.85.188.58534: Flags [P.], seq 1677964:1678144, ack 973, win 501, length 180
17:16:04.136848 IP lamponubuntu2004-s-1vcpu-1gb-tor1-01.ssh > 50.101.85.188.58534: Flags [P.], seq 1678144:1678324, ack 973, win 501, length 180
17:16:04.136988 IP lamponubuntu2004-s-1vcpu-1gb-tor1-01.ssh > 50.101.85.188.58534: Flags [P.], seq 1678324:1678504, ack 973, win 501, length 180
17:16:04.137140 IP lamponubuntu2004-s-1vcpu-1gb-tor1-01.ssh > 50.101.85.188.58534: Flags [P.], seq 1678504:1678684, ack 973, win 501, length 180
17:16:04.137282 IP lamponubuntu2004-s-1vcpu-1gb-tor1-01.ssh > 50.101.85.188.58534: Flags [P.], seq 1678684:1678864, ack 973, win 501, length 180
17:16:04.137447 IP lamponubuntu2004-s-1vcpu-1gb-tor1-01.ssh > 50.101.85.188.58534: Flags [P.], seq 1678864:1679044, ack 973, win 501, length 180
17:16:04.137591 IP lamponubuntu2004-s-1vcpu-1gb-tor1-01.ssh > 50.101.85.188.58534: Flags [P.], seq 1679044:1679224, ack 973, win 501, length 180
17:16:04.137722 IP lamponubuntu2004-s-1vcpu-1gb-tor1-01.ssh > 50.101.85.188.58534: Flags [P.], seq 1679224:1679404, ack 973, win 501, length 180
17:16:04.137848 IP lamponubuntu2004-s-1vcpu-1gb-tor1-01.ssh > 50.101.85.188.58534: Flags [P.], seq 1679404:1679584, ack 973, win 501, length 180
17:16:04.137987 IP lamponubuntu2004-s-1vcpu-1gb-tor1-01.ssh > 50.101.85.188.58534: Flags [P.], seq 1679584:1679764, ack 973, win 501, length 180
17:16:04.138154 IP lamponubuntu2004-s-1vcpu-1gb-tor1-01.ssh > 50.101.85.188.58534: Flags [P.], seq 1679764:1679944, ack 973, win 501, length 180
17:16:04.138296 IP lamponubuntu2004-s-1vcpu-1gb-tor1-01.ssh > 50.101.85.188.58534: Flags [P.], seq 1679944:1680124, ack 973, win 501, length 180
17:16:04.138448 IP lamponubuntu2004-s-1vcpu-1gb-tor1-01.ssh > 50.101.85.188.58534: Flags [P.], seq 1680124:1680304, ack 973, win 501, length 180
17:16:04.138606 IP lamponubuntu2004-s-1vcpu-1gb-tor1-01.ssh > 50.101.85.188.58534: Flags [P.], seq 1680304:1680484, ack 973, win 501, length 180
17:16:04.138752 IP lamponubuntu2004-s-1vcpu-1gb-tor1-01.ssh > 50.101.85.188.58534: Flags [P.], seq 1680484:1680664, ack 973, win 501, length 180
17:16:04.138896 IP lamponubuntu2004-s-1vcpu-1gb-tor1-01.ssh > 50.101.85.188.58534: Flags [P.], seq 1680664:1680844, ack 973, win 501, length 180
17:16:04.139039 IP lamponubuntu2004-s-1vcpu-1gb-tor1-01.ssh > 50.101.85.188.58534: Flags [P.], seq 1680844:1681024, ack 973, win 501, length 180
17:16:04.139179 IP lamponubuntu2004-s-1vcpu-1gb-tor1-01.ssh > 50.101.85.188.58534: Flags [P.], seq 1681024:1681204, ack 973, win 501, length 180
17:16:04.139349 IP lamponubuntu2004-s-1vcpu-1gb-tor1-01.ssh > 50.101.85.188.58534: Flags [P.], seq 1681204:1681384, ack 973, win 501, length 180
17:16:04.139516 IP lamponubuntu2004-s-1vcpu-1gb-tor1-01.ssh > 50.101.85.188.58534: Flags [P.], seq 1681384:1681564, ack 973, win 501, length 180
17:16:04.139659 IP lamponubuntu2004-s-1vcpu-1gb-tor1-01.ssh > 50.101.85.188.58534: Flags [P.], seq 1681564:1681744, ack 973, win 501, length 180
17:16:04.139786 IP lamponubuntu2004-s-1vcpu-1gb-tor1-01.ssh > 50.101.85.188.58534: Flags [P.], seq 1681744:1681924, ack 973, win 501, length 180
17:16:04.139926 IP lamponubuntu2004-s-1vcpu-1gb-tor1-01.ssh > 50.101.85.188.58534: Flags [P.], seq 1681924:1682104, ack 973, win 501, length 180
17:16:04.140066 IP lamponubuntu2004-s-1vcpu-1gb-tor1-01.ssh > 50.101.85.188.58534: Flags [P.], seq 1682104:1682284, ack 973, win 501, length 180
17:16:04.140242 IP lamponubuntu2004-s-1vcpu-1gb-tor1-01.ssh > 50.101.85.188.58534: Flags [P.], seq 1682284:1682464, ack 973, win 501, length 180
17:16:04.140382 IP lamponubuntu2004-s-1vcpu-1gb-tor1-01.ssh > 50.101.85.188.58534: Flags [P.], seq 1682464:1682644, ack 973, win 501, length 180
17:16:04.140523 IP lamponubuntu2004-s-1vcpu-1gb-tor1-01.ssh > 50.101.85.188.58534: Flags [P.], seq 1682644:1682824, ack 973, win 501, length 180
17:16:04.140670 IP lamponubuntu2004-s-1vcpu-1gb-tor1-01.ssh > 50.101.85.188.58534: Flags [P.], seq 1682824:1683004, ack 973, win 501, length 180
17:16:04.140820 IP lamponubuntu2004-s-1vcpu-1gb-tor1-01.ssh > 50.101.85.188.58534: Flags [P.], seq 1683004:1683184, ack 973, win 501, length 180
17:16:04.141323 IP lamponubuntu2004-s-1vcpu-1gb-tor1-01.ssh > 50.101.85.188.58534: Flags [P.], seq 1683184:1683364, ack 973, win 501, length 180
17:16:04.141491 IP lamponubuntu2004-s-1vcpu-1gb-tor1-01.ssh > 50.101.85.188.58534: Flags [P.], seq 1683364:1683544, ack 973, win 501, length 180
17:16:04.141634 IP lamponubuntu2004-s-1vcpu-1gb-tor1-01.ssh > 50.101.85.188.58534: Flags [P.], seq 1683544:1683724, ack 973, win 501, length 180
17:16:04.141776 IP lamponubuntu2004-s-1vcpu-1gb-tor1-01.ssh > 50.101.85.188.58534: Flags [P.], seq 1683724:1683904, ack 973, win 501, length 180
17:16:04.141918 IP lamponubuntu2004-s-1vcpu-1gb-tor1-01.ssh > 50.101.85.188.58534: Flags [P.], seq 1683904:1684084, ack 973, win 501, length 180
17:16:04.142056 IP lamponubuntu2004-s-1vcpu-1gb-tor1-01.ssh > 50.101.85.188.58534: Flags [P.], seq 1684084:1684264, ack 973, win 501, length 180
17:16:04.142225 IP lamponubuntu2004-s-1vcpu-1gb-tor1-01.ssh > 50.101.85.188.58534: Flags [P.], seq 1684264:1684444, ack 973, win 501, length 180
17:16:04.142380 IP lamponubuntu2004-s-1vcpu-1gb-tor1-01.ssh > 50.101.85.188.58534: Flags [P.], seq 1684444:1684624, ack 973, win 501, length 180
17:16:04.142521 IP lamponubuntu2004-s-1vcpu-1gb-tor1-01.ssh > 50.101.85.188.58534: Flags [P.], seq 1684624:1684804, ack 973, win 501, length 180
17:16:04.142662 IP lamponubuntu2004-s-1vcpu-1gb-tor1-01.ssh > 50.101.85.188.58534: Flags [P.], seq 1684804:1684984, ack 973, win 501, length 180
17:16:04.142827 IP lamponubuntu2004-s-1vcpu-1gb-tor1-01.ssh > 50.101.85.188.58534: Flags [P.], seq 1684984:1685164, ack 973, win 501, length 180
17:16:04.143040 IP lamponubuntu2004-s-1vcpu-1gb-tor1-01.ssh > 50.101.85.188.58534: Flags [P.], seq 1685164:1685344, ack 973, win 501, length 180
17:16:04.143186 IP lamponubuntu2004-s-1vcpu-1gb-tor1-01.ssh > 50.101.85.188.58534: Flags [P.], seq 1685344:1685524, ack 973, win 501, length 180
17:16:04.143361 IP lamponubuntu2004-s-1vcpu-1gb-tor1-01.ssh > 50.101.85.188.58534: Flags [P.], seq 1685524:1685704, ack 973, win 501, length 180
17:16:04.143546 IP lamponubuntu2004-s-1vcpu-1gb-tor1-01.ssh > 50.101.85.188.58534: Flags [P.], seq 1685704:1685884, ack 973, win 501, length 180
17:16:04.143698 IP lamponubuntu2004-s-1vcpu-1gb-tor1-01.ssh > 50.101.85.188.58534: Flags [P.], seq 1685884:1686064, ack 973, win 501, length 180
17:16:04.143847 IP lamponubuntu2004-s-1vcpu-1gb-tor1-01.ssh > 50.101.85.188.58534: Flags [P.], seq 1686064:1686244, ack 973, win 501, length 180
17:16:04.143988 IP lamponubuntu2004-s-1vcpu-1gb-tor1-01.ssh > 50.101.85.188.58534: Flags [P.], seq 1686244:1686424, ack 973, win 501, length 180
17:16:04.144139 IP lamponubuntu2004-s-1vcpu-1gb-tor1-01.ssh > 50.101.85.188.58534: Flags [P.], seq 1686424:1686604, ack 973, win 501, length 180
17:16:04.144288 IP lamponubuntu2004-s-1vcpu-1gb-tor1-01.ssh > 50.101.85.188.58534: Flags [P.], seq 1686604:1686784, ack 973, win 501, length 180
17:16:04.144436 IP lamponubuntu2004-s-1vcpu-1gb-tor1-01.ssh > 50.101.85.188.58534: Flags [P.], seq 1686784:1686964, ack 973, win 501, length 180
17:16:04.144581 IP lamponubuntu2004-s-1vcpu-1gb-tor1-01.ssh > 50.101.85.188.58534: Flags [P.], seq 1686964:1687144, ack 973, win 501, length 180
17:16:04.144718 IP lamponubuntu2004-s-1vcpu-1gb-tor1-01.ssh > 50.101.85.188.58534: Flags [P.], seq 1687144:1687324, ack 973, win 501, length 180
17:16:04.162155 IP lamponubuntu2004-s-1vcpu-1gb-tor1-01.ssh > 50.101.85.188.58534: Flags [P.], seq 1687324:1687504, ack 973, win 501, length 180
17:16:04.243062 IP 50.101.85.188.58534 > lamponubuntu2004-s-1vcpu-1gb-tor1-01.ssh: Flags [.], ack 1639900, win 516, length 0
17:16:04.243063 IP 50.101.85.188.58534 > lamponubuntu2004-s-1vcpu-1gb-tor1-01.ssh: Flags [.], ack 1641160, win 511, length 0
17:16:04.243063 IP 50.101.85.188.58534 > lamponubuntu2004-s-1vcpu-1gb-tor1-01.ssh: Flags [P.], seq 973:1009, ack 1641160, win 511, length 36
17:16:04.243189 IP lamponubuntu2004-s-1vcpu-1gb-tor1-01.ssh > 50.101.85.188.58534: Flags [P.], seq 1687504:1687684, ack 973, win 501, length 180
^C
9966 packets captured
9967 packets received by filter
0 packets dropped by kernel