1513, win 501, length 188
17:15:24.126630 IP lamponubuntu2004-s-1vcpu-1gb-tor1-01.ssh > 50.101.85.188.58534: Flags [P.], seq 2487244:2487432, ack 1513, win 501, length 188
17:15:24.126762 IP lamponubuntu2004-s-1vcpu-1gb-tor1-01.ssh > 50.101.85.188.58534: Flags [P.], seq 2487432:2487620, ack 1513, win 501, length 188
17:15:24.126868 IP lamponubuntu2004-s-1vcpu-1gb-tor1-01.ssh > 50.101.85.188.58534: Flags [P.], seq 2487620:2487808, ack 1513, win 501, length 188
17:15:24.126959 IP 50.101.85.188.58534 > lamponubuntu2004-s-1vcpu-1gb-tor1-01.ssh: Flags [.], ack 2483288, win 511, length 0
17:15:24.127041 IP lamponubuntu2004-s-1vcpu-1gb-tor1-01.ssh > 50.101.85.188.58534: Flags [P.], seq 2487808:2487996, ack 1513, win 501, length 188
17:15:24.127141 IP lamponubuntu2004-s-1vcpu-1gb-tor1-01.ssh > 50.101.85.188.58534: Flags [P.], seq 2487996:2488160, ack 1513, win 501, length 164
17:15:24.127235 IP lamponubuntu2004-s-1vcpu-1gb-tor1-01.ssh > 50.101.85.188.58534: Flags [P.], seq 2488160:2488348, ack 1513, win 501, length 188
17:15:24.127329 IP lamponubuntu2004-s-1vcpu-1gb-tor1-01.ssh > 50.101.85.188.58534: Flags [P.], seq 2488348:2488724, ack 1513, win 501, length 376
17:15:24.127451 IP lamponubuntu2004-s-1vcpu-1gb-tor1-01.ssh > 50.101.85.188.58534: Flags [P.], seq 2488724:2488912, ack 1513, win 501, length 188
17:15:24.127606 IP lamponubuntu2004-s-1vcpu-1gb-tor1-01.ssh > 50.101.85.188.58534: Flags [P.], seq 2488912:2489100, ack 1513, win 501, length 188
17:15:24.127722 IP lamponubuntu2004-s-1vcpu-1gb-tor1-01.ssh > 50.101.85.188.58534: Flags [P.], seq 2489100:2489288, ack 1513, win 501, length 188
17:15:24.127837 IP lamponubuntu2004-s-1vcpu-1gb-tor1-01.ssh > 50.101.85.188.58534: Flags [P.], seq 2489288:2489476, ack 1513, win 501, length 188
17:15:24.127956 IP lamponubuntu2004-s-1vcpu-1gb-tor1-01.ssh > 50.101.85.188.58534: Flags [P.], seq 2489476:2489664, ack 1513, win 501, length 188
17:15:24.128059 IP lamponubuntu2004-s-1vcpu-1gb-tor1-01.ssh > 50.101.85.188.58534: Flags [P.], seq 2489664:2489852, ack 1513, win 501, length 188
17:15:24.128155 IP lamponubuntu2004-s-1vcpu-1gb-tor1-01.ssh > 50.101.85.188.58534: Flags [P.], seq 2489852:2490040, ack 1513, win 501, length 188
17:15:24.128253 IP lamponubuntu2004-s-1vcpu-1gb-tor1-01.ssh > 50.101.85.188.58534: Flags [P.], seq 2490040:2490228, ack 1513, win 501, length 188
17:15:24.128365 IP lamponubuntu2004-s-1vcpu-1gb-tor1-01.ssh > 50.101.85.188.58534: Flags [P.], seq 2490228:2490416, ack 1513, win 501, length 188
17:15:24.128461 IP lamponubuntu2004-s-1vcpu-1gb-tor1-01.ssh > 50.101.85.188.58534: Flags [P.], seq 2490416:2490604, ack 1513, win 501, length 188
17:15:24.128617 IP lamponubuntu2004-s-1vcpu-1gb-tor1-01.ssh > 50.101.85.188.58534: Flags [P.], seq 2490604:2490792, ack 1513, win 501, length 188
17:15:24.128736 IP lamponubuntu2004-s-1vcpu-1gb-tor1-01.ssh > 50.101.85.188.58534: Flags [P.], seq 2490792:2490980, ack 1513, win 501, length 188
17:15:24.128836 IP lamponubuntu2004-s-1vcpu-1gb-tor1-01.ssh > 50.101.85.188.58534: Flags [P.], seq 2490980:2491168, ack 1513, win 501, length 188
17:15:24.128952 IP lamponubuntu2004-s-1vcpu-1gb-tor1-01.ssh > 50.101.85.188.58534: Flags [P.], seq 2491168:2491356, ack 1513, win 501, length 188
17:15:24.128975 IP 50.101.85.188.58534 > lamponubuntu2004-s-1vcpu-1gb-tor1-01.ssh: Flags [.], ack 2484432, win 516, length 0
17:15:24.128975 IP 50.101.85.188.58534 > lamponubuntu2004-s-1vcpu-1gb-tor1-01.ssh: Flags [.], ack 2484808, win 514, length 0
17:15:24.128975 IP 50.101.85.188.58534 > lamponubuntu2004-s-1vcpu-1gb-tor1-01.ssh: Flags [.], ack 2485184, win 513, length 0
17:15:24.128975 IP 50.101.85.188.58534 > lamponubuntu2004-s-1vcpu-1gb-tor1-01.ssh: Flags [.], ack 2485680, win 511, length 0
17:15:24.129140 IP lamponubuntu2004-s-1vcpu-1gb-tor1-01.ssh > 50.101.85.188.58534: Flags [P.], seq 2491356:2492048, ack 1513, win 501, length 692
17:15:24.129240 IP lamponubuntu2004-s-1vcpu-1gb-tor1-01.ssh > 50.101.85.188.58534: Flags [P.], seq 2492048:2492236, ack 1513, win 501, length 188
17:15:24.129381 IP lamponubuntu2004-s-1vcpu-1gb-tor1-01.ssh > 50.101.85.188.58534: Flags [P.], seq 2492236:2492424, ack 1513, win 501, length 188
17:15:24.129537 IP lamponubuntu2004-s-1vcpu-1gb-tor1-01.ssh > 50.101.85.188.58534: Flags [P.], seq 2492424:2492612, ack 1513, win 501, length 188
17:15:24.129799 IP lamponubuntu2004-s-1vcpu-1gb-tor1-01.ssh > 50.101.85.188.58534: Flags [P.], seq 2492612:2492800, ack 1513, win 501, length 188
17:15:24.129914 IP lamponubuntu2004-s-1vcpu-1gb-tor1-01.ssh > 50.101.85.188.58534: Flags [P.], seq 2492800:2492988, ack 1513, win 501, length 188
17:15:24.129953 IP 50.101.85.188.58534 > lamponubuntu2004-s-1vcpu-1gb-tor1-01.ssh: Flags [.], ack 2486056, win 516, length 0
17:15:24.129953 IP 50.101.85.188.58534 > lamponubuntu2004-s-1vcpu-1gb-tor1-01.ssh: Flags [.], ack 2487244, win 511, length 0
17:15:24.130106 IP lamponubuntu2004-s-1vcpu-1gb-tor1-01.ssh > 50.101.85.188.58534: Flags [P.], seq 2492988:2493424, ack 1513, win 501, length 436
17:15:24.130228 IP lamponubuntu2004-s-1vcpu-1gb-tor1-01.ssh > 50.101.85.188.58534: Flags [P.], seq 2493424:2493612, ack 1513, win 501, length 188
17:15:24.130326 IP lamponubuntu2004-s-1vcpu-1gb-tor1-01.ssh > 50.101.85.188.58534: Flags [P.], seq 2493612:2493800, ack 1513, win 501, length 188
17:15:24.130422 IP lamponubuntu2004-s-1vcpu-1gb-tor1-01.ssh > 50.101.85.188.58534: Flags [P.], seq 2493800:2493988, ack 1513, win 501, length 188
17:15:24.130523 IP lamponubuntu2004-s-1vcpu-1gb-tor1-01.ssh > 50.101.85.188.58534: Flags [P.], seq 2493988:2494176, ack 1513, win 501, length 188
17:15:24.130707 IP lamponubuntu2004-s-1vcpu-1gb-tor1-01.ssh > 50.101.85.188.58534: Flags [P.], seq 2494176:2494364, ack 1513, win 501, length 188
17:15:24.130857 IP lamponubuntu2004-s-1vcpu-1gb-tor1-01.ssh > 50.101.85.188.58534: Flags [P.], seq 2494364:2494552, ack 1513, win 501, length 188
17:15:24.130971 IP 50.101.85.188.58534 > lamponubuntu2004-s-1vcpu-1gb-tor1-01.ssh: Flags [.], ack 2487808, win 516, length 0
17:15:24.130971 IP 50.101.85.188.58534 > lamponubuntu2004-s-1vcpu-1gb-tor1-01.ssh: Flags [.], ack 2488724, win 512, length 0
17:15:24.130972 IP 50.101.85.188.58534 > lamponubuntu2004-s-1vcpu-1gb-tor1-01.ssh: Flags [.], ack 2490228, win 516, length 0
17:15:24.131102 IP lamponubuntu2004-s-1vcpu-1gb-tor1-01.ssh > 50.101.85.188.58534: Flags [P.], seq 2494552:2495116, ack 1513, win 501, length 564
17:15:24.131252 IP lamponubuntu2004-s-1vcpu-1gb-tor1-01.ssh > 50.101.85.188.58534: Flags [P.], seq 2495116:2495304, ack 1513, win 501, length 188
17:15:24.131386 IP lamponubuntu2004-s-1vcpu-1gb-tor1-01.ssh > 50.101.85.188.58534: Flags [P.], seq 2495304:2495492, ack 1513, win 501, length 188
17:15:24.131517 IP lamponubuntu2004-s-1vcpu-1gb-tor1-01.ssh > 50.101.85.188.58534: Flags [P.], seq 2495492:2495680, ack 1513, win 501, length 188
17:15:24.131648 IP lamponubuntu2004-s-1vcpu-1gb-tor1-01.ssh > 50.101.85.188.58534: Flags [P.], seq 2495680:2495868, ack 1513, win 501, length 188
17:15:24.131778 IP lamponubuntu2004-s-1vcpu-1gb-tor1-01.ssh > 50.101.85.188.58534: Flags [P.], seq 2495868:2496056, ack 1513, win 501, length 188
17:15:24.131908 IP lamponubuntu2004-s-1vcpu-1gb-tor1-01.ssh > 50.101.85.188.58534: Flags [P.], seq 2496056:2496244, ack 1513, win 501, length 188
17:15:24.132015 IP 50.101.85.188.58534 > lamponubuntu2004-s-1vcpu-1gb-tor1-01.ssh: Flags [.], ack 2490792, win 513, length 0
17:15:24.132015 IP 50.101.85.188.58534 > lamponubuntu2004-s-1vcpu-1gb-tor1-01.ssh: Flags [.], ack 2491356, win 511, length 0
17:15:24.132134 IP lamponubuntu2004-s-1vcpu-1gb-tor1-01.ssh > 50.101.85.188.58534: Flags [P.], seq 2496244:2496680, ack 1513, win 501, length 436
17:15:24.132271 IP lamponubuntu2004-s-1vcpu-1gb-tor1-01.ssh > 50.101.85.188.58534: Flags [P.], seq 2496680:2496868, ack 1513, win 501, length 188
17:15:24.132402 IP lamponubuntu2004-s-1vcpu-1gb-tor1-01.ssh > 50.101.85.188.58534: Flags [P.], seq 2496868:2497056, ack 1513, win 501, length 188
17:15:24.132548 IP lamponubuntu2004-s-1vcpu-1gb-tor1-01.ssh > 50.101.85.188.58534: Flags [P.], seq 2497056:2497244, ack 1513, win 501, length 188
17:15:24.132711 IP lamponubuntu2004-s-1vcpu-1gb-tor1-01.ssh > 50.101.85.188.58534: Flags [P.], seq 2497244:2497432, ack 1513, win 501, length 188
17:15:24.132873 IP lamponubuntu2004-s-1vcpu-1gb-tor1-01.ssh > 50.101.85.188.58534: Flags [P.], seq 2497432:2497620, ack 1513, win 501, length 188
17:15:24.132979 IP 50.101.85.188.58534 > lamponubuntu2004-s-1vcpu-1gb-tor1-01.ssh: Flags [.], ack 2492988, win 516, length 0
17:15:24.133053 IP lamponubuntu2004-s-1vcpu-1gb-tor1-01.ssh > 50.101.85.188.58534: Flags [P.], seq 2497620:2497808, ack 1513, win 501, length 188
17:15:24.133153 IP lamponubuntu2004-s-1vcpu-1gb-tor1-01.ssh > 50.101.85.188.58534: Flags [P.], seq 2497808:2498116, ack 1513, win 501, length 308
17:15:24.133248 IP lamponubuntu2004-s-1vcpu-1gb-tor1-01.ssh > 50.101.85.188.58534: Flags [P.], seq 2498116:2498304, ack 1513, win 501, length 188
17:15:24.133372 IP lamponubuntu2004-s-1vcpu-1gb-tor1-01.ssh > 50.101.85.188.58534: Flags [P.], seq 2498304:2498492, ack 1513, win 501, length 188
17:15:24.133472 IP lamponubuntu2004-s-1vcpu-1gb-tor1-01.ssh > 50.101.85.188.58534: Flags [P.], seq 2498492:2498680, ack 1513, win 501, length 188
17:15:24.133566 IP lamponubuntu2004-s-1vcpu-1gb-tor1-01.ssh > 50.101.85.188.58534: Flags [P.], seq 2498680:2498868, ack 1513, win 501, length 188
17:15:24.133664 IP lamponubuntu2004-s-1vcpu-1gb-tor1-01.ssh > 50.101.85.188.58534: Flags [P.], seq 2498868:2499056, ack 1513, win 501, length 188
17:15:24.133759 IP lamponubuntu2004-s-1vcpu-1gb-tor1-01.ssh > 50.101.85.188.58534: Flags [P.], seq 2499056:2499244, ack 1513, win 501, length 188
17:15:24.133853 IP lamponubuntu2004-s-1vcpu-1gb-tor1-01.ssh > 50.101.85.188.58534: Flags [P.], seq 2499244:2499432, ack 1513, win 501, length 188
17:15:24.133959 IP 50.101.85.188.58534 > lamponubuntu2004-s-1vcpu-1gb-tor1-01.ssh: Flags [.], ack 2494552, win 516, length 0
17:15:24.133959 IP 50.101.85.188.58534 > lamponubuntu2004-s-1vcpu-1gb-tor1-01.ssh: Flags [.], ack 2495492, win 512, length 0
17:15:24.133981 IP lamponubuntu2004-s-1vcpu-1gb-tor1-01.ssh > 50.101.85.188.58534: Flags [P.], seq 2499432:2499620, ack 1513, win 501, length 188
17:15:24.134164 IP lamponubuntu2004-s-1vcpu-1gb-tor1-01.ssh > 50.101.85.188.58534: Flags [P.], seq 2499620:2500056, ack 1513, win 501, length 436
17:15:24.134323 IP lamponubuntu2004-s-1vcpu-1gb-tor1-01.ssh > 50.101.85.188.58534: Flags [P.], seq 2500056:2500244, ack 1513, win 501, length 188
17:15:24.134477 IP lamponubuntu2004-s-1vcpu-1gb-tor1-01.ssh > 50.101.85.188.58534: Flags [P.], seq 2500244:2500432, ack 1513, win 501, length 188
17:15:24.134624 IP lamponubuntu2004-s-1vcpu-1gb-tor1-01.ssh > 50.101.85.188.58534: Flags [P.], seq 2500432:2500620, ack 1513, win 501, length 188
17:15:24.134769 IP lamponubuntu2004-s-1vcpu-1gb-tor1-01.ssh > 50.101.85.188.58534: Flags [P.], seq 2500620:2500808, ack 1513, win 501, length 188
17:15:24.134885 IP lamponubuntu2004-s-1vcpu-1gb-tor1-01.ssh > 50.101.85.188.58534: Flags [P.], seq 2500808:2500996, ack 1513, win 501, length 188
17:15:24.134986 IP lamponubuntu2004-s-1vcpu-1gb-tor1-01.ssh > 50.101.85.188.58534: Flags [P.], seq 2500996:2501184, ack 1513, win 501, length 188
17:15:24.135082 IP lamponubuntu2004-s-1vcpu-1gb-tor1-01.ssh > 50.101.85.188.58534: Flags [P.], seq 2501184:2501372, ack 1513, win 501, length 188
17:15:24.135208 IP lamponubuntu2004-s-1vcpu-1gb-tor1-01.ssh > 50.101.85.188.58534: Flags [P.], seq 2501372:2501560, ack 1513, win 501, length 188
17:15:24.135359 IP lamponubuntu2004-s-1vcpu-1gb-tor1-01.ssh > 50.101.85.188.58534: Flags [P.], seq 2501560:2501748, ack 1513, win 501, length 188
17:15:24.135513 IP lamponubuntu2004-s-1vcpu-1gb-tor1-01.ssh > 50.101.85.188.58534: Flags [P.], seq 2501748:2501936, ack 1513, win 501, length 188
17:15:24.135647 IP lamponubuntu2004-s-1vcpu-1gb-tor1-01.ssh > 50.101.85.188.58534: Flags [P.], seq 2501936:2502124, ack 1513, win 501, length 188
17:15:24.135809 IP lamponubuntu2004-s-1vcpu-1gb-tor1-01.ssh > 50.101.85.188.58534: Flags [P.], seq 2502124:2502312, ack 1513, win 501, length 188
17:15:24.135946 IP 50.101.85.188.58534 > lamponubuntu2004-s-1vcpu-1gb-tor1-01.ssh: Flags [.], ack 2496244, win 516, length 0
17:15:24.135946 IP 50.101.85.188.58534 > lamponubuntu2004-s-1vcpu-1gb-tor1-01.ssh: Flags [.], ack 2497620, win 510, length 0
17:15:24.136145 IP lamponubuntu2004-s-1vcpu-1gb-tor1-01.ssh > 50.101.85.188.58534: Flags [P.], seq 2502312:2502748, ack 1513, win 501, length 436
17:15:24.136324 IP lamponubuntu2004-s-1vcpu-1gb-tor1-01.ssh > 50.101.85.188.58534: Flags [P.], seq 2502748:2502936, ack 1513, win 501, length 188
17:15:24.136438 IP lamponubuntu2004-s-1vcpu-1gb-tor1-01.ssh > 50.101.85.188.58534: Flags [P.], seq 2502936:2503124, ack 1513, win 501, length 188
17:15:24.136589 IP lamponubuntu2004-s-1vcpu-1gb-tor1-01.ssh > 50.101.85.188.58534: Flags [P.], seq 2503124:2503312, ack 1513, win 501, length 188
17:15:24.136771 IP lamponubuntu2004-s-1vcpu-1gb-tor1-01.ssh > 50.101.85.188.58534: Flags [P.], seq 2503312:2503500, ack 1513, win 501, length 188
17:15:24.136909 IP lamponubuntu2004-s-1vcpu-1gb-tor1-01.ssh > 50.101.85.188.58534: Flags [P.], seq 2503500:2503688, ack 1513, win 501, length 188
17:15:24.136957 IP 50.101.85.188.58534 > lamponubuntu2004-s-1vcpu-1gb-tor1-01.ssh: Flags [.], ack 2498304, win 516, length 0
17:15:24.136957 IP 50.101.85.188.58534 > lamponubuntu2004-s-1vcpu-1gb-tor1-01.ssh: Flags [.], ack 2499620, win 511, length 0
17:15:24.137110 IP lamponubuntu2004-s-1vcpu-1gb-tor1-01.ssh > 50.101.85.188.58534: Flags [P.], seq 2503688:2504124, ack 1513, win 501, length 436
17:15:24.137257 IP lamponubuntu2004-s-1vcpu-1gb-tor1-01.ssh > 50.101.85.188.58534: Flags [P.], seq 2504124:2504312, ack 1513, win 501, length 188
17:15:24.137414 IP lamponubuntu2004-s-1vcpu-1gb-tor1-01.ssh > 50.101.85.188.58534: Flags [P.], seq 2504312:2504500, ack 1513, win 501, length 188
17:15:24.137560 IP lamponubuntu2004-s-1vcpu-1gb-tor1-01.ssh > 50.101.85.188.58534: Flags [P.], seq 2504500:2504688, ack 1513, win 501, length 188
17:15:24.137691 IP lamponubuntu2004-s-1vcpu-1gb-tor1-01.ssh > 50.101.85.188.58534: Flags [P.], seq 2504688:2504876, ack 1513, win 501, length 188
17:15:24.137841 IP lamponubuntu2004-s-1vcpu-1gb-tor1-01.ssh > 50.101.85.188.58534: Flags [P.], seq 2504876:2505064, ack 1513, win 501, length 188
17:15:24.137982 IP 50.101.85.188.58534 > lamponubuntu2004-s-1vcpu-1gb-tor1-01.ssh: Flags [.], ack 2500244, win 516, length 0
17:15:24.137982 IP 50.101.85.188.58534 > lamponubuntu2004-s-1vcpu-1gb-tor1-01.ssh: Flags [.], ack 2501560, win 511, length 0
17:15:24.138126 IP lamponubuntu2004-s-1vcpu-1gb-tor1-01.ssh > 50.101.85.188.58534: Flags [P.], seq 2505064:2505500, ack 1513, win 501, length 436
17:15:24.138233 IP lamponubuntu2004-s-1vcpu-1gb-tor1-01.ssh > 50.101.85.188.58534: Flags [P.], seq 2505500:2505688, ack 1513, win 501, length 188
17:15:24.138338 IP lamponubuntu2004-s-1vcpu-1gb-tor1-01.ssh > 50.101.85.188.58534: Flags [P.], seq 2505688:2505876, ack 1513, win 501, length 188
17:15:24.138453 IP lamponubuntu2004-s-1vcpu-1gb-tor1-01.ssh > 50.101.85.188.58534: Flags [P.], seq 2505876:2506064, ack 1513, win 501, length 188
17:15:24.138574 IP lamponubuntu2004-s-1vcpu-1gb-tor1-01.ssh > 50.101.85.188.58534: Flags [P.], seq 2506064:2506252, ack 1513, win 501, length 188
17:15:24.138725 IP lamponubuntu2004-s-1vcpu-1gb-tor1-01.ssh > 50.101.85.188.58534: Flags [P.], seq 2506252:2506440, ack 1513, win 501, length 188
17:15:24.138836 IP lamponubuntu2004-s-1vcpu-1gb-tor1-01.ssh > 50.101.85.188.58534: Flags [P.], seq 2506440:2506628, ack 1513, win 501, length 188
17:15:24.138942 IP 50.101.85.188.58534 > lamponubuntu2004-s-1vcpu-1gb-tor1-01.ssh: Flags [.], ack 2501936, win 516, length 0
17:15:24.138942 IP 50.101.85.188.58534 > lamponubuntu2004-s-1vcpu-1gb-tor1-01.ssh: Flags [.], ack 2502936, win 512, length 0
17:15:24.138962 IP lamponubuntu2004-s-1vcpu-1gb-tor1-01.ssh > 50.101.85.188.58534: Flags [P.], seq 2506628:2506816, ack 1513, win 501, length 188
17:15:24.139100 IP lamponubuntu2004-s-1vcpu-1gb-tor1-01.ssh > 50.101.85.188.58534: Flags [P.], seq 2506816:2507252, ack 1513, win 501, length 436
17:15:24.139201 IP lamponubuntu2004-s-1vcpu-1gb-tor1-01.ssh > 50.101.85.188.58534: Flags [P.], seq 2507252:2507440, ack 1513, win 501, length 188
17:15:24.139297 IP lamponubuntu2004-s-1vcpu-1gb-tor1-01.ssh > 50.101.85.188.58534: Flags [P.], seq 2507440:2507628, ack 1513, win 501, length 188
17:15:24.139391 IP lamponubuntu2004-s-1vcpu-1gb-tor1-01.ssh > 50.101.85.188.58534: Flags [P.], seq 2507628:2507816, ack 1513, win 501, length 188
17:15:24.139486 IP lamponubuntu2004-s-1vcpu-1gb-tor1-01.ssh > 50.101.85.188.58534: Flags [P.], seq 2507816:2508004, ack 1513, win 501, length 188
17:15:24.139602 IP lamponubuntu2004-s-1vcpu-1gb-tor1-01.ssh > 50.101.85.188.58534: Flags [P.], seq 2508004:2508192, ack 1513, win 501, length 188
17:15:24.139705 IP lamponubuntu2004-s-1vcpu-1gb-tor1-01.ssh > 50.101.85.188.58534: Flags [P.], seq 2508192:2508380, ack 1513, win 501, length 188
17:15:24.139800 IP lamponubuntu2004-s-1vcpu-1gb-tor1-01.ssh > 50.101.85.188.58534: Flags [P.], seq 2508380:2508568, ack 1513, win 501, length 188
17:15:24.139898 IP lamponubuntu2004-s-1vcpu-1gb-tor1-01.ssh > 50.101.85.188.58534: Flags [P.], seq 2508568:2508756, ack 1513, win 501, length 188
17:15:24.139930 IP 50.101.85.188.58534 > lamponubuntu2004-s-1vcpu-1gb-tor1-01.ssh: Flags [.], ack 2503312, win 510, length 0
17:15:24.139930 IP 50.101.85.188.58534 > lamponubuntu2004-s-1vcpu-1gb-tor1-01.ssh: Flags [.], ack 2504688, win 516, length 0
17:15:24.140443 IP lamponubuntu2004-s-1vcpu-1gb-tor1-01.ssh > 50.101.85.188.58534: Flags [P.], seq 2508756:2509192, ack 1513, win 501, length 436
17:15:24.140585 IP lamponubuntu2004-s-1vcpu-1gb-tor1-01.ssh > 50.101.85.188.58534: Flags [P.], seq 2509192:2509380, ack 1513, win 501, length 188
17:15:24.140705 IP lamponubuntu2004-s-1vcpu-1gb-tor1-01.ssh > 50.101.85.188.58534: Flags [P.], seq 2509380:2509568, ack 1513, win 501, length 188
17:15:24.140819 IP lamponubuntu2004-s-1vcpu-1gb-tor1-01.ssh > 50.101.85.188.58534: Flags [P.], seq 2509568:2509756, ack 1513, win 501, length 188
17:15:24.140926 IP 50.101.85.188.58534 > lamponubuntu2004-s-1vcpu-1gb-tor1-01.ssh: Flags [.], ack 2505064, win 514, length 0
17:15:24.140961 IP lamponubuntu2004-s-1vcpu-1gb-tor1-01.ssh > 50.101.85.188.58534: Flags [P.], seq 2509756:2509944, ack 1513, win 501, length 188
17:15:24.141085 IP lamponubuntu2004-s-1vcpu-1gb-tor1-01.ssh > 50.101.85.188.58534: Flags [P.], seq 2509944:2510252, ack 1513, win 501, length 308
17:15:24.141211 IP lamponubuntu2004-s-1vcpu-1gb-tor1-01.ssh > 50.101.85.188.58534: Flags [P.], seq 2510252:2510440, ack 1513, win 501, length 188
17:15:24.141343 IP lamponubuntu2004-s-1vcpu-1gb-tor1-01.ssh > 50.101.85.188.58534: Flags [P.], seq 2510440:2510628, ack 1513, win 501, length 188
17:15:24.141464 IP lamponubuntu2004-s-1vcpu-1gb-tor1-01.ssh > 50.101.85.188.58534: Flags [P.], seq 2510628:2510816, ack 1513, win 501, length 188
17:15:24.141623 IP lamponubuntu2004-s-1vcpu-1gb-tor1-01.ssh > 50.101.85.188.58534: Flags [P.], seq 2510816:2511004, ack 1513, win 501, length 188
17:15:24.141742 IP lamponubuntu2004-s-1vcpu-1gb-tor1-01.ssh > 50.101.85.188.58534: Flags [P.], seq 2511004:2511192, ack 1513, win 501, length 188
17:15:24.141849 IP lamponubuntu2004-s-1vcpu-1gb-tor1-01.ssh > 50.101.85.188.58534: Flags [P.], seq 2511192:2511380, ack 1513, win 501, length 188
17:15:24.141966 IP 50.101.85.188.58534 > lamponubuntu2004-s-1vcpu-1gb-tor1-01.ssh: Flags [.], ack 2506440, win 516, length 0
17:15:24.141966 IP 50.101.85.188.58534 > lamponubuntu2004-s-1vcpu-1gb-tor1-01.ssh: Flags [.], ack 2508004, win 516, length 0
17:15:24.141985 IP lamponubuntu2004-s-1vcpu-1gb-tor1-01.ssh > 50.101.85.188.58534: Flags [P.], seq 2511380:2511568, ack 1513, win 501, length 188
17:15:24.142247 IP lamponubuntu2004-s-1vcpu-1gb-tor1-01.ssh > 50.101.85.188.58534: Flags [P.], seq 2511568:2512004, ack 1513, win 501, length 436
17:15:24.142366 IP lamponubuntu2004-s-1vcpu-1gb-tor1-01.ssh > 50.101.85.188.58534: Flags [P.], seq 2512004:2512192, ack 1513, win 501, length 188
17:15:24.142473 IP lamponubuntu2004-s-1vcpu-1gb-tor1-01.ssh > 50.101.85.188.58534: Flags [P.], seq 2512192:2512380, ack 1513, win 501, length 188
17:15:24.142606 IP lamponubuntu2004-s-1vcpu-1gb-tor1-01.ssh > 50.101.85.188.58534: Flags [P.], seq 2512380:2512568, ack 1513, win 501, length 188
17:15:24.142728 IP lamponubuntu2004-s-1vcpu-1gb-tor1-01.ssh > 50.101.85.188.58534: Flags [P.], seq 2512568:2512756, ack 1513, win 501, length 188
17:15:24.142830 IP lamponubuntu2004-s-1vcpu-1gb-tor1-01.ssh > 50.101.85.188.58534: Flags [P.], seq 2512756:2512944, ack 1513, win 501, length 188
17:15:24.142930 IP lamponubuntu2004-s-1vcpu-1gb-tor1-01.ssh > 50.101.85.188.58534: Flags [P.], seq 2512944:2513132, ack 1513, win 501, length 188
17:15:24.142959 IP 50.101.85.188.58534 > lamponubuntu2004-s-1vcpu-1gb-tor1-01.ssh: Flags [.], ack 2508380, win 514, length 0
17:15:24.143081 IP lamponubuntu2004-s-1vcpu-1gb-tor1-01.ssh > 50.101.85.188.58534: Flags [P.], seq 2513132:2513440, ack 1513, win 501, length 308
17:15:24.143184 IP lamponubuntu2004-s-1vcpu-1gb-tor1-01.ssh > 50.101.85.188.58534: Flags [P.], seq 2513440:2513628, ack 1513, win 501, length 188
17:15:24.143286 IP lamponubuntu2004-s-1vcpu-1gb-tor1-01.ssh > 50.101.85.188.58534: Flags [P.], seq 2513628:2513816, ack 1513, win 501, length 188
17:15:24.143383 IP lamponubuntu2004-s-1vcpu-1gb-tor1-01.ssh > 50.101.85.188.58534: Flags [P.], seq 2513816:2514004, ack 1513, win 501, length 188
17:15:24.143485 IP lamponubuntu2004-s-1vcpu-1gb-tor1-01.ssh > 50.101.85.188.58534: Flags [P.], seq 2514004:2514192, ack 1513, win 501, length 188
17:15:24.143585 IP lamponubuntu2004-s-1vcpu-1gb-tor1-01.ssh > 50.101.85.188.58534: Flags [P.], seq 2514192:2514380, ack 1513, win 501, length 188
17:15:24.143685 IP lamponubuntu2004-s-1vcpu-1gb-tor1-01.ssh > 50.101.85.188.58534: Flags [P.], seq 2514380:2514568, ack 1513, win 501, length 188
17:15:24.143784 IP lamponubuntu2004-s-1vcpu-1gb-tor1-01.ssh > 50.101.85.188.58534: Flags [P.], seq 2514568:2514756, ack 1513, win 501, length 188
17:15:24.143887 IP lamponubuntu2004-s-1vcpu-1gb-tor1-01.ssh > 50.101.85.188.58534: Flags [P.], seq 2514756:2514944, ack 1513, win 501, length 188
17:15:24.143995 IP 50.101.85.188.58534 > lamponubuntu2004-s-1vcpu-1gb-tor1-01.ssh: Flags [.], ack 2509568, win 516, length 0
17:15:24.143995 IP 50.101.85.188.58534 > lamponubuntu2004-s-1vcpu-1gb-tor1-01.ssh: Flags [.], ack 2509944, win 514, length 0
17:15:24.144104 IP lamponubuntu2004-s-1vcpu-1gb-tor1-01.ssh > 50.101.85.188.58534: Flags [P.], seq 2514944:2515380, ack 1513, win 501, length 436
17:15:24.144212 IP lamponubuntu2004-s-1vcpu-1gb-tor1-01.ssh > 50.101.85.188.58534: Flags [P.], seq 2515380:2515568, ack 1513, win 501, length 188
17:15:24.144312 IP lamponubuntu2004-s-1vcpu-1gb-tor1-01.ssh > 50.101.85.188.58534: Flags [P.], seq 2515568:2515756, ack 1513, win 501, length 188
17:15:24.144412 IP lamponubuntu2004-s-1vcpu-1gb-tor1-01.ssh > 50.101.85.188.58534: Flags [P.], seq 2515756:2515944, ack 1513, win 501, length 188
17:15:24.144525 IP lamponubuntu2004-s-1vcpu-1gb-tor1-01.ssh > 50.101.85.188.58534: Flags [P.], seq 2515944:2516132, ack 1513, win 501, length 188
17:15:24.144645 IP lamponubuntu2004-s-1vcpu-1gb-tor1-01.ssh > 50.101.85.188.58534: Flags [P.], seq 2516132:2516320, ack 1513, win 501, length 188
17:15:24.144813 IP lamponubuntu2004-s-1vcpu-1gb-tor1-01.ssh > 50.101.85.188.58534: Flags [P.], seq 2516320:2516508, ack 1513, win 501, length 188
17:15:24.144925 IP 50.101.85.188.58534 > lamponubuntu2004-s-1vcpu-1gb-tor1-01.ssh: Flags [.], ack 2511380, win 516, length 0
17:15:24.145006 IP lamponubuntu2004-s-1vcpu-1gb-tor1-01.ssh > 50.101.85.188.58534: Flags [P.], seq 2516508:2516696, ack 1513, win 501, length 188
17:15:24.145105 IP lamponubuntu2004-s-1vcpu-1gb-tor1-01.ssh > 50.101.85.188.58534: Flags [P.], seq 2516696:2516860, ack 1513, win 501, length 164
17:15:24.145201 IP lamponubuntu2004-s-1vcpu-1gb-tor1-01.ssh > 50.101.85.188.58534: Flags [P.], seq 2516860:2517048, ack 1513, win 501, length 188
17:15:24.145313 IP lamponubuntu2004-s-1vcpu-1gb-tor1-01.ssh > 50.101.85.188.58534: Flags [P.], seq 2517048:2517236, ack 1513, win 501, length 188
17:15:24.145416 IP lamponubuntu2004-s-1vcpu-1gb-tor1-01.ssh > 50.101.85.188.58534: Flags [P.], seq 2517236:2517424, ack 1513, win 501, length 188
17:15:24.145561 IP lamponubuntu2004-s-1vcpu-1gb-tor1-01.ssh > 50.101.85.188.58534: Flags [P.], seq 2517424:2517612, ack 1513, win 501, length 188
17:15:24.145698 IP lamponubuntu2004-s-1vcpu-1gb-tor1-01.ssh > 50.101.85.188.58534: Flags [P.], seq 2517612:2517800, ack 1513, win 501, length 188
17:15:24.145840 IP lamponubuntu2004-s-1vcpu-1gb-tor1-01.ssh > 50.101.85.188.58534: Flags [P.], seq 2517800:2517988, ack 1513, win 501, length 188
17:15:24.145922 IP 50.101.85.188.58534 > lamponubuntu2004-s-1vcpu-1gb-tor1-01.ssh: Flags [.], ack 2512004, win 513, length 0
17:15:24.145923 IP 50.101.85.188.58534 > lamponubuntu2004-s-1vcpu-1gb-tor1-01.ssh: Flags [.], ack 2513132, win 516, length 0
17:15:24.146017 IP lamponubuntu2004-s-1vcpu-1gb-tor1-01.ssh > 50.101.85.188.58534: Flags [P.], seq 2517988:2518176, ack 1513, win 501, length 188
17:15:24.146151 IP lamponubuntu2004-s-1vcpu-1gb-tor1-01.ssh > 50.101.85.188.58534: Flags [P.], seq 2518176:2518612, ack 1513, win 501, length 436
17:15:24.146252 IP lamponubuntu2004-s-1vcpu-1gb-tor1-01.ssh > 50.101.85.188.58534: Flags [P.], seq 2518612:2518800, ack 1513, win 501, length 188
17:15:24.146348 IP lamponubuntu2004-s-1vcpu-1gb-tor1-01.ssh > 50.101.85.188.58534: Flags [P.], seq 2518800:2518988, ack 1513, win 501, length 188
17:15:24.146444 IP lamponubuntu2004-s-1vcpu-1gb-tor1-01.ssh > 50.101.85.188.58534: Flags [P.], seq 2518988:2519176, ack 1513, win 501, length 188
17:15:24.146564 IP lamponubuntu2004-s-1vcpu-1gb-tor1-01.ssh > 50.101.85.188.58534: Flags [P.], seq 2519176:2519364, ack 1513, win 501, length 188
17:15:24.146695 IP lamponubuntu2004-s-1vcpu-1gb-tor1-01.ssh > 50.101.85.188.58534: Flags [P.], seq 2519364:2519552, ack 1513, win 501, length 188
17:15:24.146840 IP lamponubuntu2004-s-1vcpu-1gb-tor1-01.ssh > 50.101.85.188.58534: Flags [P.], seq 2519552:2519740, ack 1513, win 501, length 188
17:15:24.146938 IP 50.101.85.188.58534 > lamponubuntu2004-s-1vcpu-1gb-tor1-01.ssh: Flags [.], ack 2514004, win 512, length 0
17:15:24.147021 IP lamponubuntu2004-s-1vcpu-1gb-tor1-01.ssh > 50.101.85.188.58534: Flags [P.], seq 2519740:2519928, ack 1513, win 501, length 188
17:15:24.147134 IP lamponubuntu2004-s-1vcpu-1gb-tor1-01.ssh > 50.101.85.188.58534: Flags [P.], seq 2519928:2520236, ack 1513, win 501, length 308
17:15:24.147233 IP lamponubuntu2004-s-1vcpu-1gb-tor1-01.ssh > 50.101.85.188.58534: Flags [P.], seq 2520236:2520424, ack 1513, win 501, length 188
17:15:24.147338 IP lamponubuntu2004-s-1vcpu-1gb-tor1-01.ssh > 50.101.85.188.58534: Flags [P.], seq 2520424:2520800, ack 1513, win 501, length 376
17:15:24.147438 IP lamponubuntu2004-s-1vcpu-1gb-tor1-01.ssh > 50.101.85.188.58534: Flags [P.], seq 2520800:2520988, ack 1513, win 501, length 188
17:15:24.147546 IP lamponubuntu2004-s-1vcpu-1gb-tor1-01.ssh > 50.101.85.188.58534: Flags [P.], seq 2520988:2521176, ack 1513, win 501, length 188
17:15:24.147663 IP lamponubuntu2004-s-1vcpu-1gb-tor1-01.ssh > 50.101.85.188.58534: Flags [P.], seq 2521176:2521364, ack 1513, win 501, length 188
17:15:24.147805 IP lamponubuntu2004-s-1vcpu-1gb-tor1-01.ssh > 50.101.85.188.58534: Flags [P.], seq 2521364:2521552, ack 1513, win 501, length 188
17:15:24.147958 IP lamponubuntu2004-s-1vcpu-1gb-tor1-01.ssh > 50.101.85.188.58534: Flags [P.], seq 2521552:2521740, ack 1513, win 501, length 188
17:15:24.147995 IP 50.101.85.188.58534 > lamponubuntu2004-s-1vcpu-1gb-tor1-01.ssh: Flags [.], ack 2514944, win 516, length 0
17:15:24.147995 IP 50.101.85.188.58534 > lamponubuntu2004-s-1vcpu-1gb-tor1-01.ssh: Flags [.], ack 2516320, win 510, length 0
17:15:24.148141 IP lamponubuntu2004-s-1vcpu-1gb-tor1-01.ssh > 50.101.85.188.58534: Flags [P.], seq 2521740:2522176, ack 1513, win 501, length 436
17:15:24.148258 IP lamponubuntu2004-s-1vcpu-1gb-tor1-01.ssh > 50.101.85.188.58534: Flags [P.], seq 2522176:2522364, ack 1513, win 501, length 188
17:15:24.148358 IP lamponubuntu2004-s-1vcpu-1gb-tor1-01.ssh > 50.101.85.188.58534: Flags [P.], seq 2522364:2522552, ack 1513, win 501, length 188
17:15:24.148485 IP lamponubuntu2004-s-1vcpu-1gb-tor1-01.ssh > 50.101.85.188.58534: Flags [P.], seq 2522552:2522740, ack 1513, win 501, length 188
17:15:24.148634 IP lamponubuntu2004-s-1vcpu-1gb-tor1-01.ssh > 50.101.85.188.58534: Flags [P.], seq 2522740:2522928, ack 1513, win 501, length 188
17:15:24.148744 IP lamponubuntu2004-s-1vcpu-1gb-tor1-01.ssh > 50.101.85.188.58534: Flags [P.], seq 2522928:2523116, ack 1513, win 501, length 188
17:15:24.148877 IP lamponubuntu2004-s-1vcpu-1gb-tor1-01.ssh > 50.101.85.188.58534: Flags [P.], seq 2523116:2523304, ack 1513, win 501, length 188
17:15:24.148962 IP 50.101.85.188.58534 > lamponubuntu2004-s-1vcpu-1gb-tor1-01.ssh: Flags [.], ack 2517424, win 516, length 0
17:15:24.148962 IP 50.101.85.188.58534 > lamponubuntu2004-s-1vcpu-1gb-tor1-01.ssh: Flags [.], ack 2517800, win 514, length 0
17:15:24.149072 IP lamponubuntu2004-s-1vcpu-1gb-tor1-01.ssh > 50.101.85.188.58534: Flags [P.], seq 2523304:2523740, ack 1513, win 501, length 436
17:15:24.149179 IP lamponubuntu2004-s-1vcpu-1gb-tor1-01.ssh > 50.101.85.188.58534: Flags [P.], seq 2523740:2523928, ack 1513, win 501, length 188
17:15:24.149279 IP lamponubuntu2004-s-1vcpu-1gb-tor1-01.ssh > 50.101.85.188.58534: Flags [P.], seq 2523928:2524116, ack 1513, win 501, length 188
17:15:24.149412 IP lamponubuntu2004-s-1vcpu-1gb-tor1-01.ssh > 50.101.85.188.58534: Flags [P.], seq 2524116:2524304, ack 1513, win 501, length 188
17:15:24.149540 IP lamponubuntu2004-s-1vcpu-1gb-tor1-01.ssh > 50.101.85.188.58534: Flags [P.], seq 2524304:2524492, ack 1513, win 501, length 188
17:15:24.149701 IP lamponubuntu2004-s-1vcpu-1gb-tor1-01.ssh > 50.101.85.188.58534: Flags [P.], seq 2524492:2524680, ack 1513, win 501, length 188
17:15:24.149813 IP lamponubuntu2004-s-1vcpu-1gb-tor1-01.ssh > 50.101.85.188.58534: Flags [P.], seq 2524680:2524868, ack 1513, win 501, length 188
17:15:24.149925 IP 50.101.85.188.58534 > lamponubuntu2004-s-1vcpu-1gb-tor1-01.ssh: Flags [.], ack 2518988, win 516, length 0
17:15:24.149941 IP lamponubuntu2004-s-1vcpu-1gb-tor1-01.ssh > 50.101.85.188.58534: Flags [P.], seq 2524868:2525056, ack 1513, win 501, length 188
17:15:24.150107 IP lamponubuntu2004-s-1vcpu-1gb-tor1-01.ssh > 50.101.85.188.58534: Flags [P.], seq 2525056:2525364, ack 1513, win 501, length 308
17:15:24.150216 IP lamponubuntu2004-s-1vcpu-1gb-tor1-01.ssh > 50.101.85.188.58534: Flags [P.], seq 2525364:2525552, ack 1513, win 501, length 188
17:15:24.150318 IP lamponubuntu2004-s-1vcpu-1gb-tor1-01.ssh > 50.101.85.188.58534: Flags [P.], seq 2525552:2525740, ack 1513, win 501, length 188
17:15:24.150418 IP lamponubuntu2004-s-1vcpu-1gb-tor1-01.ssh > 50.101.85.188.58534: Flags [P.], seq 2525740:2525928, ack 1513, win 501, length 188
17:15:24.150519 IP lamponubuntu2004-s-1vcpu-1gb-tor1-01.ssh > 50.101.85.188.58534: Flags [P.], seq 2525928:2526116, ack 1513, win 501, length 188
17:15:24.150637 IP lamponubuntu2004-s-1vcpu-1gb-tor1-01.ssh > 50.101.85.188.58534: Flags [P.], seq 2526116:2526304, ack 1513, win 501, length 188
17:15:24.150748 IP lamponubuntu2004-s-1vcpu-1gb-tor1-01.ssh > 50.101.85.188.58534: Flags [P.], seq 2526304:2526492, ack 1513, win 501, length 188
17:15:24.150850 IP lamponubuntu2004-s-1vcpu-1gb-tor1-01.ssh > 50.101.85.188.58534: Flags [P.], seq 2526492:2526680, ack 1513, win 501, length 188
17:15:24.150950 IP lamponubuntu2004-s-1vcpu-1gb-tor1-01.ssh > 50.101.85.188.58534: Flags [P.], seq 2526680:2526868, ack 1513, win 501, length 188
17:15:24.151050 IP lamponubuntu2004-s-1vcpu-1gb-tor1-01.ssh > 50.101.85.188.58534: Flags [P.], seq 2526868:2527056, ack 1513, win 501, length 188
17:15:24.151153 IP lamponubuntu2004-s-1vcpu-1gb-tor1-01.ssh > 50.101.85.188.58534: Flags [P.], seq 2527056:2527244, ack 1513, win 501, length 188
17:15:24.151252 IP lamponubuntu2004-s-1vcpu-1gb-tor1-01.ssh > 50.101.85.188.58534: Flags [P.], seq 2527244:2527432, ack 1513, win 501, length 188
17:15:24.151367 IP lamponubuntu2004-s-1vcpu-1gb-tor1-01.ssh > 50.101.85.188.58534: Flags [P.], seq 2527432:2527620, ack 1513, win 501, length 188
17:15:24.151480 IP lamponubuntu2004-s-1vcpu-1gb-tor1-01.ssh > 50.101.85.188.58534: Flags [P.], seq 2527620:2527808, ack 1513, win 501, length 188
17:15:24.151580 IP lamponubuntu2004-s-1vcpu-1gb-tor1-01.ssh > 50.101.85.188.58534: Flags [P.], seq 2527808:2527996, ack 1513, win 501, length 188
17:15:24.151745 IP lamponubuntu2004-s-1vcpu-1gb-tor1-01.ssh > 50.101.85.188.58534: Flags [P.], seq 2527996:2528184, ack 1513, win 501, length 188
17:15:24.151899 IP lamponubuntu2004-s-1vcpu-1gb-tor1-01.ssh > 50.101.85.188.58534: Flags [P.], seq 2528184:2528372, ack 1513, win 501, length 188
17:15:24.151930 IP 50.101.85.188.58534 > lamponubuntu2004-s-1vcpu-1gb-tor1-01.ssh: Flags [.], ack 2521176, win 516, length 0
17:15:24.151930 IP 50.101.85.188.58534 > lamponubuntu2004-s-1vcpu-1gb-tor1-01.ssh: Flags [.], ack 2522364, win 511, length 0
17:15:24.151930 IP 50.101.85.188.58534 > lamponubuntu2004-s-1vcpu-1gb-tor1-01.ssh: Flags [.], ack 2523304, win 516, length 0
17:15:24.152087 IP lamponubuntu2004-s-1vcpu-1gb-tor1-01.ssh > 50.101.85.188.58534: Flags [P.], seq 2528372:2528936, ack 1513, win 501, length 564
17:15:24.152194 IP lamponubuntu2004-s-1vcpu-1gb-tor1-01.ssh > 50.101.85.188.58534: Flags [P.], seq 2528936:2529124, ack 1513, win 501, length 188
17:15:24.152324 IP lamponubuntu2004-s-1vcpu-1gb-tor1-01.ssh > 50.101.85.188.58534: Flags [P.], seq 2529124:2529312, ack 1513, win 501, length 188
17:15:24.152440 IP lamponubuntu2004-s-1vcpu-1gb-tor1-01.ssh > 50.101.85.188.58534: Flags [P.], seq 2529312:2529500, ack 1513, win 501, length 188
17:15:24.152591 IP lamponubuntu2004-s-1vcpu-1gb-tor1-01.ssh > 50.101.85.188.58534: Flags [P.], seq 2529500:2529688, ack 1513, win 501, length 188
17:15:24.152824 IP lamponubuntu2004-s-1vcpu-1gb-tor1-01.ssh > 50.101.85.188.58534: Flags [P.], seq 2529688:2529876, ack 1513, win 501, length 188
17:15:24.152982 IP 50.101.85.188.58534 > lamponubuntu2004-s-1vcpu-1gb-tor1-01.ssh: Flags [.], ack 2523928, win 513, length 0
17:15:24.152982 IP 50.101.85.188.58534 > lamponubuntu2004-s-1vcpu-1gb-tor1-01.ssh: Flags [.], ack 2524304, win 512, length 0
17:15:24.153095 IP lamponubuntu2004-s-1vcpu-1gb-tor1-01.ssh > 50.101.85.188.58534: Flags [P.], seq 2529876:2530312, ack 1513, win 501, length 436
17:15:24.153271 IP lamponubuntu2004-s-1vcpu-1gb-tor1-01.ssh > 50.101.85.188.58534: Flags [P.], seq 2530312:2530500, ack 1513, win 501, length 188
17:15:24.153452 IP lamponubuntu2004-s-1vcpu-1gb-tor1-01.ssh > 50.101.85.188.58534: Flags [P.], seq 2530500:2530688, ack 1513, win 501, length 188
17:15:24.153609 IP lamponubuntu2004-s-1vcpu-1gb-tor1-01.ssh > 50.101.85.188.58534: Flags [P.], seq 2530688:2530876, ack 1513, win 501, length 188
17:15:24.153799 IP lamponubuntu2004-s-1vcpu-1gb-tor1-01.ssh > 50.101.85.188.58534: Flags [P.], seq 2530876:2531064, ack 1513, win 501, length 188
17:15:24.153976 IP 50.101.85.188.58534 > lamponubuntu2004-s-1vcpu-1gb-tor1-01.ssh: Flags [.], ack 2525552, win 516, length 0
17:15:24.153977 IP 50.101.85.188.58534 > lamponubuntu2004-s-1vcpu-1gb-tor1-01.ssh: Flags [.], ack 2525928, win 514, length 0
17:15:24.153977 IP 50.101.85.188.58534 > lamponubuntu2004-s-1vcpu-1gb-tor1-01.ssh: Flags [.], ack 2527056, win 516, length 0
17:15:24.154155 IP lamponubuntu2004-s-1vcpu-1gb-tor1-01.ssh > 50.101.85.188.58534: Flags [P.], seq 2531064:2531252, ack 1513, win 501, length 188
17:15:24.154203 IP lamponubuntu2004-s-1vcpu-1gb-tor1-01.ssh > 50.101.85.188.58534: Flags [P.], seq 2531252:2531664, ack 1513, win 501, length 412
17:15:24.154333 IP lamponubuntu2004-s-1vcpu-1gb-tor1-01.ssh > 50.101.85.188.58534: Flags [P.], seq 2531664:2531996, ack 1513, win 501, length 332
17:15:24.154442 IP lamponubuntu2004-s-1vcpu-1gb-tor1-01.ssh > 50.101.85.188.58534: Flags [P.], seq 2531996:2532184, ack 1513, win 501, length 188
17:15:24.154581 IP lamponubuntu2004-s-1vcpu-1gb-tor1-01.ssh > 50.101.85.188.58534: Flags [P.], seq 2532184:2532372, ack 1513, win 501, length 188
17:15:24.154747 IP lamponubuntu2004-s-1vcpu-1gb-tor1-01.ssh > 50.101.85.188.58534: Flags [P.], seq 2532372:2532560, ack 1513, win 501, length 188
17:15:24.154921 IP lamponubuntu2004-s-1vcpu-1gb-tor1-01.ssh > 50.101.85.188.58534: Flags [P.], seq 2532560:2532748, ack 1513, win 501, length 188
17:15:24.154943 IP 50.101.85.188.58534 > lamponubuntu2004-s-1vcpu-1gb-tor1-01.ssh: Flags [.], ack 2527620, win 513, length 0
17:15:24.155069 IP lamponubuntu2004-s-1vcpu-1gb-tor1-01.ssh > 50.101.85.188.58534: Flags [P.], seq 2532748:2533056, ack 1513, win 501, length 308
17:15:24.155182 IP lamponubuntu2004-s-1vcpu-1gb-tor1-01.ssh > 50.101.85.188.58534: Flags [P.], seq 2533056:2533244, ack 1513, win 501, length 188
17:15:24.155284 IP lamponubuntu2004-s-1vcpu-1gb-tor1-01.ssh > 50.101.85.188.58534: Flags [P.], seq 2533244:2533432, ack 1513, win 501, length 188
17:15:24.155383 IP lamponubuntu2004-s-1vcpu-1gb-tor1-01.ssh > 50.101.85.188.58534: Flags [P.], seq 2533432:2533620, ack 1513, win 501, length 188
17:15:24.155535 IP lamponubuntu2004-s-1vcpu-1gb-tor1-01.ssh > 50.101.85.188.58534: Flags [P.], seq 2533620:2533808, ack 1513, win 501, length 188
17:15:24.155708 IP lamponubuntu2004-s-1vcpu-1gb-tor1-01.ssh > 50.101.85.188.58534: Flags [P.], seq 2533808:2533996, ack 1513, win 501, length 188
17:15:24.155847 IP lamponubuntu2004-s-1vcpu-1gb-tor1-01.ssh > 50.101.85.188.58534: Flags [P.], seq 2533996:2534184, ack 1513, win 501, length 188
17:15:24.155948 IP 50.101.85.188.58534 > lamponubuntu2004-s-1vcpu-1gb-tor1-01.ssh: Flags [.], ack 2529312, win 516, length 0
17:15:24.155948 IP 50.101.85.188.58534 > lamponubuntu2004-s-1vcpu-1gb-tor1-01.ssh: Flags [.], ack 2529876, win 513, length 0
17:15:24.155948 IP 50.101.85.188.58534 > lamponubuntu2004-s-1vcpu-1gb-tor1-01.ssh: Flags [.], ack 2530500, win 511, length 0
17:15:24.155948 IP 50.101.85.188.58534 > lamponubuntu2004-s-1vcpu-1gb-tor1-01.ssh: Flags [.], ack 2530876, win 516, length 0
17:15:24.156084 IP lamponubuntu2004-s-1vcpu-1gb-tor1-01.ssh > 50.101.85.188.58534: Flags [P.], seq 2534184:2534876, ack 1513, win 501, length 692
17:15:24.156197 IP lamponubuntu2004-s-1vcpu-1gb-tor1-01.ssh > 50.101.85.188.58534: Flags [P.], seq 2534876:2535064, ack 1513, win 501, length 188
17:15:24.156311 IP lamponubuntu2004-s-1vcpu-1gb-tor1-01.ssh > 50.101.85.188.58534: Flags [P.], seq 2535064:2535252, ack 1513, win 501, length 188
17:15:24.156443 IP lamponubuntu2004-s-1vcpu-1gb-tor1-01.ssh > 50.101.85.188.58534: Flags [P.], seq 2535252:2535440, ack 1513, win 501, length 188
17:15:24.156549 IP lamponubuntu2004-s-1vcpu-1gb-tor1-01.ssh > 50.101.85.188.58534: Flags [P.], seq 2535440:2535628, ack 1513, win 501, length 188
17:15:24.156650 IP lamponubuntu2004-s-1vcpu-1gb-tor1-01.ssh > 50.101.85.188.58534: Flags [P.], seq 2535628:2535816, ack 1513, win 501, length 188
17:15:24.156751 IP lamponubuntu2004-s-1vcpu-1gb-tor1-01.ssh > 50.101.85.188.58534: Flags [P.], seq 2535816:2536004, ack 1513, win 501, length 188
17:15:24.156851 IP lamponubuntu2004-s-1vcpu-1gb-tor1-01.ssh > 50.101.85.188.58534: Flags [P.], seq 2536004:2536192, ack 1513, win 501, length 188
17:15:24.156952 IP lamponubuntu2004-s-1vcpu-1gb-tor1-01.ssh > 50.101.85.188.58534: Flags [P.], seq 2536192:2536380, ack 1513, win 501, length 188
17:15:24.157079 IP lamponubuntu2004-s-1vcpu-1gb-tor1-01.ssh > 50.101.85.188.58534: Flags [P.], seq 2536380:2536568, ack 1513, win 501, length 188
17:15:24.157184 IP lamponubuntu2004-s-1vcpu-1gb-tor1-01.ssh > 50.101.85.188.58534: Flags [P.], seq 2536568:2536756, ack 1513, win 501, length 188
17:15:24.157285 IP lamponubuntu2004-s-1vcpu-1gb-tor1-01.ssh > 50.101.85.188.58534: Flags [P.], seq 2536756:2536944, ack 1513, win 501, length 188
17:15:24.157423 IP lamponubuntu2004-s-1vcpu-1gb-tor1-01.ssh > 50.101.85.188.58534: Flags [P.], seq 2536944:2537132, ack 1513, win 501, length 188
17:15:24.157534 IP lamponubuntu2004-s-1vcpu-1gb-tor1-01.ssh > 50.101.85.188.58534: Flags [P.], seq 2537132:2537320, ack 1513, win 501, length 188
17:15:24.157636 IP lamponubuntu2004-s-1vcpu-1gb-tor1-01.ssh > 50.101.85.188.58534: Flags [P.], seq 2537320:2537508, ack 1513, win 501, length 188
17:15:24.157799 IP lamponubuntu2004-s-1vcpu-1gb-tor1-01.ssh > 50.101.85.188.58534: Flags [P.], seq 2537508:2537696, ack 1513, win 501, length 188
17:15:24.157913 IP lamponubuntu2004-s-1vcpu-1gb-tor1-01.ssh > 50.101.85.188.58534: Flags [P.], seq 2537696:2537884, ack 1513, win 501, length 188
17:15:24.158025 IP lamponubuntu2004-s-1vcpu-1gb-tor1-01.ssh > 50.101.85.188.58534: Flags [P.], seq 2537884:2538072, ack 1513, win 501, length 188
17:15:24.158149 IP lamponubuntu2004-s-1vcpu-1gb-tor1-01.ssh > 50.101.85.188.58534: Flags [P.], seq 2538072:2538260, ack 1513, win 501, length 188
17:15:24.158255 IP lamponubuntu2004-s-1vcpu-1gb-tor1-01.ssh > 50.101.85.188.58534: Flags [P.], seq 2538260:2538448, ack 1513, win 501, length 188
17:15:24.158355 IP lamponubuntu2004-s-1vcpu-1gb-tor1-01.ssh > 50.101.85.188.58534: Flags [P.], seq 2538448:2538636, ack 1513, win 501, length 188
17:15:24.158455 IP lamponubuntu2004-s-1vcpu-1gb-tor1-01.ssh > 50.101.85.188.58534: Flags [P.], seq 2538636:2538824, ack 1513, win 501, length 188
17:15:24.158610 IP lamponubuntu2004-s-1vcpu-1gb-tor1-01.ssh > 50.101.85.188.58534: Flags [P.], seq 2538824:2539012, ack 1513, win 501, length 188
17:15:24.158719 IP lamponubuntu2004-s-1vcpu-1gb-tor1-01.ssh > 50.101.85.188.58534: Flags [P.], seq 2539012:2539200, ack 1513, win 501, length 188
17:15:24.158828 IP lamponubuntu2004-s-1vcpu-1gb-tor1-01.ssh > 50.101.85.188.58534: Flags [P.], seq 2539200:2539388, ack 1513, win 501, length 188
17:15:24.158931 IP lamponubuntu2004-s-1vcpu-1gb-tor1-01.ssh > 50.101.85.188.58534: Flags [P.], seq 2539388:2539576, ack 1513, win 501, length 188
17:15:24.159014 IP 50.101.85.188.58534 > lamponubuntu2004-s-1vcpu-1gb-tor1-01.ssh: Flags [.], ack 2531664, win 513, length 0
17:15:24.159014 IP 50.101.85.188.58534 > lamponubuntu2004-s-1vcpu-1gb-tor1-01.ssh: Flags [.], ack 2532748, win 516, length 0
17:15:24.159014 IP 50.101.85.188.58534 > lamponubuntu2004-s-1vcpu-1gb-tor1-01.ssh: Flags [.], ack 2533244, win 514, length 0
17:15:24.159014 IP 50.101.85.188.58534 > lamponubuntu2004-s-1vcpu-1gb-tor1-01.ssh: Flags [.], ack 2533620, win 512, length 0
17:15:24.159175 IP lamponubuntu2004-s-1vcpu-1gb-tor1-01.ssh > 50.101.85.188.58534: Flags [P.], seq 2539576:2540268, ack 1513, win 501, length 692
17:15:24.159281 IP lamponubuntu2004-s-1vcpu-1gb-tor1-01.ssh > 50.101.85.188.58534: Flags [P.], seq 2540268:2540456, ack 1513, win 501, length 188
17:15:24.159382 IP lamponubuntu2004-s-1vcpu-1gb-tor1-01.ssh > 50.101.85.188.58534: Flags [P.], seq 2540456:2540644, ack 1513, win 501, length 188
17:15:24.159483 IP lamponubuntu2004-s-1vcpu-1gb-tor1-01.ssh > 50.101.85.188.58534: Flags [P.], seq 2540644:2540832, ack 1513, win 501, length 188
17:15:24.159583 IP lamponubuntu2004-s-1vcpu-1gb-tor1-01.ssh > 50.101.85.188.58534: Flags [P.], seq 2540832:2541020, ack 1513, win 501, length 188
17:15:24.159681 IP lamponubuntu2004-s-1vcpu-1gb-tor1-01.ssh > 50.101.85.188.58534: Flags [P.], seq 2541020:2541208, ack 1513, win 501, length 188
17:15:24.159782 IP lamponubuntu2004-s-1vcpu-1gb-tor1-01.ssh > 50.101.85.188.58534: Flags [P.], seq 2541208:2541396, ack 1513, win 501, length 188
17:15:24.159884 IP lamponubuntu2004-s-1vcpu-1gb-tor1-01.ssh > 50.101.85.188.58534: Flags [P.], seq 2541396:2541584, ack 1513, win 501, length 188
17:15:24.159964 IP 50.101.85.188.58534 > lamponubuntu2004-s-1vcpu-1gb-tor1-01.ssh: Flags [.], ack 2533996, win 511, length 0
17:15:24.159964 IP 50.101.85.188.58534 > lamponubuntu2004-s-1vcpu-1gb-tor1-01.ssh: Flags [.], ack 2535064, win 516, length 0
17:15:24.159964 IP 50.101.85.188.58534 > lamponubuntu2004-s-1vcpu-1gb-tor1-01.ssh: Flags [.], ack 2535440, win 514, length 0
17:15:24.159964 IP 50.101.85.188.58534 > lamponubuntu2004-s-1vcpu-1gb-tor1-01.ssh: Flags [.], ack 2536380, win 511, length 0
17:15:24.160097 IP lamponubuntu2004-s-1vcpu-1gb-tor1-01.ssh > 50.101.85.188.58534: Flags [P.], seq 2541584:2542276, ack 1513, win 501, length 692
17:15:24.160201 IP lamponubuntu2004-s-1vcpu-1gb-tor1-01.ssh > 50.101.85.188.58534: Flags [P.], seq 2542276:2542464, ack 1513, win 501, length 188
17:15:24.160301 IP lamponubuntu2004-s-1vcpu-1gb-tor1-01.ssh > 50.101.85.188.58534: Flags [P.], seq 2542464:2542652, ack 1513, win 501, length 188
17:15:24.160399 IP lamponubuntu2004-s-1vcpu-1gb-tor1-01.ssh > 50.101.85.188.58534: Flags [P.], seq 2542652:2542840, ack 1513, win 501, length 188
17:15:24.160497 IP lamponubuntu2004-s-1vcpu-1gb-tor1-01.ssh > 50.101.85.188.58534: Flags [P.], seq 2542840:2543028, ack 1513, win 501, length 188
17:15:24.160647 IP lamponubuntu2004-s-1vcpu-1gb-tor1-01.ssh > 50.101.85.188.58534: Flags [P.], seq 2543028:2543216, ack 1513, win 501, length 188
17:15:24.160759 IP lamponubuntu2004-s-1vcpu-1gb-tor1-01.ssh > 50.101.85.188.58534: Flags [P.], seq 2543216:2543404, ack 1513, win 501, length 188
17:15:24.160863 IP lamponubuntu2004-s-1vcpu-1gb-tor1-01.ssh > 50.101.85.188.58534: Flags [P.], seq 2543404:2543592, ack 1513, win 501, length 188
17:15:24.160961 IP 50.101.85.188.58534 > lamponubuntu2004-s-1vcpu-1gb-tor1-01.ssh: Flags [.], ack 2537696, win 516, length 0
17:15:24.160961 IP 50.101.85.188.58534 > lamponubuntu2004-s-1vcpu-1gb-tor1-01.ssh: Flags [.], ack 2538072, win 514, length 0
17:15:24.160961 IP 50.101.85.188.58534 > lamponubuntu2004-s-1vcpu-1gb-tor1-01.ssh: Flags [.], ack 2539012, win 511, length 0
17:15:24.161085 IP lamponubuntu2004-s-1vcpu-1gb-tor1-01.ssh > 50.101.85.188.58534: Flags [P.], seq 2543592:2544156, ack 1513, win 501, length 564
17:15:24.161193 IP lamponubuntu2004-s-1vcpu-1gb-tor1-01.ssh > 50.101.85.188.58534: Flags [P.], seq 2544156:2544344, ack 1513, win 501, length 188
17:15:24.161294 IP lamponubuntu2004-s-1vcpu-1gb-tor1-01.ssh > 50.101.85.188.58534: Flags [P.], seq 2544344:2544532, ack 1513, win 501, length 188
17:15:24.161418 IP lamponubuntu2004-s-1vcpu-1gb-tor1-01.ssh > 50.101.85.188.58534: Flags [P.], seq 2544532:2544720, ack 1513, win 501, length 188
17:15:24.161518 IP lamponubuntu2004-s-1vcpu-1gb-tor1-01.ssh > 50.101.85.188.58534: Flags [P.], seq 2544720:2544908, ack 1513, win 501, length 188
17:15:24.161618 IP lamponubuntu2004-s-1vcpu-1gb-tor1-01.ssh > 50.101.85.188.58534: Flags [P.], seq 2544908:2545096, ack 1513, win 501, length 188
17:15:24.161718 IP lamponubuntu2004-s-1vcpu-1gb-tor1-01.ssh > 50.101.85.188.58534: Flags [P.], seq 2545096:2545284, ack 1513, win 501, length 188
17:15:24.161818 IP lamponubuntu2004-s-1vcpu-1gb-tor1-01.ssh > 50.101.85.188.58534: Flags [P.], seq 2545284:2545472, ack 1513, win 501, length 188
17:15:24.161919 IP lamponubuntu2004-s-1vcpu-1gb-tor1-01.ssh > 50.101.85.188.58534: Flags [P.], seq 2545472:2545660, ack 1513, win 501, length 188
17:15:24.161949 IP 50.101.85.188.58534 > lamponubuntu2004-s-1vcpu-1gb-tor1-01.ssh: Flags [.], ack 2539576, win 516, length 0
17:15:24.162063 IP lamponubuntu2004-s-1vcpu-1gb-tor1-01.ssh > 50.101.85.188.58534: Flags [P.], seq 2545660:2545968, ack 1513, win 501, length 308
17:15:24.162191 IP lamponubuntu2004-s-1vcpu-1gb-tor1-01.ssh > 50.101.85.188.58534: Flags [P.], seq 2545968:2546156, ack 1513, win 501, length 188
17:15:24.162292 IP lamponubuntu2004-s-1vcpu-1gb-tor1-01.ssh > 50.101.85.188.58534: Flags [P.], seq 2546156:2546344, ack 1513, win 501, length 188
17:15:24.162392 IP lamponubuntu2004-s-1vcpu-1gb-tor1-01.ssh > 50.101.85.188.58534: Flags [P.], seq 2546344:2546532, ack 1513, win 501, length 188
17:15:24.162495 IP lamponubuntu2004-s-1vcpu-1gb-tor1-01.ssh > 50.101.85.188.58534: Flags [P.], seq 2546532:2546720, ack 1513, win 501, length 188
17:15:24.162674 IP lamponubuntu2004-s-1vcpu-1gb-tor1-01.ssh > 50.101.85.188.58534: Flags [P.], seq 2546720:2546908, ack 1513, win 501, length 188
17:15:24.162814 IP lamponubuntu2004-s-1vcpu-1gb-tor1-01.ssh > 50.101.85.188.58534: Flags [P.], seq 2546908:2547096, ack 1513, win 501, length 188
17:15:24.162934 IP lamponubuntu2004-s-1vcpu-1gb-tor1-01.ssh > 50.101.85.188.58534: Flags [P.], seq 2547096:2547284, ack 1513, win 501, length 188
17:15:24.162965 IP 50.101.85.188.58534 > lamponubuntu2004-s-1vcpu-1gb-tor1-01.ssh: Flags [.], ack 2541584, win 516, length 0
17:15:24.162966 IP 50.101.85.188.58534 > lamponubuntu2004-s-1vcpu-1gb-tor1-01.ssh: Flags [P.], seq 1513:1549, ack 2541584, win 516, length 36
17:15:24.163121 IP lamponubuntu2004-s-1vcpu-1gb-tor1-01.ssh > 50.101.85.188.58534: Flags [P.], seq 2547284:2547736, ack 1549, win 501, length 452
17:15:24.163264 IP lamponubuntu2004-s-1vcpu-1gb-tor1-01.ssh > 50.101.85.188.58534: Flags [P.], seq 2547736:2547924, ack 1549, win 501, length 188
17:15:24.163443 IP lamponubuntu2004-s-1vcpu-1gb-tor1-01.ssh > 50.101.85.188.58534: Flags [P.], seq 2547924:2548112, ack 1549, win 501, length 188
17:15:24.163628 IP lamponubuntu2004-s-1vcpu-1gb-tor1-01.ssh > 50.101.85.188.58534: Flags [P.], seq 2548112:2548300, ack 1549, win 501, length 188
17:15:24.163765 IP lamponubuntu2004-s-1vcpu-1gb-tor1-01.ssh > 50.101.85.188.58534: Flags [P.], seq 2548300:2548488, ack 1549, win 501, length 188
17:15:24.163873 IP lamponubuntu2004-s-1vcpu-1gb-tor1-01.ssh > 50.101.85.188.58534: Flags [P.], seq 2548488:2548676, ack 1549, win 501, length 188
17:15:24.163957 IP 50.101.85.188.58534 > lamponubuntu2004-s-1vcpu-1gb-tor1-01.ssh: Flags [.], ack 2542464, win 512, length 0
17:15:24.163957 IP 50.101.85.188.58534 > lamponubuntu2004-s-1vcpu-1gb-tor1-01.ssh: Flags [.], ack 2543592, win 516, length 0
17:15:24.164090 IP lamponubuntu2004-s-1vcpu-1gb-tor1-01.ssh > 50.101.85.188.58534: Flags [P.], seq 2548676:2549112, ack 1549, win 501, length 436
17:15:24.164197 IP lamponubuntu2004-s-1vcpu-1gb-tor1-01.ssh > 50.101.85.188.58534: Flags [P.], seq 2549112:2549300, ack 1549, win 501, length 188
17:15:24.164308 IP lamponubuntu2004-s-1vcpu-1gb-tor1-01.ssh > 50.101.85.188.58534: Flags [P.], seq 2549300:2549488, ack 1549, win 501, length 188
17:15:24.164413 IP lamponubuntu2004-s-1vcpu-1gb-tor1-01.ssh > 50.101.85.188.58534: Flags [P.], seq 2549488:2549676, ack 1549, win 501, length 188
17:15:24.164528 IP lamponubuntu2004-s-1vcpu-1gb-tor1-01.ssh > 50.101.85.188.58534: Flags [P.], seq 2549676:2549864, ack 1549, win 501, length 188
17:15:24.164722 IP lamponubuntu2004-s-1vcpu-1gb-tor1-01.ssh > 50.101.85.188.58534: Flags [P.], seq 2549864:2550052, ack 1549, win 501, length 188
17:15:24.164879 IP lamponubuntu2004-s-1vcpu-1gb-tor1-01.ssh > 50.101.85.188.58534: Flags [P.], seq 2550052:2550240, ack 1549, win 501, length 188
17:15:24.164967 IP 50.101.85.188.58534 > lamponubuntu2004-s-1vcpu-1gb-tor1-01.ssh: Flags [.], ack 2544908, win 511, length 0
17:15:24.165061 IP lamponubuntu2004-s-1vcpu-1gb-tor1-01.ssh > 50.101.85.188.58534: Flags [P.], seq 2550240:2550548, ack 1549, win 501, length 308
17:15:24.165182 IP lamponubuntu2004-s-1vcpu-1gb-tor1-01.ssh > 50.101.85.188.58534: Flags [P.], seq 2550548:2550736, ack 1549, win 501, length 188
17:15:24.165355 IP lamponubuntu2004-s-1vcpu-1gb-tor1-01.ssh > 50.101.85.188.58534: Flags [P.], seq 2550736:2550924, ack 1549, win 501, length 188
17:15:24.165507 IP lamponubuntu2004-s-1vcpu-1gb-tor1-01.ssh > 50.101.85.188.58534: Flags [P.], seq 2550924:2551112, ack 1549, win 501, length 188
17:15:24.165616 IP lamponubuntu2004-s-1vcpu-1gb-tor1-01.ssh > 50.101.85.188.58534: Flags [P.], seq 2551112:2551300, ack 1549, win 501, length 188
17:15:24.165764 IP lamponubuntu2004-s-1vcpu-1gb-tor1-01.ssh > 50.101.85.188.58534: Flags [P.], seq 2551300:2551488, ack 1549, win 501, length 188
17:15:24.165917 IP lamponubuntu2004-s-1vcpu-1gb-tor1-01.ssh > 50.101.85.188.58534: Flags [P.], seq 2551488:2551676, ack 1549, win 501, length 188
17:15:24.165950 IP 50.101.85.188.58534 > lamponubuntu2004-s-1vcpu-1gb-tor1-01.ssh: Flags [.], ack 2546532, win 516, length 0
17:15:24.165950 IP 50.101.85.188.58534 > lamponubuntu2004-s-1vcpu-1gb-tor1-01.ssh: Flags [.], ack 2546908, win 514, length 0
17:15:24.166115 IP lamponubuntu2004-s-1vcpu-1gb-tor1-01.ssh > 50.101.85.188.58534: Flags [P.], seq 2551676:2552112, ack 1549, win 501, length 436
17:15:24.166321 IP lamponubuntu2004-s-1vcpu-1gb-tor1-01.ssh > 50.101.85.188.58534: Flags [P.], seq 2552112:2552300, ack 1549, win 501, length 188
17:15:24.166447 IP lamponubuntu2004-s-1vcpu-1gb-tor1-01.ssh > 50.101.85.188.58534: Flags [P.], seq 2552300:2552488, ack 1549, win 501, length 188
17:15:24.166628 IP lamponubuntu2004-s-1vcpu-1gb-tor1-01.ssh > 50.101.85.188.58534: Flags [P.], seq 2552488:2552676, ack 1549, win 501, length 188
17:15:24.166747 IP lamponubuntu2004-s-1vcpu-1gb-tor1-01.ssh > 50.101.85.188.58534: Flags [P.], seq 2552676:2552864, ack 1549, win 501, length 188
17:15:24.166850 IP lamponubuntu2004-s-1vcpu-1gb-tor1-01.ssh > 50.101.85.188.58534: Flags [P.], seq 2552864:2553052, ack 1549, win 501, length 188
17:15:24.166949 IP 50.101.85.188.58534 > lamponubuntu2004-s-1vcpu-1gb-tor1-01.ssh: Flags [.], ack 2547736, win 511, length 0
17:15:24.166949 IP 50.101.85.188.58534 > lamponubuntu2004-s-1vcpu-1gb-tor1-01.ssh: Flags [P.], seq 1549:1585, ack 2547736, win 511, length 36
17:15:24.166949 IP 50.101.85.188.58534 > lamponubuntu2004-s-1vcpu-1gb-tor1-01.ssh: Flags [.], ack 2548488, win 516, length 0
17:15:24.167071 IP lamponubuntu2004-s-1vcpu-1gb-tor1-01.ssh > 50.101.85.188.58534: Flags [P.], seq 2553052:2553240, ack 1585, win 501, length 188
^C
14980 packets captured
14980 packets received by filter
0 packets dropped by kernel