17:03:52.109700 IP lamponubuntu2004-s-1vcpu-1gb-tor1-01.ssh > 50.101.85.188.58534: Flags [P.], seq 31613732:31613920, ack 18721, win 501, length 188
17:03:52.109793 IP 50.101.85.188.58534 > lamponubuntu2004-s-1vcpu-1gb-tor1-01.ssh: Flags [.], ack 31608640, win 513, length 0
17:03:52.109793 IP 50.101.85.188.58534 > lamponubuntu2004-s-1vcpu-1gb-tor1-01.ssh: Flags [.], ack 31609580, win 516, length 0
17:03:52.109940 IP lamponubuntu2004-s-1vcpu-1gb-tor1-01.ssh > 50.101.85.188.58534: Flags [P.], seq 31613920:31614364, ack 18721, win 501, length 444
17:03:52.110102 IP lamponubuntu2004-s-1vcpu-1gb-tor1-01.ssh > 50.101.85.188.58534: Flags [P.], seq 31614364:31614552, ack 18721, win 501, length 188
17:03:52.110262 IP lamponubuntu2004-s-1vcpu-1gb-tor1-01.ssh > 50.101.85.188.58534: Flags [P.], seq 31614552:31614740, ack 18721, win 501, length 188
17:03:52.110507 IP lamponubuntu2004-s-1vcpu-1gb-tor1-01.ssh > 50.101.85.188.58534: Flags [P.], seq 31614740:31614928, ack 18721, win 501, length 188
17:03:52.110657 IP lamponubuntu2004-s-1vcpu-1gb-tor1-01.ssh > 50.101.85.188.58534: Flags [P.], seq 31614928:31615116, ack 18721, win 501, length 188
17:03:52.110784 IP 50.101.85.188.58534 > lamponubuntu2004-s-1vcpu-1gb-tor1-01.ssh: Flags [.], ack 31610528, win 512, length 0
17:03:52.110899 IP lamponubuntu2004-s-1vcpu-1gb-tor1-01.ssh > 50.101.85.188.58534: Flags [P.], seq 31615116:31615432, ack 18721, win 501, length 316
17:03:52.111035 IP lamponubuntu2004-s-1vcpu-1gb-tor1-01.ssh > 50.101.85.188.58534: Flags [P.], seq 31615432:31615620, ack 18721, win 501, length 188
17:03:52.111177 IP lamponubuntu2004-s-1vcpu-1gb-tor1-01.ssh > 50.101.85.188.58534: Flags [P.], seq 31615620:31615808, ack 18721, win 501, length 188
17:03:52.111312 IP lamponubuntu2004-s-1vcpu-1gb-tor1-01.ssh > 50.101.85.188.58534: Flags [P.], seq 31615808:31615996, ack 18721, win 501, length 188
17:03:52.111470 IP lamponubuntu2004-s-1vcpu-1gb-tor1-01.ssh > 50.101.85.188.58534: Flags [P.], seq 31615996:31616184, ack 18721, win 501, length 188
17:03:52.111612 IP lamponubuntu2004-s-1vcpu-1gb-tor1-01.ssh > 50.101.85.188.58534: Flags [P.], seq 31616184:31616372, ack 18721, win 501, length 188
17:03:52.112010 IP 50.101.85.188.58534 > lamponubuntu2004-s-1vcpu-1gb-tor1-01.ssh: Flags [.], ack 31611596, win 516, length 0
17:03:52.112010 IP 50.101.85.188.58534 > lamponubuntu2004-s-1vcpu-1gb-tor1-01.ssh: Flags [.], ack 31612160, win 513, length 0
17:03:52.112042 IP lamponubuntu2004-s-1vcpu-1gb-tor1-01.ssh > 50.101.85.188.58534: Flags [P.], seq 31616372:31616560, ack 18721, win 501, length 188
17:03:52.112259 IP lamponubuntu2004-s-1vcpu-1gb-tor1-01.ssh > 50.101.85.188.58534: Flags [P.], seq 31616560:31617004, ack 18721, win 501, length 444
17:03:52.112398 IP lamponubuntu2004-s-1vcpu-1gb-tor1-01.ssh > 50.101.85.188.58534: Flags [P.], seq 31617004:31617192, ack 18721, win 501, length 188
17:03:52.112536 IP lamponubuntu2004-s-1vcpu-1gb-tor1-01.ssh > 50.101.85.188.58534: Flags [P.], seq 31617192:31617380, ack 18721, win 501, length 188
17:03:52.112682 IP lamponubuntu2004-s-1vcpu-1gb-tor1-01.ssh > 50.101.85.188.58534: Flags [P.], seq 31617380:31617568, ack 18721, win 501, length 188
17:03:52.112837 IP 50.101.85.188.58534 > lamponubuntu2004-s-1vcpu-1gb-tor1-01.ssh: Flags [.], ack 31612980, win 510, length 0
17:03:52.112837 IP 50.101.85.188.58534 > lamponubuntu2004-s-1vcpu-1gb-tor1-01.ssh: Flags [.], ack 31613356, win 516, length 0
17:03:52.112837 IP 50.101.85.188.58534 > lamponubuntu2004-s-1vcpu-1gb-tor1-01.ssh: Flags [.], ack 31613920, win 513, length 0
17:03:52.112869 IP lamponubuntu2004-s-1vcpu-1gb-tor1-01.ssh > 50.101.85.188.58534: Flags [P.], seq 31617568:31617756, ack 18721, win 501, length 188
17:03:52.113092 IP lamponubuntu2004-s-1vcpu-1gb-tor1-01.ssh > 50.101.85.188.58534: Flags [P.], seq 31617756:31618328, ack 18721, win 501, length 572
17:03:52.113248 IP lamponubuntu2004-s-1vcpu-1gb-tor1-01.ssh > 50.101.85.188.58534: Flags [P.], seq 31618328:31618516, ack 18721, win 501, length 188
17:03:52.113386 IP lamponubuntu2004-s-1vcpu-1gb-tor1-01.ssh > 50.101.85.188.58534: Flags [P.], seq 31618516:31618704, ack 18721, win 501, length 188
17:03:52.113525 IP lamponubuntu2004-s-1vcpu-1gb-tor1-01.ssh > 50.101.85.188.58534: Flags [P.], seq 31618704:31618892, ack 18721, win 501, length 188
17:03:52.113664 IP lamponubuntu2004-s-1vcpu-1gb-tor1-01.ssh > 50.101.85.188.58534: Flags [P.], seq 31618892:31619080, ack 18721, win 501, length 188
17:03:52.113797 IP lamponubuntu2004-s-1vcpu-1gb-tor1-01.ssh > 50.101.85.188.58534: Flags [P.], seq 31619080:31619268, ack 18721, win 501, length 188
17:03:52.113830 IP 50.101.85.188.58534 > lamponubuntu2004-s-1vcpu-1gb-tor1-01.ssh: Flags [.], ack 31614552, win 511, length 0
17:03:52.113830 IP 50.101.85.188.58534 > lamponubuntu2004-s-1vcpu-1gb-tor1-01.ssh: Flags [.], ack 31615432, win 516, length 0
17:03:52.114020 IP lamponubuntu2004-s-1vcpu-1gb-tor1-01.ssh > 50.101.85.188.58534: Flags [P.], seq 31619268:31619712, ack 18721, win 501, length 444
17:03:52.114390 IP lamponubuntu2004-s-1vcpu-1gb-tor1-01.ssh > 50.101.85.188.58534: Flags [P.], seq 31619712:31619900, ack 18721, win 501, length 188
17:03:52.114551 IP lamponubuntu2004-s-1vcpu-1gb-tor1-01.ssh > 50.101.85.188.58534: Flags [P.], seq 31619900:31620088, ack 18721, win 501, length 188
17:03:52.114686 IP lamponubuntu2004-s-1vcpu-1gb-tor1-01.ssh > 50.101.85.188.58534: Flags [P.], seq 31620088:31620276, ack 18721, win 501, length 188
17:03:52.114811 IP 50.101.85.188.58534 > lamponubuntu2004-s-1vcpu-1gb-tor1-01.ssh: Flags [.], ack 31616184, win 513, length 0
17:03:52.114926 IP lamponubuntu2004-s-1vcpu-1gb-tor1-01.ssh > 50.101.85.188.58534: Flags [P.], seq 31620276:31620592, ack 18721, win 501, length 316
17:03:52.115063 IP lamponubuntu2004-s-1vcpu-1gb-tor1-01.ssh > 50.101.85.188.58534: Flags [P.], seq 31620592:31620780, ack 18721, win 501, length 188
17:03:52.115198 IP lamponubuntu2004-s-1vcpu-1gb-tor1-01.ssh > 50.101.85.188.58534: Flags [P.], seq 31620780:31620968, ack 18721, win 501, length 188
17:03:52.115336 IP lamponubuntu2004-s-1vcpu-1gb-tor1-01.ssh > 50.101.85.188.58534: Flags [P.], seq 31620968:31621156, ack 18721, win 501, length 188
17:03:52.115473 IP lamponubuntu2004-s-1vcpu-1gb-tor1-01.ssh > 50.101.85.188.58534: Flags [P.], seq 31621156:31621344, ack 18721, win 501, length 188
17:03:52.115611 IP lamponubuntu2004-s-1vcpu-1gb-tor1-01.ssh > 50.101.85.188.58534: Flags [P.], seq 31621344:31621532, ack 18721, win 501, length 188
17:03:52.115750 IP lamponubuntu2004-s-1vcpu-1gb-tor1-01.ssh > 50.101.85.188.58534: Flags [P.], seq 31621532:31621720, ack 18721, win 501, length 188
17:03:52.115849 IP 50.101.85.188.58534 > lamponubuntu2004-s-1vcpu-1gb-tor1-01.ssh: Flags [.], ack 31616560, win 511, length 0
17:03:52.115961 IP lamponubuntu2004-s-1vcpu-1gb-tor1-01.ssh > 50.101.85.188.58534: Flags [P.], seq 31621720:31622036, ack 18721, win 501, length 316
17:03:52.116101 IP lamponubuntu2004-s-1vcpu-1gb-tor1-01.ssh > 50.101.85.188.58534: Flags [P.], seq 31622036:31622224, ack 18721, win 501, length 188
17:03:52.116242 IP lamponubuntu2004-s-1vcpu-1gb-tor1-01.ssh > 50.101.85.188.58534: Flags [P.], seq 31622224:31622412, ack 18721, win 501, length 188
17:03:52.116399 IP lamponubuntu2004-s-1vcpu-1gb-tor1-01.ssh > 50.101.85.188.58534: Flags [P.], seq 31622412:31622600, ack 18721, win 501, length 188
17:03:52.116539 IP lamponubuntu2004-s-1vcpu-1gb-tor1-01.ssh > 50.101.85.188.58534: Flags [P.], seq 31622600:31622788, ack 18721, win 501, length 188
17:03:52.116678 IP lamponubuntu2004-s-1vcpu-1gb-tor1-01.ssh > 50.101.85.188.58534: Flags [P.], seq 31622788:31622976, ack 18721, win 501, length 188
17:03:52.116817 IP lamponubuntu2004-s-1vcpu-1gb-tor1-01.ssh > 50.101.85.188.58534: Flags [P.], seq 31622976:31623164, ack 18721, win 501, length 188
17:03:52.116857 IP 50.101.85.188.58534 > lamponubuntu2004-s-1vcpu-1gb-tor1-01.ssh: Flags [.], ack 31617568, win 516, length 0
17:03:52.116857 IP 50.101.85.188.58534 > lamponubuntu2004-s-1vcpu-1gb-tor1-01.ssh: Flags [.], ack 31618328, win 513, length 0
17:03:52.116857 IP 50.101.85.188.58534 > lamponubuntu2004-s-1vcpu-1gb-tor1-01.ssh: Flags [.], ack 31619080, win 516, length 0
17:03:52.117069 IP lamponubuntu2004-s-1vcpu-1gb-tor1-01.ssh > 50.101.85.188.58534: Flags [P.], seq 31623164:31623736, ack 18721, win 501, length 572
17:03:52.117238 IP lamponubuntu2004-s-1vcpu-1gb-tor1-01.ssh > 50.101.85.188.58534: Flags [P.], seq 31623736:31623924, ack 18721, win 501, length 188
17:03:52.117381 IP lamponubuntu2004-s-1vcpu-1gb-tor1-01.ssh > 50.101.85.188.58534: Flags [P.], seq 31623924:31624112, ack 18721, win 501, length 188
17:03:52.117520 IP lamponubuntu2004-s-1vcpu-1gb-tor1-01.ssh > 50.101.85.188.58534: Flags [P.], seq 31624112:31624300, ack 18721, win 501, length 188
17:03:52.117654 IP lamponubuntu2004-s-1vcpu-1gb-tor1-01.ssh > 50.101.85.188.58534: Flags [P.], seq 31624300:31624488, ack 18721, win 501, length 188
17:03:52.117792 IP lamponubuntu2004-s-1vcpu-1gb-tor1-01.ssh > 50.101.85.188.58534: Flags [P.], seq 31624488:31624676, ack 18721, win 501, length 188
17:03:52.117834 IP 50.101.85.188.58534 > lamponubuntu2004-s-1vcpu-1gb-tor1-01.ssh: Flags [.], ack 31619712, win 513, length 0
17:03:52.117834 IP 50.101.85.188.58534 > lamponubuntu2004-s-1vcpu-1gb-tor1-01.ssh: Flags [.], ack 31621156, win 516, length 0
17:03:52.118018 IP lamponubuntu2004-s-1vcpu-1gb-tor1-01.ssh > 50.101.85.188.58534: Flags [P.], seq 31624676:31625120, ack 18721, win 501, length 444
17:03:52.118208 IP lamponubuntu2004-s-1vcpu-1gb-tor1-01.ssh > 50.101.85.188.58534: Flags [P.], seq 31625120:31625308, ack 18721, win 501, length 188
17:03:52.118358 IP lamponubuntu2004-s-1vcpu-1gb-tor1-01.ssh > 50.101.85.188.58534: Flags [P.], seq 31625308:31625496, ack 18721, win 501, length 188
17:03:52.118492 IP lamponubuntu2004-s-1vcpu-1gb-tor1-01.ssh > 50.101.85.188.58534: Flags [P.], seq 31625496:31625684, ack 18721, win 501, length 188
17:03:52.118629 IP lamponubuntu2004-s-1vcpu-1gb-tor1-01.ssh > 50.101.85.188.58534: Flags [P.], seq 31625684:31625872, ack 18721, win 501, length 188
17:03:52.118765 IP lamponubuntu2004-s-1vcpu-1gb-tor1-01.ssh > 50.101.85.188.58534: Flags [P.], seq 31625872:31626060, ack 18721, win 501, length 188
17:03:52.118811 IP 50.101.85.188.58534 > lamponubuntu2004-s-1vcpu-1gb-tor1-01.ssh: Flags [.], ack 31621532, win 514, length 0
17:03:52.118811 IP 50.101.85.188.58534 > lamponubuntu2004-s-1vcpu-1gb-tor1-01.ssh: Flags [.], ack 31622036, win 512, length 0
17:03:52.118987 IP lamponubuntu2004-s-1vcpu-1gb-tor1-01.ssh > 50.101.85.188.58534: Flags [P.], seq 31626060:31626504, ack 18721, win 501, length 444
17:03:52.119143 IP lamponubuntu2004-s-1vcpu-1gb-tor1-01.ssh > 50.101.85.188.58534: Flags [P.], seq 31626504:31626692, ack 18721, win 501, length 188
17:03:52.119280 IP lamponubuntu2004-s-1vcpu-1gb-tor1-01.ssh > 50.101.85.188.58534: Flags [P.], seq 31626692:31626880, ack 18721, win 501, length 188
17:03:52.119419 IP lamponubuntu2004-s-1vcpu-1gb-tor1-01.ssh > 50.101.85.188.58534: Flags [P.], seq 31626880:31627068, ack 18721, win 501, length 188
17:03:52.119563 IP lamponubuntu2004-s-1vcpu-1gb-tor1-01.ssh > 50.101.85.188.58534: Flags [P.], seq 31627068:31627256, ack 18721, win 501, length 188
17:03:52.119712 IP lamponubuntu2004-s-1vcpu-1gb-tor1-01.ssh > 50.101.85.188.58534: Flags [P.], seq 31627256:31627444, ack 18721, win 501, length 188
17:03:52.119823 IP 50.101.85.188.58534 > lamponubuntu2004-s-1vcpu-1gb-tor1-01.ssh: Flags [.], ack 31622788, win 516, length 0
17:03:52.119823 IP 50.101.85.188.58534 > lamponubuntu2004-s-1vcpu-1gb-tor1-01.ssh: Flags [.], ack 31623164, win 514, length 0
17:03:52.119901 IP lamponubuntu2004-s-1vcpu-1gb-tor1-01.ssh > 50.101.85.188.58534: Flags [P.], seq 31627444:31627632, ack 18721, win 501, length 188
17:03:52.120098 IP lamponubuntu2004-s-1vcpu-1gb-tor1-01.ssh > 50.101.85.188.58534: Flags [P.], seq 31627632:31628076, ack 18721, win 501, length 444
17:03:52.120237 IP lamponubuntu2004-s-1vcpu-1gb-tor1-01.ssh > 50.101.85.188.58534: Flags [P.], seq 31628076:31628264, ack 18721, win 501, length 188
17:03:52.120376 IP lamponubuntu2004-s-1vcpu-1gb-tor1-01.ssh > 50.101.85.188.58534: Flags [P.], seq 31628264:31628452, ack 18721, win 501, length 188
17:03:52.120512 IP lamponubuntu2004-s-1vcpu-1gb-tor1-01.ssh > 50.101.85.188.58534: Flags [P.], seq 31628452:31628640, ack 18721, win 501, length 188
17:03:52.120649 IP lamponubuntu2004-s-1vcpu-1gb-tor1-01.ssh > 50.101.85.188.58534: Flags [P.], seq 31628640:31628828, ack 18721, win 501, length 188
17:03:52.120788 IP lamponubuntu2004-s-1vcpu-1gb-tor1-01.ssh > 50.101.85.188.58534: Flags [P.], seq 31628828:31629016, ack 18721, win 501, length 188
17:03:52.120828 IP 50.101.85.188.58534 > lamponubuntu2004-s-1vcpu-1gb-tor1-01.ssh: Flags [.], ack 31623924, win 511, length 0
17:03:52.120989 IP lamponubuntu2004-s-1vcpu-1gb-tor1-01.ssh > 50.101.85.188.58534: Flags [P.], seq 31629016:31629332, ack 18721, win 501, length 316
17:03:52.121136 IP lamponubuntu2004-s-1vcpu-1gb-tor1-01.ssh > 50.101.85.188.58534: Flags [P.], seq 31629332:31629520, ack 18721, win 501, length 188
17:03:52.121287 IP lamponubuntu2004-s-1vcpu-1gb-tor1-01.ssh > 50.101.85.188.58534: Flags [P.], seq 31629520:31629708, ack 18721, win 501, length 188
17:03:52.121424 IP lamponubuntu2004-s-1vcpu-1gb-tor1-01.ssh > 50.101.85.188.58534: Flags [P.], seq 31629708:31629896, ack 18721, win 501, length 188
17:03:52.121580 IP lamponubuntu2004-s-1vcpu-1gb-tor1-01.ssh > 50.101.85.188.58534: Flags [P.], seq 31629896:31630084, ack 18721, win 501, length 188
17:03:52.121721 IP lamponubuntu2004-s-1vcpu-1gb-tor1-01.ssh > 50.101.85.188.58534: Flags [P.], seq 31630084:31630272, ack 18721, win 501, length 188
17:03:52.121837 IP 50.101.85.188.58534 > lamponubuntu2004-s-1vcpu-1gb-tor1-01.ssh: Flags [.], ack 31624676, win 516, length 0
17:03:52.121837 IP 50.101.85.188.58534 > lamponubuntu2004-s-1vcpu-1gb-tor1-01.ssh: Flags [.], ack 31625872, win 511, length 0
17:03:52.121837 IP 50.101.85.188.58534 > lamponubuntu2004-s-1vcpu-1gb-tor1-01.ssh: Flags [.], ack 31626060, win 510, length 0
17:03:52.121837 IP 50.101.85.188.58534 > lamponubuntu2004-s-1vcpu-1gb-tor1-01.ssh: Flags [.], ack 31626880, win 516, length 0
17:03:52.121923 IP lamponubuntu2004-s-1vcpu-1gb-tor1-01.ssh > 50.101.85.188.58534: Flags [P.], seq 31630272:31630460, ack 18721, win 501, length 188
17:03:52.122202 IP lamponubuntu2004-s-1vcpu-1gb-tor1-01.ssh > 50.101.85.188.58534: Flags [P.], seq 31630460:31631152, ack 18721, win 501, length 692
17:03:52.122346 IP lamponubuntu2004-s-1vcpu-1gb-tor1-01.ssh > 50.101.85.188.58534: Flags [P.], seq 31631152:31631340, ack 18721, win 501, length 188
17:03:52.122486 IP lamponubuntu2004-s-1vcpu-1gb-tor1-01.ssh > 50.101.85.188.58534: Flags [P.], seq 31631340:31631528, ack 18721, win 501, length 188
17:03:52.122633 IP lamponubuntu2004-s-1vcpu-1gb-tor1-01.ssh > 50.101.85.188.58534: Flags [P.], seq 31631528:31631716, ack 18721, win 501, length 188
17:03:52.122774 IP lamponubuntu2004-s-1vcpu-1gb-tor1-01.ssh > 50.101.85.188.58534: Flags [P.], seq 31631716:31631904, ack 18721, win 501, length 188
17:03:52.122817 IP 50.101.85.188.58534 > lamponubuntu2004-s-1vcpu-1gb-tor1-01.ssh: Flags [.], ack 31627256, win 514, length 0
17:03:52.122973 IP lamponubuntu2004-s-1vcpu-1gb-tor1-01.ssh > 50.101.85.188.58534: Flags [P.], seq 31631904:31632220, ack 18721, win 501, length 316
17:03:52.123126 IP lamponubuntu2004-s-1vcpu-1gb-tor1-01.ssh > 50.101.85.188.58534: Flags [P.], seq 31632220:31632408, ack 18721, win 501, length 188
17:03:52.123264 IP lamponubuntu2004-s-1vcpu-1gb-tor1-01.ssh > 50.101.85.188.58534: Flags [P.], seq 31632408:31632596, ack 18721, win 501, length 188
17:03:52.123402 IP lamponubuntu2004-s-1vcpu-1gb-tor1-01.ssh > 50.101.85.188.58534: Flags [P.], seq 31632596:31632784, ack 18721, win 501, length 188
17:03:52.123536 IP lamponubuntu2004-s-1vcpu-1gb-tor1-01.ssh > 50.101.85.188.58534: Flags [P.], seq 31632784:31632972, ack 18721, win 501, length 188
17:03:52.123674 IP lamponubuntu2004-s-1vcpu-1gb-tor1-01.ssh > 50.101.85.188.58534: Flags [P.], seq 31632972:31633160, ack 18721, win 501, length 188
17:03:52.123828 IP 50.101.85.188.58534 > lamponubuntu2004-s-1vcpu-1gb-tor1-01.ssh: Flags [.], ack 31628264, win 510, length 0
17:03:52.123828 IP 50.101.85.188.58534 > lamponubuntu2004-s-1vcpu-1gb-tor1-01.ssh: Flags [.], ack 31628828, win 516, length 0
17:03:52.123853 IP lamponubuntu2004-s-1vcpu-1gb-tor1-01.ssh > 50.101.85.188.58534: Flags [P.], seq 31633160:31633348, ack 18721, win 501, length 188
17:03:52.124042 IP lamponubuntu2004-s-1vcpu-1gb-tor1-01.ssh > 50.101.85.188.58534: Flags [P.], seq 31633348:31633792, ack 18721, win 501, length 444
17:03:52.124201 IP lamponubuntu2004-s-1vcpu-1gb-tor1-01.ssh > 50.101.85.188.58534: Flags [P.], seq 31633792:31633980, ack 18721, win 501, length 188
17:03:52.124442 IP lamponubuntu2004-s-1vcpu-1gb-tor1-01.ssh > 50.101.85.188.58534: Flags [P.], seq 31633980:31634168, ack 18721, win 501, length 188
17:03:52.124594 IP lamponubuntu2004-s-1vcpu-1gb-tor1-01.ssh > 50.101.85.188.58534: Flags [P.], seq 31634168:31634356, ack 18721, win 501, length 188
17:03:52.124735 IP lamponubuntu2004-s-1vcpu-1gb-tor1-01.ssh > 50.101.85.188.58534: Flags [P.], seq 31634356:31634544, ack 18721, win 501, length 188
17:03:52.124833 IP 50.101.85.188.58534 > lamponubuntu2004-s-1vcpu-1gb-tor1-01.ssh: Flags [.], ack 31629520, win 513, length 0
17:03:52.124948 IP lamponubuntu2004-s-1vcpu-1gb-tor1-01.ssh > 50.101.85.188.58534: Flags [P.], seq 31634544:31634860, ack 18721, win 501, length 316
17:03:52.125091 IP lamponubuntu2004-s-1vcpu-1gb-tor1-01.ssh > 50.101.85.188.58534: Flags [P.], seq 31634860:31635048, ack 18721, win 501, length 188
17:03:52.125232 IP lamponubuntu2004-s-1vcpu-1gb-tor1-01.ssh > 50.101.85.188.58534: Flags [P.], seq 31635048:31635236, ack 18721, win 501, length 188
17:03:52.125740 IP lamponubuntu2004-s-1vcpu-1gb-tor1-01.ssh > 50.101.85.188.58534: Flags [P.], seq 31635236:31635424, ack 18721, win 501, length 188
17:03:52.125926 IP 50.101.85.188.58534 > lamponubuntu2004-s-1vcpu-1gb-tor1-01.ssh: Flags [.], ack 31630460, win 516, length 0
17:03:52.125926 IP 50.101.85.188.58534 > lamponubuntu2004-s-1vcpu-1gb-tor1-01.ssh: Flags [.], ack 31631528, win 511, length 0
17:03:52.125956 IP lamponubuntu2004-s-1vcpu-1gb-tor1-01.ssh > 50.101.85.188.58534: Flags [P.], seq 31635424:31635612, ack 18721, win 501, length 188
17:03:52.126193 IP lamponubuntu2004-s-1vcpu-1gb-tor1-01.ssh > 50.101.85.188.58534: Flags [P.], seq 31635612:31636056, ack 18721, win 501, length 444
17:03:52.126332 IP lamponubuntu2004-s-1vcpu-1gb-tor1-01.ssh > 50.101.85.188.58534: Flags [P.], seq 31636056:31636244, ack 18721, win 501, length 188
17:03:52.126473 IP lamponubuntu2004-s-1vcpu-1gb-tor1-01.ssh > 50.101.85.188.58534: Flags [P.], seq 31636244:31636432, ack 18721, win 501, length 188
17:03:52.126660 IP lamponubuntu2004-s-1vcpu-1gb-tor1-01.ssh > 50.101.85.188.58534: Flags [P.], seq 31636432:31636620, ack 18721, win 501, length 188
17:03:52.126799 IP lamponubuntu2004-s-1vcpu-1gb-tor1-01.ssh > 50.101.85.188.58534: Flags [P.], seq 31636620:31636808, ack 18721, win 501, length 188
17:03:52.126838 IP 50.101.85.188.58534 > lamponubuntu2004-s-1vcpu-1gb-tor1-01.ssh: Flags [.], ack 31632220, win 516, length 0
17:03:52.126838 IP 50.101.85.188.58534 > lamponubuntu2004-s-1vcpu-1gb-tor1-01.ssh: Flags [.], ack 31633792, win 516, length 0
17:03:52.127027 IP lamponubuntu2004-s-1vcpu-1gb-tor1-01.ssh > 50.101.85.188.58534: Flags [P.], seq 31636808:31637252, ack 18721, win 501, length 444
17:03:52.127169 IP lamponubuntu2004-s-1vcpu-1gb-tor1-01.ssh > 50.101.85.188.58534: Flags [P.], seq 31637252:31637440, ack 18721, win 501, length 188
17:03:52.127308 IP lamponubuntu2004-s-1vcpu-1gb-tor1-01.ssh > 50.101.85.188.58534: Flags [P.], seq 31637440:31637628, ack 18721, win 501, length 188
17:03:52.127481 IP lamponubuntu2004-s-1vcpu-1gb-tor1-01.ssh > 50.101.85.188.58534: Flags [P.], seq 31637628:31637816, ack 18721, win 501, length 188
17:03:52.127632 IP lamponubuntu2004-s-1vcpu-1gb-tor1-01.ssh > 50.101.85.188.58534: Flags [P.], seq 31637816:31638004, ack 18721, win 501, length 188
17:03:52.127773 IP lamponubuntu2004-s-1vcpu-1gb-tor1-01.ssh > 50.101.85.188.58534: Flags [P.], seq 31638004:31638192, ack 18721, win 501, length 188
17:03:52.127817 IP 50.101.85.188.58534 > lamponubuntu2004-s-1vcpu-1gb-tor1-01.ssh: Flags [.], ack 31634168, win 514, length 0
17:03:52.127817 IP 50.101.85.188.58534 > lamponubuntu2004-s-1vcpu-1gb-tor1-01.ssh: Flags [.], ack 31634860, win 511, length 0
17:03:52.127998 IP lamponubuntu2004-s-1vcpu-1gb-tor1-01.ssh > 50.101.85.188.58534: Flags [P.], seq 31638192:31638636, ack 18721, win 501, length 444
17:03:52.128140 IP lamponubuntu2004-s-1vcpu-1gb-tor1-01.ssh > 50.101.85.188.58534: Flags [P.], seq 31638636:31638824, ack 18721, win 501, length 188
17:03:52.128360 IP lamponubuntu2004-s-1vcpu-1gb-tor1-01.ssh > 50.101.85.188.58534: Flags [P.], seq 31638824:31639012, ack 18721, win 501, length 188
17:03:52.128528 IP lamponubuntu2004-s-1vcpu-1gb-tor1-01.ssh > 50.101.85.188.58534: Flags [P.], seq 31639012:31639200, ack 18721, win 501, length 188
17:03:52.128673 IP lamponubuntu2004-s-1vcpu-1gb-tor1-01.ssh > 50.101.85.188.58534: Flags [P.], seq 31639200:31639388, ack 18721, win 501, length 188
17:03:52.128822 IP 50.101.85.188.58534 > lamponubuntu2004-s-1vcpu-1gb-tor1-01.ssh: Flags [.], ack 31635236, win 510, length 0
17:03:52.128843 IP lamponubuntu2004-s-1vcpu-1gb-tor1-01.ssh > 50.101.85.188.58534: Flags [P.], seq 31639388:31639576, ack 18721, win 501, length 188
17:03:52.129011 IP lamponubuntu2004-s-1vcpu-1gb-tor1-01.ssh > 50.101.85.188.58534: Flags [P.], seq 31639576:31639892, ack 18721, win 501, length 316
17:03:52.129149 IP lamponubuntu2004-s-1vcpu-1gb-tor1-01.ssh > 50.101.85.188.58534: Flags [P.], seq 31639892:31640080, ack 18721, win 501, length 188
17:03:52.129288 IP lamponubuntu2004-s-1vcpu-1gb-tor1-01.ssh > 50.101.85.188.58534: Flags [P.], seq 31640080:31640268, ack 18721, win 501, length 188
17:03:52.129428 IP lamponubuntu2004-s-1vcpu-1gb-tor1-01.ssh > 50.101.85.188.58534: Flags [P.], seq 31640268:31640456, ack 18721, win 501, length 188
17:03:52.129562 IP lamponubuntu2004-s-1vcpu-1gb-tor1-01.ssh > 50.101.85.188.58534: Flags [P.], seq 31640456:31640644, ack 18721, win 501, length 188
17:03:52.129698 IP lamponubuntu2004-s-1vcpu-1gb-tor1-01.ssh > 50.101.85.188.58534: Flags [P.], seq 31640644:31640832, ack 18721, win 501, length 188
17:03:52.129826 IP 50.101.85.188.58534 > lamponubuntu2004-s-1vcpu-1gb-tor1-01.ssh: Flags [.], ack 31636244, win 516, length 0
17:03:52.129826 IP 50.101.85.188.58534 > lamponubuntu2004-s-1vcpu-1gb-tor1-01.ssh: Flags [.], ack 31636808, win 513, length 0
17:03:52.129957 IP lamponubuntu2004-s-1vcpu-1gb-tor1-01.ssh > 50.101.85.188.58534: Flags [P.], seq 31640832:31641020, ack 18721, win 501, length 188
17:03:52.130114 IP lamponubuntu2004-s-1vcpu-1gb-tor1-01.ssh > 50.101.85.188.58534: Flags [P.], seq 31641020:31641312, ack 18721, win 501, length 292
17:03:52.130263 IP lamponubuntu2004-s-1vcpu-1gb-tor1-01.ssh > 50.101.85.188.58534: Flags [P.], seq 31641312:31641500, ack 18721, win 501, length 188
17:03:52.130393 IP lamponubuntu2004-s-1vcpu-1gb-tor1-01.ssh > 50.101.85.188.58534: Flags [P.], seq 31641500:31641688, ack 18721, win 501, length 188
17:03:52.130635 IP lamponubuntu2004-s-1vcpu-1gb-tor1-01.ssh > 50.101.85.188.58534: Flags [P.], seq 31641688:31641876, ack 18721, win 501, length 188
17:03:52.130764 IP lamponubuntu2004-s-1vcpu-1gb-tor1-01.ssh > 50.101.85.188.58534: Flags [P.], seq 31641876:31642064, ack 18721, win 501, length 188
17:03:52.130876 IP 50.101.85.188.58534 > lamponubuntu2004-s-1vcpu-1gb-tor1-01.ssh: Flags [.], ack 31638004, win 516, length 0
17:03:52.130995 IP lamponubuntu2004-s-1vcpu-1gb-tor1-01.ssh > 50.101.85.188.58534: Flags [P.], seq 31642064:31642252, ack 18721, win 501, length 188
17:03:52.131129 IP lamponubuntu2004-s-1vcpu-1gb-tor1-01.ssh > 50.101.85.188.58534: Flags [P.], seq 31642252:31642568, ack 18721, win 501, length 316
17:03:52.131258 IP lamponubuntu2004-s-1vcpu-1gb-tor1-01.ssh > 50.101.85.188.58534: Flags [P.], seq 31642568:31642756, ack 18721, win 501, length 188
17:03:52.131387 IP lamponubuntu2004-s-1vcpu-1gb-tor1-01.ssh > 50.101.85.188.58534: Flags [P.], seq 31642756:31642944, ack 18721, win 501, length 188
17:03:52.131516 IP lamponubuntu2004-s-1vcpu-1gb-tor1-01.ssh > 50.101.85.188.58534: Flags [P.], seq 31642944:31643132, ack 18721, win 501, length 188
17:03:52.131649 IP lamponubuntu2004-s-1vcpu-1gb-tor1-01.ssh > 50.101.85.188.58534: Flags [P.], seq 31643132:31643320, ack 18721, win 501, length 188
17:03:52.131777 IP lamponubuntu2004-s-1vcpu-1gb-tor1-01.ssh > 50.101.85.188.58534: Flags [P.], seq 31643320:31643508, ack 18721, win 501, length 188
17:03:52.131819 IP 50.101.85.188.58534 > lamponubuntu2004-s-1vcpu-1gb-tor1-01.ssh: Flags [.], ack 31639200, win 511, length 0
17:03:52.131966 IP lamponubuntu2004-s-1vcpu-1gb-tor1-01.ssh > 50.101.85.188.58534: Flags [P.], seq 31643508:31643696, ack 18721, win 501, length 188
17:03:52.132100 IP lamponubuntu2004-s-1vcpu-1gb-tor1-01.ssh > 50.101.85.188.58534: Flags [P.], seq 31643696:31644012, ack 18721, win 501, length 316
17:03:52.132230 IP lamponubuntu2004-s-1vcpu-1gb-tor1-01.ssh > 50.101.85.188.58534: Flags [P.], seq 31644012:31644200, ack 18721, win 501, length 188
17:03:52.132356 IP lamponubuntu2004-s-1vcpu-1gb-tor1-01.ssh > 50.101.85.188.58534: Flags [P.], seq 31644200:31644388, ack 18721, win 501, length 188
17:03:52.132485 IP lamponubuntu2004-s-1vcpu-1gb-tor1-01.ssh > 50.101.85.188.58534: Flags [P.], seq 31644388:31644576, ack 18721, win 501, length 188
17:03:52.132611 IP lamponubuntu2004-s-1vcpu-1gb-tor1-01.ssh > 50.101.85.188.58534: Flags [P.], seq 31644576:31644764, ack 18721, win 501, length 188
17:03:52.132833 IP 50.101.85.188.58534 > lamponubuntu2004-s-1vcpu-1gb-tor1-01.ssh: Flags [.], ack 31639892, win 516, length 0
17:03:52.132833 IP 50.101.85.188.58534 > lamponubuntu2004-s-1vcpu-1gb-tor1-01.ssh: Flags [.], ack 31640832, win 512, length 0
17:03:52.132958 IP lamponubuntu2004-s-1vcpu-1gb-tor1-01.ssh > 50.101.85.188.58534: Flags [P.], seq 31644764:31644952, ack 18721, win 501, length 188
17:03:52.133093 IP lamponubuntu2004-s-1vcpu-1gb-tor1-01.ssh > 50.101.85.188.58534: Flags [P.], seq 31644952:31645396, ack 18721, win 501, length 444
17:03:52.133222 IP lamponubuntu2004-s-1vcpu-1gb-tor1-01.ssh > 50.101.85.188.58534: Flags [P.], seq 31645396:31645584, ack 18721, win 501, length 188
17:03:52.133349 IP lamponubuntu2004-s-1vcpu-1gb-tor1-01.ssh > 50.101.85.188.58534: Flags [P.], seq 31645584:31645772, ack 18721, win 501, length 188
17:03:52.133477 IP lamponubuntu2004-s-1vcpu-1gb-tor1-01.ssh > 50.101.85.188.58534: Flags [P.], seq 31645772:31645960, ack 18721, win 501, length 188
17:03:52.133605 IP lamponubuntu2004-s-1vcpu-1gb-tor1-01.ssh > 50.101.85.188.58534: Flags [P.], seq 31645960:31646148, ack 18721, win 501, length 188
17:03:52.133732 IP lamponubuntu2004-s-1vcpu-1gb-tor1-01.ssh > 50.101.85.188.58534: Flags [P.], seq 31646148:31646336, ack 18721, win 501, length 188
17:03:52.133861 IP lamponubuntu2004-s-1vcpu-1gb-tor1-01.ssh > 50.101.85.188.58534: Flags [P.], seq 31646336:31646524, ack 18721, win 501, length 188
17:03:52.133990 IP lamponubuntu2004-s-1vcpu-1gb-tor1-01.ssh > 50.101.85.188.58534: Flags [P.], seq 31646524:31646712, ack 18721, win 501, length 188
17:03:52.134140 IP lamponubuntu2004-s-1vcpu-1gb-tor1-01.ssh > 50.101.85.188.58534: Flags [P.], seq 31646712:31646900, ack 18721, win 501, length 188
17:03:52.134293 IP lamponubuntu2004-s-1vcpu-1gb-tor1-01.ssh > 50.101.85.188.58534: Flags [P.], seq 31646900:31647088, ack 18721, win 501, length 188
17:03:52.134419 IP lamponubuntu2004-s-1vcpu-1gb-tor1-01.ssh > 50.101.85.188.58534: Flags [P.], seq 31647088:31647276, ack 18721, win 501, length 188
17:03:52.134547 IP lamponubuntu2004-s-1vcpu-1gb-tor1-01.ssh > 50.101.85.188.58534: Flags [P.], seq 31647276:31647464, ack 18721, win 501, length 188
17:03:52.134675 IP lamponubuntu2004-s-1vcpu-1gb-tor1-01.ssh > 50.101.85.188.58534: Flags [P.], seq 31647464:31647652, ack 18721, win 501, length 188
17:03:52.134805 IP lamponubuntu2004-s-1vcpu-1gb-tor1-01.ssh > 50.101.85.188.58534: Flags [P.], seq 31647652:31647840, ack 18721, win 501, length 188
17:03:52.134856 IP 50.101.85.188.58534 > lamponubuntu2004-s-1vcpu-1gb-tor1-01.ssh: Flags [.], ack 31641876, win 516, length 0
17:03:52.134856 IP 50.101.85.188.58534 > lamponubuntu2004-s-1vcpu-1gb-tor1-01.ssh: Flags [.], ack 31642252, win 514, length 0
17:03:52.134856 IP 50.101.85.188.58534 > lamponubuntu2004-s-1vcpu-1gb-tor1-01.ssh: Flags [.], ack 31642944, win 511, length 0
17:03:52.134856 IP 50.101.85.188.58534 > lamponubuntu2004-s-1vcpu-1gb-tor1-01.ssh: Flags [P.], seq 18721:18757, ack 31642944, win 511, length 36
17:03:52.135177 IP lamponubuntu2004-s-1vcpu-1gb-tor1-01.ssh > 50.101.85.188.58534: Flags [P.], seq 31647840:31648028, ack 18757, win 501, length 188
17:03:52.135326 IP lamponubuntu2004-s-1vcpu-1gb-tor1-01.ssh > 50.101.85.188.58534: Flags [P.], seq 31648028:31648744, ack 18757, win 501, length 716
17:03:52.135459 IP lamponubuntu2004-s-1vcpu-1gb-tor1-01.ssh > 50.101.85.188.58534: Flags [P.], seq 31648744:31648932, ack 18757, win 501, length 188
17:03:52.135591 IP lamponubuntu2004-s-1vcpu-1gb-tor1-01.ssh > 50.101.85.188.58534: Flags [P.], seq 31648932:31649120, ack 18757, win 501, length 188
17:03:52.135723 IP lamponubuntu2004-s-1vcpu-1gb-tor1-01.ssh > 50.101.85.188.58534: Flags [P.], seq 31649120:31649308, ack 18757, win 501, length 188
17:03:52.135827 IP 50.101.85.188.58534 > lamponubuntu2004-s-1vcpu-1gb-tor1-01.ssh: Flags [.], ack 31644012, win 516, length 0
17:03:52.135827 IP 50.101.85.188.58534 > lamponubuntu2004-s-1vcpu-1gb-tor1-01.ssh: Flags [.], ack 31644388, win 514, length 0
17:03:52.135966 IP lamponubuntu2004-s-1vcpu-1gb-tor1-01.ssh > 50.101.85.188.58534: Flags [P.], seq 31649308:31649496, ack 18757, win 501, length 188
17:03:52.136102 IP lamponubuntu2004-s-1vcpu-1gb-tor1-01.ssh > 50.101.85.188.58534: Flags [P.], seq 31649496:31649940, ack 18757, win 501, length 444
17:03:52.136232 IP lamponubuntu2004-s-1vcpu-1gb-tor1-01.ssh > 50.101.85.188.58534: Flags [P.], seq 31649940:31650128, ack 18757, win 501, length 188
17:03:52.136360 IP lamponubuntu2004-s-1vcpu-1gb-tor1-01.ssh > 50.101.85.188.58534: Flags [P.], seq 31650128:31650316, ack 18757, win 501, length 188
17:03:52.136493 IP lamponubuntu2004-s-1vcpu-1gb-tor1-01.ssh > 50.101.85.188.58534: Flags [P.], seq 31650316:31650504, ack 18757, win 501, length 188
17:03:52.136618 IP lamponubuntu2004-s-1vcpu-1gb-tor1-01.ssh > 50.101.85.188.58534: Flags [P.], seq 31650504:31650692, ack 18757, win 501, length 188
17:03:52.136754 IP lamponubuntu2004-s-1vcpu-1gb-tor1-01.ssh > 50.101.85.188.58534: Flags [P.], seq 31650692:31650880, ack 18757, win 501, length 188
17:03:52.136869 IP 50.101.85.188.58534 > lamponubuntu2004-s-1vcpu-1gb-tor1-01.ssh: Flags [.], ack 31644764, win 513, length 0
17:03:52.136869 IP 50.101.85.188.58534 > lamponubuntu2004-s-1vcpu-1gb-tor1-01.ssh: Flags [.], ack 31645960, win 516, length 0
17:03:52.136995 IP lamponubuntu2004-s-1vcpu-1gb-tor1-01.ssh > 50.101.85.188.58534: Flags [P.], seq 31650880:31651068, ack 18757, win 501, length 188
17:03:52.137228 IP lamponubuntu2004-s-1vcpu-1gb-tor1-01.ssh > 50.101.85.188.58534: Flags [P.], seq 31651068:31651512, ack 18757, win 501, length 444
17:03:52.137370 IP lamponubuntu2004-s-1vcpu-1gb-tor1-01.ssh > 50.101.85.188.58534: Flags [P.], seq 31651512:31651700, ack 18757, win 501, length 188
17:03:52.137501 IP lamponubuntu2004-s-1vcpu-1gb-tor1-01.ssh > 50.101.85.188.58534: Flags [P.], seq 31651700:31652040, ack 18757, win 501, length 340
17:03:52.137636 IP lamponubuntu2004-s-1vcpu-1gb-tor1-01.ssh > 50.101.85.188.58534: Flags [P.], seq 31652040:31652228, ack 18757, win 501, length 188
17:03:52.137771 IP lamponubuntu2004-s-1vcpu-1gb-tor1-01.ssh > 50.101.85.188.58534: Flags [P.], seq 31652228:31652416, ack 18757, win 501, length 188
17:03:52.137908 IP lamponubuntu2004-s-1vcpu-1gb-tor1-01.ssh > 50.101.85.188.58534: Flags [P.], seq 31652416:31652604, ack 18757, win 501, length 188
17:03:52.138042 IP lamponubuntu2004-s-1vcpu-1gb-tor1-01.ssh > 50.101.85.188.58534: Flags [P.], seq 31652604:31652792, ack 18757, win 501, length 188
17:03:52.138221 IP lamponubuntu2004-s-1vcpu-1gb-tor1-01.ssh > 50.101.85.188.58534: Flags [P.], seq 31652792:31652980, ack 18757, win 501, length 188
17:03:52.138363 IP lamponubuntu2004-s-1vcpu-1gb-tor1-01.ssh > 50.101.85.188.58534: Flags [P.], seq 31652980:31653168, ack 18757, win 501, length 188
17:03:52.138501 IP lamponubuntu2004-s-1vcpu-1gb-tor1-01.ssh > 50.101.85.188.58534: Flags [P.], seq 31653168:31653356, ack 18757, win 501, length 188
17:03:52.138638 IP lamponubuntu2004-s-1vcpu-1gb-tor1-01.ssh > 50.101.85.188.58534: Flags [P.], seq 31653356:31653544, ack 18757, win 501, length 188
17:03:52.138773 IP lamponubuntu2004-s-1vcpu-1gb-tor1-01.ssh > 50.101.85.188.58534: Flags [P.], seq 31653544:31653732, ack 18757, win 501, length 188
17:03:52.138891 IP 50.101.85.188.58534 > lamponubuntu2004-s-1vcpu-1gb-tor1-01.ssh: Flags [.], ack 31646524, win 513, length 0
17:03:52.138891 IP 50.101.85.188.58534 > lamponubuntu2004-s-1vcpu-1gb-tor1-01.ssh: Flags [.], ack 31647276, win 511, length 0
17:03:52.138891 IP 50.101.85.188.58534 > lamponubuntu2004-s-1vcpu-1gb-tor1-01.ssh: Flags [.], ack 31647652, win 516, length 0
17:03:52.138892 IP 50.101.85.188.58534 > lamponubuntu2004-s-1vcpu-1gb-tor1-01.ssh: Flags [.], ack 31647840, win 515, length 0
17:03:52.138892 IP 50.101.85.188.58534 > lamponubuntu2004-s-1vcpu-1gb-tor1-01.ssh: Flags [.], ack 31648744, win 511, length 0
17:03:52.139112 IP lamponubuntu2004-s-1vcpu-1gb-tor1-01.ssh > 50.101.85.188.58534: Flags [P.], seq 31653732:31654552, ack 18757, win 501, length 820
17:03:52.139332 IP lamponubuntu2004-s-1vcpu-1gb-tor1-01.ssh > 50.101.85.188.58534: Flags [P.], seq 31654552:31654740, ack 18757, win 501, length 188
17:03:52.139474 IP lamponubuntu2004-s-1vcpu-1gb-tor1-01.ssh > 50.101.85.188.58534: Flags [P.], seq 31654740:31654928, ack 18757, win 501, length 188
17:03:52.139610 IP lamponubuntu2004-s-1vcpu-1gb-tor1-01.ssh > 50.101.85.188.58534: Flags [P.], seq 31654928:31655116, ack 18757, win 501, length 188
17:03:52.139745 IP lamponubuntu2004-s-1vcpu-1gb-tor1-01.ssh > 50.101.85.188.58534: Flags [P.], seq 31655116:31655304, ack 18757, win 501, length 188
17:03:52.139855 IP 50.101.85.188.58534 > lamponubuntu2004-s-1vcpu-1gb-tor1-01.ssh: Flags [.], ack 31649120, win 516, length 0
17:03:52.139855 IP 50.101.85.188.58534 > lamponubuntu2004-s-1vcpu-1gb-tor1-01.ssh: Flags [.], ack 31649496, win 514, length 0
17:03:52.139855 IP 50.101.85.188.58534 > lamponubuntu2004-s-1vcpu-1gb-tor1-01.ssh: Flags [.], ack 31650128, win 512, length 0
17:03:52.139855 IP 50.101.85.188.58534 > lamponubuntu2004-s-1vcpu-1gb-tor1-01.ssh: Flags [.], ack 31651068, win 516, length 0
17:03:52.140048 IP lamponubuntu2004-s-1vcpu-1gb-tor1-01.ssh > 50.101.85.188.58534: Flags [P.], seq 31655304:31655996, ack 18757, win 501, length 692
17:03:52.140189 IP lamponubuntu2004-s-1vcpu-1gb-tor1-01.ssh > 50.101.85.188.58534: Flags [P.], seq 31655996:31656184, ack 18757, win 501, length 188
17:03:52.140326 IP lamponubuntu2004-s-1vcpu-1gb-tor1-01.ssh > 50.101.85.188.58534: Flags [P.], seq 31656184:31656372, ack 18757, win 501, length 188
17:03:52.140460 IP lamponubuntu2004-s-1vcpu-1gb-tor1-01.ssh > 50.101.85.188.58534: Flags [P.], seq 31656372:31656560, ack 18757, win 501, length 188
17:03:52.140611 IP lamponubuntu2004-s-1vcpu-1gb-tor1-01.ssh > 50.101.85.188.58534: Flags [P.], seq 31656560:31656748, ack 18757, win 501, length 188
17:03:52.140748 IP lamponubuntu2004-s-1vcpu-1gb-tor1-01.ssh > 50.101.85.188.58534: Flags [P.], seq 31656748:31656936, ack 18757, win 501, length 188
17:03:52.140867 IP 50.101.85.188.58534 > lamponubuntu2004-s-1vcpu-1gb-tor1-01.ssh: Flags [.], ack 31651700, win 513, length 0
17:03:52.140979 IP lamponubuntu2004-s-1vcpu-1gb-tor1-01.ssh > 50.101.85.188.58534: Flags [P.], seq 31656936:31657252, ack 18757, win 501, length 316
17:03:52.141118 IP lamponubuntu2004-s-1vcpu-1gb-tor1-01.ssh > 50.101.85.188.58534: Flags [P.], seq 31657252:31657440, ack 18757, win 501, length 188
17:03:52.141252 IP lamponubuntu2004-s-1vcpu-1gb-tor1-01.ssh > 50.101.85.188.58534: Flags [P.], seq 31657440:31657628, ack 18757, win 501, length 188
17:03:52.141391 IP lamponubuntu2004-s-1vcpu-1gb-tor1-01.ssh > 50.101.85.188.58534: Flags [P.], seq 31657628:31657816, ack 18757, win 501, length 188
17:03:52.141526 IP lamponubuntu2004-s-1vcpu-1gb-tor1-01.ssh > 50.101.85.188.58534: Flags [P.], seq 31657816:31658004, ack 18757, win 501, length 188
17:03:52.141662 IP lamponubuntu2004-s-1vcpu-1gb-tor1-01.ssh > 50.101.85.188.58534: Flags [P.], seq 31658004:31658192, ack 18757, win 501, length 188
17:03:52.141797 IP lamponubuntu2004-s-1vcpu-1gb-tor1-01.ssh > 50.101.85.188.58534: Flags [P.], seq 31658192:31658380, ack 18757, win 501, length 188
17:03:52.141934 IP lamponubuntu2004-s-1vcpu-1gb-tor1-01.ssh > 50.101.85.188.58534: Flags [P.], seq 31658380:31658568, ack 18757, win 501, length 188
17:03:52.142093 IP lamponubuntu2004-s-1vcpu-1gb-tor1-01.ssh > 50.101.85.188.58534: Flags [P.], seq 31658568:31658756, ack 18757, win 501, length 188
17:03:52.142248 IP lamponubuntu2004-s-1vcpu-1gb-tor1-01.ssh > 50.101.85.188.58534: Flags [P.], seq 31658756:31658944, ack 18757, win 501, length 188
17:03:52.142391 IP lamponubuntu2004-s-1vcpu-1gb-tor1-01.ssh > 50.101.85.188.58534: Flags [P.], seq 31658944:31659132, ack 18757, win 501, length 188
17:03:52.142532 IP lamponubuntu2004-s-1vcpu-1gb-tor1-01.ssh > 50.101.85.188.58534: Flags [P.], seq 31659132:31659320, ack 18757, win 501, length 188
17:03:52.142668 IP lamponubuntu2004-s-1vcpu-1gb-tor1-01.ssh > 50.101.85.188.58534: Flags [P.], seq 31659320:31659508, ack 18757, win 501, length 188
17:03:52.142809 IP lamponubuntu2004-s-1vcpu-1gb-tor1-01.ssh > 50.101.85.188.58534: Flags [P.], seq 31659508:31659696, ack 18757, win 501, length 188
17:03:52.142883 IP 50.101.85.188.58534 > lamponubuntu2004-s-1vcpu-1gb-tor1-01.ssh: Flags [.], ack 31652792, win 516, length 0
17:03:52.142883 IP 50.101.85.188.58534 > lamponubuntu2004-s-1vcpu-1gb-tor1-01.ssh: Flags [.], ack 31653544, win 513, length 0
17:03:52.142883 IP 50.101.85.188.58534 > lamponubuntu2004-s-1vcpu-1gb-tor1-01.ssh: Flags [.], ack 31654552, win 516, length 0
17:03:52.142883 IP 50.101.85.188.58534 > lamponubuntu2004-s-1vcpu-1gb-tor1-01.ssh: Flags [.], ack 31654928, win 514, length 0
17:03:52.143110 IP lamponubuntu2004-s-1vcpu-1gb-tor1-01.ssh > 50.101.85.188.58534: Flags [P.], seq 31659696:31660388, ack 18757, win 501, length 692
17:03:52.143251 IP lamponubuntu2004-s-1vcpu-1gb-tor1-01.ssh > 50.101.85.188.58534: Flags [P.], seq 31660388:31660576, ack 18757, win 501, length 188
17:03:52.143388 IP lamponubuntu2004-s-1vcpu-1gb-tor1-01.ssh > 50.101.85.188.58534: Flags [P.], seq 31660576:31660764, ack 18757, win 501, length 188
17:03:52.143542 IP lamponubuntu2004-s-1vcpu-1gb-tor1-01.ssh > 50.101.85.188.58534: Flags [P.], seq 31660764:31660952, ack 18757, win 501, length 188
17:03:52.143683 IP lamponubuntu2004-s-1vcpu-1gb-tor1-01.ssh > 50.101.85.188.58534: Flags [P.], seq 31660952:31661140, ack 18757, win 501, length 188
17:03:52.143839 IP 50.101.85.188.58534 > lamponubuntu2004-s-1vcpu-1gb-tor1-01.ssh: Flags [.], ack 31656184, win 516, length 0
17:03:52.143839 IP 50.101.85.188.58534 > lamponubuntu2004-s-1vcpu-1gb-tor1-01.ssh: Flags [.], ack 31656748, win 513, length 0
17:03:52.143863 IP lamponubuntu2004-s-1vcpu-1gb-tor1-01.ssh > 50.101.85.188.58534: Flags [P.], seq 31661140:31661328, ack 18757, win 501, length 188
17:03:52.144056 IP lamponubuntu2004-s-1vcpu-1gb-tor1-01.ssh > 50.101.85.188.58534: Flags [P.], seq 31661328:31661772, ack 18757, win 501, length 444
17:03:52.144192 IP lamponubuntu2004-s-1vcpu-1gb-tor1-01.ssh > 50.101.85.188.58534: Flags [P.], seq 31661772:31661960, ack 18757, win 501, length 188
